Title,Company,Posted on,Location,Experience,Skills
"UX Design Manager, AI Mode",Google India Pvt Ltd,2025-08-29,San,8-11 Years,"visual design expertise, design system development, stakeholder influence, job posting, recruitment, workforce, decision making, compensation"
"Staff Software Engineer, Secure AI",Google India Pvt Ltd,2025-08-29,Pune,8-11 Years,"software design, machine learning, network security, programming languages, project leadership, c, artificial intelligence, java, data structures, python, cryptography, unix/linux, algorithms, storage, software engineer, rest, natural language processing, information retrieval, mobile, windows"
Lead Data/AI Engineering,AT&T,2025-08-29,Bengaluru,9-12 Years,"telecom domain expertise, application architecture design, security architecture practices, mentor, technical leadership, storage, microservices, design patterns, software development, cism, technical design"
"Software Engineer, AI Foundations",Google India Pvt Ltd,2025-08-29,Taiwan,2-3 Years,"software development expertise, machine learning applications, data management techniques, cross functional collaboration, storage, artificial intelligence, security, software engineer, natural language processing, information retrieval, android development"
"Software Engineer, Vertex AI",Google India Pvt Ltd,2025-08-29,Poland,2-3 Years,"software development, machine learning, data structures, distributed systems, model optimization, algorithms, storage, artificial intelligence, security, system development, debugging, software engineer, cloud services, natural language processing, information retrieval, mobile, infrastructure"
AI-Enabled Visual Designer,Xoxoday,2025-08-29,Bengaluru,3-5 Years,"visual storytelling, brand identity development, digital content creation, conceptual thinking, ideas, cutting, blending"
"Technology Practice Lead, AI",Google India Pvt Ltd,2025-08-29,Singapore,1-4 Years,"ai solutions adoption, cloud architecture expertise, stakeholder engagement, data analytics techniques, technical engagement leadership, job posting, recruitment, workforce, decision making"
AI/ML Engineering Manager,TaskUs,2025-08-29,Chennai,3-5 Years,"ai & ml engineering, project management, data modeling techniques, c, java, apache, big data, lex, nosql, algorithms, hadoop, microsoft azure, machine learning, infrastructure, opencv"
Senior Solutions Architect - Generative AI,Nvidia Graphics Pvt Ltd,2025-08-29,Bengaluru,7-11 Years,"generative ai, large language models, gpu cluster architecture, rag workflows, model deployment, orchestration, artificial intelligence, docker, solution architect, information retrieval, infrastructure"
AI Protection Analyst,Google India Pvt Ltd,2025-08-29,Bengaluru,2-4 Years,"data analysis techniques, programming proficiency, threat detection expertise, job posting, recruitment, workforce"
Artificial Intelligence (AI) AI  Empowered Productivity Specialist,every media technologies pvt. ltd.,2025-08-28,Mumbai,1-4 Years,"ai tool proficiency, time management, content enhancement, task automation, appointments, internet"
"Technology Practice Lead, AI",Google India Pvt Ltd,2025-08-28,Singapore,1-4 Years,"ai solutions development, cloud native architecture, data analytics expertise, stakeholder engagement, cross functional collaboration, job posting, recruitment, workforce, decision making"
"Senior Software Engineer, AI/ML",valgenesis india p ltd,2025-08-28,Hyderabad,4-8 Years,"machine learning solutions, python programming, data enhancement, mlops platforms, ai/ml domain expertise, senior software engineer, artificial intelligence, devops, image processing, neo4j, opencv"
Senior Engineer Consultant-AI Science,Verizon Data Services India Pvt Ltd,2025-08-28,Chennai,4-6 Years,"machine learning development, ai model deployment, statistical modeling techniques, data analysis tools, cloud computing proficiency, fundamentals, algorithms, c, orchestration, data mining, data warehousing, docker, java, rest, python, consultant"
"Technology Practice Lead, AI",Google India Pvt Ltd,2025-08-28,Singapore,1-4 Years,"cloud native architecture, ai solutions adoption, data analytics techniques, stakeholder engagement, technical problem solving, job posting, recruitment, workforce, decision making"
"Software Engineer III, Generative AI",Google India Pvt Ltd,2025-08-28,Poland,2-4 Years,"software development, generative ai, machine learning, model deployment, collaborative design, artificial intelligence, system development, data structures, algorithms, storage, security, debugging, software engineer, natural language processing, information retrieval, mobile, infrastructure"
"Junior Software Engineer, AI/ML",valgenesis india p ltd,2025-08-28,Hyderabad,1-3 Years,"ai driven solutions, api integration, python programming, database interactions, ml model optimization, junior software engineer, artificial intelligence, postgresql, mysql, machine learning, node.js, neo4j, entry level"
SENIOR AI ENGINEER,Caterpillar Inc.,2025-08-28,Chennai,3-5 Years,"machine learning techniques, generative ai applications, deep learning models, data engineering pipelines, algorithms, data mining, bi, sql, apache, git, github"
"UX Design Manager, AI Mode",Google India Pvt Ltd,2025-08-28,San,8-11 Years,"visual design systems, ux prototyping, team leadership, stakeholder influence, design process improvement, job posting, recruitment, workforce, decision making, compensation"
AI Data Analyst,arrk group,2025-08-28,Navi,4-7 Years,"data analysis techniques machine learning models ai model implementation python programming proficiency data visualization tools, algorithms, sql, git, postgresql, linux, data structures, rest, opencv"
Artificial Intelligence (AI),EVERYMEDIA ENTERTAINMENT MARKETING PRIVATE LIMITED,2025-08-28,Mumbai,1-4 Years,"ai tool proficiency, digital literacy, time management, appointments, internet"
"Staff Software Engineer, AI/ML",Google India Pvt Ltd,2025-08-27,Hyderabad,8-11 Years,"software development, ai/ml expertise, architecture design, team leadership, algorithms, software design, storage, artificial intelligence, security, software engineer, data structures, natural language processing, information retrieval, mobile, machine learning"
"Data Science Research, AI Benchmark",Google India Pvt Ltd,2025-08-27,Mexico,3-5 Years,"statistical analysis, machine learning techniques, data modeling, sql proficiency, python programming, job posting, recruitment, workforce"
"Staff Software Engineer, Secure AI",Google India Pvt Ltd,2025-08-27,Pune,8-11 Years,"software development, machine learning, software security, project management, technical leadership, c, artificial intelligence, java, data structures, python, cryptography, unix/linux, algorithms, software design, storage, software engineer, rest, natural language processing"
"Software Engineer, Vertex AI",Google India Pvt Ltd,2025-08-27,Poland,2-5 Years,"software development, machine learning, data structures, distributed systems, debugging techniques, algorithms, storage, artificial intelligence, security, system development, software engineer, cloud services, natural language processing, information retrieval, mobile, infrastructure"
"Software Engineer III, Generative AI",Google India Pvt Ltd,2025-08-27,Poland,2-5 Years,"software development, generative ai, machine learning, code evaluation, debugging techniques, artificial intelligence, system development, data structures, algorithms, storage, security, software engineer, natural language processing, information retrieval, mobile, infrastructure"
"Product Policy Specialist, Generative AI",Google India Pvt Ltd,2025-08-27,Seattle,5-7 Years,"ai policy development, content moderation, research and analysis, problem solving, job posting, recruitment, compensation, workforce"
AI Protection Analyst,Google India Pvt Ltd,2025-08-27,Bengaluru,2-4 Years,"data analysis techniques, programming languages proficiency, job posting, recruitment, workforce"
Research Engineer  Generative AI  AI Frontiers,Microsoft India Pvt Ltd,2025-08-27,Redmond,1-2 Years,"reinforcement learning, python programming, pytorch/jax framework, large language models, debugging distributed code, algorithms, cuda, orchestration, artificial intelligence, san"
Principal Research Engineer  Generative AI  AI Frontiers,Microsoft India Pvt Ltd,2025-08-27,Redmond,4-6 Years,"reinforcement learning, large language models, python development, pytorch/jax framework, multi agent systems, algorithms, cuda, orchestration, artificial intelligence, debugging, san"
"Sr. Product Manager, Databricks AI",Databricks,2025-08-27,San,2-5 Years,"html/css manipulation, javascript programming, image handling techniques, dom manipulation, data attribute usage, san, loading"
"Principal, Generative AI Safety Strategy",Google India Pvt Ltd,2025-08-27,San,10-13 Years,"trust and safety, stakeholder management, problem solving, data analytics, risk management, job posting, recruitment, workforce, decision making, compensation"
"Technical Solutions Engineer, AI/ML",Google India Pvt Ltd,2025-08-27,Poland,4-7 Years,"code debugging, cloud infrastructure, systems administration, machine learning, networking protocols, java, html, big data, c#, python, oracle, javascript, web technologies, system administration, cloud services, kernel, ruby, consultant, php"
Senior AI Consultant,CGI Information Systems and Management Consultants Pvt Ltd,2025-08-27,Netherlands,5-10 Years,"ai and data science, machine learning expertise, python/r programming, data engineering solutions, cgi, director, consultant, devops, big data"
"Conversational AI Manager, Google Cloud",Google India Pvt Ltd,2025-08-27,Bengaluru,8-11 Years,"conversational ai solutions, bot design expertise, natural language processing, cloud computing management, technical team leadership, artificial intelligence, security, java, python, solution delivery, infrastructure"
"Staff Software Engineer, Secure AI",Google India Pvt Ltd,2025-08-27,Pune,8-11 Years,"software development, machine learning, security architecture, technical leadership, stakeholder management, c, artificial intelligence, java, data structures, python, cryptography, unix/linux, algorithms, software design, storage, software engineer, rest, natural language processing"
"Software Engineer, Vertex AI",Google India Pvt Ltd,2025-08-27,Poland,2-5 Years,"software development, data structures, machine learning, distributed systems, problem solving, algorithms, storage, artificial intelligence, security, system development, debugging, software engineer, cloud services, natural language processing, information retrieval, mobile, infrastructure"
Conversational AI Strategic Cloud Engineer,Google India Pvt Ltd,2025-08-27,Bengaluru,5-8 Years,"conversational ai development, cloud solution architecture, natural language processing, customer engagement management, job posting, recruitment, workforce"
"Security Engineer, AI Protection",Google India Pvt Ltd,2025-08-27,Seattle,2-5 Years,"security engineering, threat modeling, incident response, python programming, security assessments, learning, job posting, recruitment, workforce, compensation"
AI/ML Engineer - OptimumBrew Technology,optimumbrew technology,2025-08-26,Surat,1-5 Years,"ai/ml, python programming, machine learning frameworks, data manipulation, software development, algorithms, sql, debugging, api, cloud computing"
Senior AI Engineer - Embedded LLM,cerence,2025-08-26,Pune,3-5 Years,"embedded programming, machine learning, llm optimization, software development, algorithm testing, algorithms, c, artificial intelligence, security"
"Analyst- Artificial Intelligence (AI), BGM",BLACKROCK,2025-08-26,Gurgaon,1-3 Years,"natural language processing, machine learning models, data engineering tools, quantitative analysis techniques, ai strategy development, python"
Presales - Conversational AI,Quantiphi,2025-08-26,Mumbai,5-8 Years,"contact center technology, solution architecture, analytical problem solving, genesys, ivr, messaging, infrastructure"
Associate - Artificial Intelligence (AI)- BGM,BLACKROCK,2025-08-26,Gurgaon,3-5 Years,"natural language processing, machine learning models, data engineering, python programming, statistical analysis"
Generative AI Internship,granicus,2025-08-26,Bengaluru,0-3 Years,"generative ai development, python programming, ui/ux design, machine learning techniques, algorithms, artificial intelligence, git, data structures, cloud services"
AI Backend Developer,Zeta Global,2025-08-26,Bengaluru,5-8 Years,"data analysis, gen ai expertise, api development, python programming, artificial intelligence, apache, devops, html, sql, git, san, mobile"
AI Lead,ETHOS,2025-08-26,Bengaluru,5-9 Years,"artificial intelligence, san, python"
AI Engineer II,Monotype,2025-08-26,Noida,3-6 Years,"ai/ml solutions, data preparation, model optimization, programming proficiency, cloud platforms, algorithms, artificial intelligence, python, natural language processing, machine learning"
Director- AI,Wadhwani Foundation,2025-08-26,Delhi,5-8 Years,"generative ai development, predictive ai modeling, advanced prompt engineering, data science leadership, placement"
Sr Specialist Data/AI Engineering,AT&T,2025-08-26,Bengaluru,5-8 Years,"python development, data engineering, ai model integration, azure integration, api development, data warehousing, storage, security, data services, data quality, data integration"
Gen AI Architect,HARMAN INTERNATIONAL,2025-08-26,Bengaluru,5-10 Years,"genai solutions, microservices architecture, graphql proficiency, full stack development, production ready systems, innovation, ideas, cutting, action"
Sr Specialist Data/AI Engineering,AT&T,2025-08-26,Bengaluru,8-10 Years,"advanced javascript, ui/ux design, graph visualization, responsive design, team collaboration, prototyping, wireframing, user research, designing, css3"
Senior Researcher  Generative AI - Microsoft Research AI Frontiers,Microsoft India Pvt Ltd,2025-08-26,Redmond,5-10 Years,"generative ai expertise, large language models, model evaluation techniques, multidisciplinary collaboration, ideas, safety, cutting, action"
"Senior, AI Solutions Engineer  RPA",Schneider Electric Pvt Ltd,2025-08-26,Bengaluru,2-4 Years,"blue prism expertise, ui path proficiency, ci/cd and devops, analytical problem solving, information technology, .net technologies, exception handling, ado.net, asp.net, json, software engineering, api, business applications, rest, project delivery, software support"
Conversational AI Solution Engineer,ALLIANZ,2025-08-26,Delhi,3-5 Years,"conversational ai design, javascript programming, api integration, natural language processing, agile methodology, gcc, artificial intelligence, crm, rest, python, infrastructure"
"Senior Architect, AI Solutions Engineering",Nvidia Graphics Pvt Ltd,2025-08-26,Canada,10-13 Years,"ai solutions architect, distributed systems, performance optimization, cloud technologies, algorithms, graphics, storage, artificial intelligence, sql, docker, database, java, git, linux, mysql, hadoop, mongodb, perforce, rest, cloud services, python, mobile, windows, machine learning, nosql"
Gen AI Engineer,virtusa consulting services pvt. ltd.,2025-08-26,Chennai,5-8 Years,"generative ai development, aws cloud expertise, full stack development, frontend frameworks proficiency, rest, python, api, javascript, gateway"
Senior AI and Data Expert,CGI Information Systems and Management Consultants Pvt Ltd,2025-08-26,Canada,5-10 Years,"ai expertise, data analysis, project management, business strategy, information technology"
AI Skilling Data Analyst,Microsoft India Pvt Ltd,2025-08-26,Redmond,2-8 Years,"data analysis, ai/ml technology, sql proficiency, data storytelling, stakeholder management, bi, dashboards, data science, san, data analytics, predictive analytics, data analyst, tableau, data governance"
Senior Engineer - AI/ML,ARROW ELECTRONICS,2025-08-26,Hyderabad,5-8 Years,"real time software development, software testing methodologies, problem solving approaches, programming languages proficiency, mobile, test cases, embedded software, project life cycle"
Engineering Manager- Gen AI,Exotel,2025-08-26,Bengaluru,8-10 Years,"team leadership, stakeholder management, software development, code quality assurance, cloud deployment, rest api, java, devops, voip, telecom, mysql, ruby, node.js, infrastructure, php"
Staff Gen AI Engineer,blue yonder,2025-08-26,Dallas,8-10 Years,"full stack development, ai solutions architecture, backend python expertise, restful api design, cloud technologies familiarity, css, orchestration, java, software engineering, html, javascript, docker, database, security, machine learning, infrastructure"
Senior AI/ML Engineer,BENCHMARK IT SOLUTIONS,2025-08-25,Pune,5-10 Years,"generative ai expertise, large language models, transformer models understanding, coding and problem solving, team leadership abilities, machine learning"
"Group Product Manager, AI Accelerator",Google India Pvt Ltd,2025-08-25,Hyderabad,10-13 Years,"product management, stakeholder engagement, cross functional collaboration, ai application, technical presentation, hr, job posting, recruitment, workforce, decision making"
Principal AI/ML Engineer,GSK,2025-08-25,Bengaluru,10-13 Years,"ai/ml project leadership, cloud ai platforms, generative ai techniques, large language models, ai/ml frameworks proficiency, recruitment, recruitment process, interview"
Responsible AI Solution Architect,Microsoft India Pvt Ltd,2025-08-25,Redmond,6-10 Years,"ai ethics expertise, project leadership, cross functional collaboration, solution architecture, program management, security, san, mitigation, nist"
AI Tools & Excel Specialist,sharda consultancy,2025-08-25,Delhi,0-2 Years,"microsoft office excel, ai"
"Senior Solutions Architect, Generative AI",Nvidia Graphics Pvt Ltd,2025-08-25,Mumbai,5-8 Years,"generative ai solutions, large language models, retrieval augmented generation, model optimization techniques, gpu cluster architecture, orchestration, artificial intelligence, docker, solution architect, information retrieval, infrastructure"
Senior AI Applied Scientist,Microsoft India Pvt Ltd,2025-08-25,Redmond,4-7 Years,"machine learning expertise, data science proficiency, research and development, production, model development, innovation, documentation, data collection, cutting"
Senior AI Analyst (AI Trust and Integrity),Onit,2025-08-25,Pune,5-7 Years,"ai risk assessment, ethical compliance, python proficiency, vulnerability identification, data analysis tools, hr"
Cloud & AI Specialist,Microsoft India Pvt Ltd,2025-08-25,Brazil,6-8 Years,"cloud solutions sales, customer relationship management, digital transformation strategy, technical sales expertise, partner collaboration, revenue growth, sales process, cxo, plan execution, account management, strategic direction, marketing, build, selling"
Senior AI Engineer,TARGET,2025-08-25,Bengaluru,6-9 Years,"generative ai solutions, performance tuning, machine learning optimization, cross functional collaboration, mentoring engineers, artificial intelligence, python, cloud services, system architecture"
Software Engineer- II ( Gen AI),blue yonder,2025-08-25,Dallas,2-3 Years,"generative ai techniques, ai model development, python programming, machine learning frameworks, cloud platform familiarity, software engineering, github, nosql, node.js, algorithms, docker, react.js, security, hadoop, rdbms, infrastructure"
"Applied Scientist II, Alexa AI",AMAZON INDIA PVT LTD,2025-08-25,Bengaluru,2-7 Years,"deep learning expertise, machine learning frameworks, data analysis proficiency, algorithms, linux"
Senior AI Engineer,INDEGENE,2025-08-25,Bengaluru,4-7 Years,"data engineering solutions, advanced analytics techniques, data quality assurance, data visualization tools, machine learning models, business requirements, bi, dashboards, sql, statistical modeling, data analysis, tableau, data governance"
"AI Software Solutions Engineer (AI Frameworks, Workloads)",Intel,2025-08-25,Bengaluru,10-15 Years,"ai frameworks development, deep learning inference, optimization techniques, algorithms, gcc, advanced c, storage, machine learning, artificial intelligence, infrastructure"
AI Solution Engineer,AUTOMATION ANYWHERE,2025-08-25,Bengaluru,3-5 Years,"ai solution delivery, deploy ai solutions, data privacy management, cross functional collaboration, prompt engineering & rag, orchestration, sql, security, natural language processing, access management, cloud storage"
"Technology Practice Lead, AI",Google India Pvt Ltd,2025-08-25,Singapore,1-4 Years,"ai solutions adoption, cloud native architecture, stakeholder engagement, data analytics insights, cross functional collaboration, job posting, recruitment, workforce, decision making"
Digital AI Workforce Specialist,Microsoft India Pvt Ltd,2025-08-25,Japan,5-7 Years,"ai workforce solutions, consultative selling, stakeholder engagement, technology sales, business strategy development, orchestration, information technology"
Digital AI Workforce Specialist,Microsoft India Pvt Ltd,2025-08-25,Japan,5-7 Years,"ai workforce solutions, consultative selling, stakeholder engagement, technology sales, business strategy development, orchestration, information technology"
Generative AI Architect,Orion Innovation,2025-08-25,Chennai,5-9 Years,"generative ai development, multimodal ai integration, python programming expertise, azure cloud services, foundation model fine tuning, algorithms, user interaction, memory management, data structures, machine learning"
AI Engineer,Onit,2025-08-25,Pune,6-9 Years,"ai development, machine learning, natural language processing, python programming, bi, javascript, security, node.js"
"Principal, Generative AI Safety Strategy",Google India Pvt Ltd,2025-08-25,San,10-13 Years,"trust and safety expertise, data analytics proficiency, stakeholder management, influencing cross functionally, job posting, recruitment, workforce, decision making, compensation"
Cloud & AI Specialist,Microsoft India Pvt Ltd,2025-08-25,Brazil,6-8 Years,"cloud solutions sales, customer relationship management, digital transformation strategy, technical sales expertise, partner collaboration, revenue growth, sales process, cxo, plan execution, account management, strategic direction, marketing, build, selling"
Responsible AI Solution Risk Assessor,Microsoft India Pvt Ltd,2025-08-25,Redmond,6-8 Years,"risk management expertise, responsible ai frameworks, compliance documentation, information technology, business analyst, system security, use cases, san, consulting, nist"
Senior Software Engineer - AI,Harness,2025-08-25,Bengaluru,3-6 Years,"backend development, python programming, rest apis, nosql databases, generative ai architecture, orchestration, software engineering, mysql, javascript, servicenow, mongodb, software delivery, machine learning, splunk"
"Data Engineer-AI,ML",Orion Innovation,2025-08-25,Chennai,5-8 Years,"generative ai development, python programming, azure cloud services, machine learning pipelines, data analysis, artificial intelligence, big data, natural language processing, .net"
"AI Software Solutions Engineer (AI Frameworks, Workloads)",Intel,2025-08-25,Bengaluru,5-6 Years,"ai frameworks design deep learning optimization pytorch framework expertise advanced c programming inference workloads profiling, algorithms, python, gcc, storage, machine learning, artificial intelligence, infrastructure"
Senior Software Engineer - AI,Harness,2025-08-25,Bengaluru,3-6 Years,"backend development, python programming, rest apis, nosql databases, generative ai architecture, orchestration, software engineering, mysql, javascript, servicenow, mongodb, software delivery, machine learning, splunk"
Senior AI Data Scientist,Pall India Pvt Ltd,2025-08-25,Bengaluru,3-5 Years,"artificial intelligence development, machine learning models, data analytics techniques, devops principles, microsoft power platform, hosting, bi, python, natural language processing"
Software Test  AI Development Tools,MICROCHIP TECHNOLOGY PRIVATE LIMITED,2025-08-25,Chennai,3-5 Years,"software testing, ai methodologies, full stack testing, python programming, embedded systems, information retrieval, artificial intelligence"
AI Software engineer,GSK,2025-08-25,Bengaluru,5-8 Years,"ai digital twin, agile methodologies, python development, time series modeling, software design, artificial intelligence, software engineer"
AI Engineer (Prompt Engineer),Onit,2025-08-25,Pune,4-7 Years,"natural language processing, ai solutions development, business requirement translation, bi, machine learning, javascript, security, node.js"
Senior AI Applied Scientist,Microsoft India Pvt Ltd,2025-08-25,Redmond,4-7 Years,"machine learning expertise, data science proficiency, research and development, production, model development, innovation, documentation, data collection, cutting"
Solution Engineering- AI Business Processes,Microsoft India Pvt Ltd,2025-08-25,Mexico,6-8 Years,"technical pre sales, customer engagement, solution design, cloud architecture, competitive strategy, information technology, bi, technology management, messaging"
Solution Engineering- AI Business Processes,Microsoft India Pvt Ltd,2025-08-25,Chile,5-6 Years,"technical pre sales, cloud computing, strategy development, competitive analysis, customer engagement, information technology, microsoft technologies, bi, technology management"
AI-Business Solution Engineer- CoPilot,Microsoft India Pvt Ltd,2025-08-25,San,2-6 Years,"technical pre sales, solution architecture, customer demonstrations, ai productivity solutions, microsoft technologies, information technology, bi, artificial intelligence, security, technology management, business applications, san, windows"
"Applied Scientist II, Alexa AI",AMAZON INDIA PVT LTD,2025-08-25,Bengaluru,2-7 Years,"deep learning expertise, machine learning frameworks, data analysis proficiency, algorithms, linux"
