Title,Company,Posted on,Location,Experience,Skills
Python Automation Testing Job Details | Gainwell Technologies LLC,Gainwell Technologies,2025-09-10,Bengaluru,7-10 Years,"python selenium automation, test framework design, api testing tools, ci/cd integration, sql script writing, tfs, continuous integration, test automation, test management, regression testing, automation tester, healthcare, test data, automation tools, jira, automation testing, software delivery, sdet"
Python Developer-5 Yrs-Gurgaon job in Gurgaon,crescendo global,2025-09-09,Gurgaon,5-8 Years,"python development, data analysis, performance optimization, code review, object oriented programming, algorithms, sql, postgresql, data structures, mongodb"
Lead Data Engineer - Python - 7  Years - Bengaluru job in Bengaluru,crescendo global,2025-09-09,Bengaluru,7-10 Years,"data engineering expertise, python programming, etl process design, cloud platforms familiarity, agile methodologies, leadership hiring, recruitment, compensation"
Full Stack Developer-Python-4  Years-Gurugram(Hybrid) job in,crescendo global,2025-09-09,Gurgaon,4-7 Years,"vb, net development, react, js framework, cloud services expertise, sql database management, css, vb.net, docker, react.js, security, git, web application developer, oops, python, web technologies"
Senior Manager - Finance Automation (Python Developer) - HO,"kotak mahindra bank,",2025-09-09,Mumbai,3-5 Years,"python programming, process automation, data analysis, stakeholder collaboration, application development, css, html"
Senior Manager - Finance Automation (Python Developer) - HO,"kotak mahindra bank,",2025-09-09,Mumbai,3-5 Years,"python programming, process automation, data analysis, stakeholder collaboration, application development, css, html"
Senior Data Engineer - Python - 5  Years - Bengaluru job in Bengaluru,crescendo global,2025-09-09,Bengaluru,5-9 Years,"data engineering expertise, etl process development, leadership hiring, recruitment, compensation"
"Data Engineer - Python,SQL,AWS - 6  Years - Gurugram job in Gurugram",crescendo global,2025-09-09,Gurgaon,6-9 Years,"data engineering expertise, sql proficiency, information technology, hadoop, big data"
Hiring For Python Architect,krazy mantra hr solutions,2025-09-09,Chennai,5-8 Years,"python programming, oop concepts, mysql expertise, api development, testing frameworks, curl, django, oops, data structures"
Member Of Technical Staff II (Python Automation Testing ),Nutanix,2025-09-09,Bengaluru,2-4 Years,"python programming, automation testing, selenium expertise, system performance, problem solving, test automation, test cases, jmeter, qa, java, linux, test planning, jenkins, data structures, test case development, infrastructure, metrics, test tools"
Full Stack Developer-Python-4  Years-Gurugram(Hybrid) job in,crescendo global,2025-09-09,Gurgaon,4-7 Years,"vb, net development, react, js framework, cloud services expertise, sql database management, css, vb.net, docker, react.js, security, git, web application developer, oops, python, web technologies"
Data Scientist,Think Future Technologies Pvt Ltd,2025-09-09,Gurgaon,2-5 Years,"python, postgresql, sql, docker"
"Binance Accelerator Program - Backend Engineer (Python, Java)",Binance,2025-09-09,Taiwan,1-3 Years,"web data extraction, python programming, java spring boot, sql proficiency, fundamentals, docker, security, git, postgresql, devops, json, software engineering, mysql, big data, rest, github, infrastructure, web crawling"
"Assisstant Manger-IT(VBA,.NET,PYTHON)-3-5Yrs-Mumbai job in Mumbai",crescendo global,2025-09-09,Mumbai,3-5 Years,"net development, vba programming, python scripting, sql server management, application troubleshooting, leadership hiring, recruitment"
"Binance Accelerator Program - Backend Engineer (Python, Java)",Binance,2025-09-09,Taiwan,1-3 Years,"web data extraction, python programming, java spring boot, sql proficiency, fundamentals, docker, security, git, postgresql, devops, json, software engineering, mysql, big data, rest, github, infrastructure, web crawling"
Full Stack Developer-Python-4  Years-Gurugram(Hybrid) job in,crescendo global,2025-09-09,Gurgaon,4-7 Years,"vb, net development, react, js framework, cloud services expertise, sql database management, css, vb.net, docker, react.js, security, git, web application developer, oops, python, web technologies"
Senior Software Engineer - Python,nec software solutions (india) pvt ltd,2025-09-09,Mumbai,4-6 Years,"python development, javascript (typescript), frontend development, backend programming, senior software engineer, problem solving"
Python API with DevOps Developer - (Exp : 4-6 Years),CIGNEX Datamatics Technologies Pvt Ltd,2025-09-09,Bengaluru,4-6 Years,"api development, ci/cd management, docker deployment, kubernetes orchestration, devops automation, python, security"
Hiring For Python Architect,krazy mantra hr solutions,2025-09-09,Chennai,5-8 Years,"python programming, oop concepts, mysql expertise, api development, testing frameworks, curl, django, oops, data structures"
Python Developer,Trigyn Technologies Ltd,2025-09-08,Delhi,3-6 Years,"python proficiency, web frameworks, api development, front end integration, css, html5, rest api, bootstrap, ajax, javascript, docker, security, git, oops, mongodb, dhtml"
Looking for a Python API developer,e-stone information technology,2025-09-08,Mumbai,3-5 Years,"python functions, async rest api, mysql integration, custom authentication, nginx deployment, oracle, react.js, database, node.js, linux, project delivery"
"Deep Learning, Machine LearningTechnical Architect",NLP People,2025-09-08,Delhi,10-13 Years,"algorithms, python, api, machine learning"
Computer Scientist (Python),Adobe Systems Ltd,2025-09-08,Noida,4-9 Years,"machine learning services, distributed systems, python development, restful services, ci/cd operations, cloud services, docker, java"
Hiring For Observability Engineer,krazy mantra hr solutions,2025-09-08,Chennai,2-8 Years,"data integration, otel, java, python, grafana, data aggregation"
VP Risk Analytics,Analytics Vidhya,2025-09-07,Gurgaon,7-10 Years,"python, machine learning, triggers"
Data Scientist (Python Expert ),Analytics Vidhya,2025-09-07,Hyderabad,2-5 Years,"git, mysql, big data, image processing, python, mobile, problem solving, team player, django, opencv"
Member Of Technical Staff 3 (Python/Go Backend  Linux)4-6yrs,Nutanix,2025-09-07,Bengaluru,4-6 Years,"python/go development, distributed systems design, problem solving expertise, api design principles, linux environment proficiency, os, director, system software, application management, infrastructure"
"Director - Data Engineering (15  years' experience, Skills: - Python, Hadoop, Spark, Kafka, GenAI)",Visa Inc.,2025-09-07,Bengaluru,8-10 Years,"software engineering leadership, technical architecture design, product lifecycle management, ai/ml integration, project management expertise, mentor, procedures, software development, director, technical design"
Analytics Manager - R/python,Analytics Vidhya,2025-09-07,Noida,5-8 Years,"algorithms, signal processing, python, sas, machine learning, unix"
Machine Learning Lead,Analytics Vidhya,2025-09-07,Bengaluru,7-10 Years,"algorithms, python, machine learning"
Sr. Manager Machine Learning (Analytics Team),Analytics Vidhya,2025-09-07,Gurgaon,2-5 Years,"python, machine learning, triggers"
Member Of Technical Staff 3 (Python/Go Backend  Linux)4-6yrs,Nutanix,2025-09-07,Bengaluru,4-6 Years,"python/go development, distributed systems design, problem solving expertise, api design principles, linux environment proficiency, os, director, system software, application management, infrastructure"
Sr. Data Engineer - AWS Python Pyspark Job Job Details | Yash Technologies,Yash Technologies Pvt Ltd,2025-09-07,Bengaluru,3-4 Years,"aws services, data pipelines, python development, sql proficiency, etl tools, apache, devops, mysql, mongodb, github, cloud services, oracle, nosql"
Job Title : Python Developer,W3Softech India Private Limited,2025-09-07,Hyderabad,0-1 Years,"python programming, front end technologies, containerization (docker), software development lifecycle, css, mobile, javascript, html"
Python Testing Engineer,e-con systems india pvt.ltd.,2025-09-07,Chennai,3-5 Years,"os, testing, test cases, qa, testing engineer, writing, logging, unix/linux, black box testing, product testing, writing test cases"
Sr. Associate - Data Scientist,Analytics Vidhya,2025-09-07,Bengaluru,0-2 Years,"algorithms, crm, python, problem solving, machine learning, messaging"
Image Processing / Software Developer (GIS),advanced risk analytics private limited,2025-09-07,Pune,0-3 Years,"c, python, c, algorithm development, machine learning, opencv"
Senior Analytics,Analytics Vidhya,2025-09-07,Delhi,5-10 Years,"python, sas, sql"
B.Tech. Computer Science and MCA Interns,right infotech solutions pvt. ltd,2025-09-07,Delhi,0-3 Years,"python, mobile, sql, java, apache, unix shell programming"
Data Scientist (Machine Learning),Analytics Vidhya,2025-09-07,Gurgaon,5-8 Years,"algorithms, python, data mining, machine learning, mysql"
Data Scientist,Analytics Vidhya,2025-09-07,Chennai,3-8 Years,"algorithms, python, data mining, sql, sql scripting"
Sr. Data Scientist (NLP),Analytics Vidhya,2025-09-07,Gurgaon,2-5 Years,"sql, mysql, python, information retrieval, machine learning"
Python Engineer,Analytics Vidhya,2025-09-07,Gurgaon,3-6 Years,"python, machine learning, java, apache, git, digitization"
Python Developer,Analytics Vidhya,2025-09-07,Hyderabad,2-4 Years,"python, css, html5, javascript, sql, django, linux, mysql, html, unix"
Python Developer,magnarus technologies private limited,2025-09-07,Hyderabad,1-3 Years,"image processing, python, c, c programming, operating system, team player, database, mysql, unix"
Data Engineer,Analytics Vidhya,2025-09-07,Gurgaon,2-8 Years,"python, sql, market dynamics"
Data Analyst,Analytics Vidhya,2025-09-07,Noida,2-5 Years,"python, sql, messaging, infrastructure"
Job Title : Python Developer,W3Softech India Private Limited,2025-09-07,Hyderabad,0-1 Years,"python programming, front end technologies, containerization (docker), software development lifecycle, css, mobile, javascript, html"
"Software Development Engineer 3 - Python, AWS/Azure",Adobe Systems Ltd,2025-09-07,Noida,5-8 Years,"cloud solutions development, python automation expertise, aws/azure optimization, software design engineering, data analytics systems, docker, git, devops, linux, cloud services, machine learning, splunk"
Python Developer,Analytics Vidhya,2025-09-07,Gurgaon,5-8 Years,"python, css, html5, html, ajax, javascript"
Sr Software/lead Engineers  Python/SDN Development,Analytics Vidhya,2025-09-07,Bengaluru,3-6 Years,"python, adapters, rest api, snmp, docker, messaging, ems/nms, json, sdn"
L2 Mid Technical Support  Java/Python,Movate technologies limited,2025-09-06,Hyderabad,4-6 Years,"sdlc understanding, problem solving, agile methodologies, client coordination, technical support, python, logical thinking, java"
L2 Sr. Technical Support  Java/Python,Movate technologies limited,2025-09-06,Hyderabad,6-9 Years,"project planning, client coordination, agile methodologies, problem solving, team management, python, logical thinking, java"
Hiring For Technical Lead - Python API,krazy mantra hr solutions,2025-09-06,Pune,5-8 Years,"python development, flask framework, sql databases, api design, gcp certification, git"
L2 Sr. Technical Support  Java/Python,Movate technologies limited,2025-09-06,Hyderabad,6-9 Years,"project planning, client coordination, agile methodologies, problem solving, team management, python, logical thinking, java"
Senior Software Engineer (Java/Python and Database),MASTERCARD,2025-09-06,Pune,6-9 Years,"full stack engineer, restful api development, java and python, database management, agile methodologies, senior software engineer, big data, c#, maven, spring security, .net, soap, algorithms, hibernate, sql, git, json, jpa, junit, problem solving, jdk, spring boot, production environment, splunk"
"Lead Software Engineer - Apache Nifi, Python, PySpark, Hadoop, Cloudera platforms, and Airflow",MASTERCARD,2025-09-06,Pune,10-13 Years,"data engineering expertise, python and pyspark, hadoop ecosystem proficiency, information technology, apache, java, big data, pl/sql, oracle, oracle sql, hive, scala, storage, security, git, debugging, software engineer, unix shell"
Python Developer,Movate technologies limited,2025-09-06,Chennai,5-8 Years,"data conversion, nosql databases, data lake construction, cost optimization, python programming, delta"
Aera Technology - Senior Software Engineer I (Python),Aera Technology,2025-09-05,San,5-7 Years,"backend development, python frameworks, api development, ci/cd pipeline, test automation, algorithms, rest api, senior software engineer, docker, sql, oop, git, data structures, san, django"
"Senior Manager (Technical Engineering Manager, Python, Angular, Microservices, Gen AI)",Visa Inc.,2025-09-05,Bengaluru,7-10 Years,"software architecture, agile methodologies, devops practices, cross functional collaboration, team leadership, production, innovation, implementation, process improvement, planning, process automation"
Seagate - Python Gen AI Developer Job Job Details | Yash Technologies,Yash Technologies Pvt Ltd,2025-09-05,Pune,3-7 Years,"python development, ai project delivery, azure openai, scikit learn expertise, fastapi exposure"
Hiring For Python   Azure   Databricks   Hadoop   Snowflake   SQL,krazy mantra hr solutions,2025-09-05,Chennai,2-7 Years,"python, azure, databricks, hadoop, snowflake, sql"
Data Engineer - Python Full Stack - 5  Years - Gurugram (Hybrid) job,crescendo global,2025-09-05,Gurgaon,5-8 Years,"python expertise, etl processes, data modeling, full stack development, data analytics, sql"
Embedded Service Engineer (Python Developer),autodesk india pvt ltd,2025-09-05,Pune,6-9 Years,"software troubleshooting, cloud automation, windows networking, scripting languages, customer liaison, contractor, cad, civil 3d, autocad, mitigation, engineering, revit"
Data Engineer - Python Full Stack - 5  Years - Gurugram (Hybrid) job,crescendo global,2025-09-05,Gurgaon,5-8 Years,"python expertise, etl processes, data modeling, full stack development, data analytics, sql"
Embedded Service Engineer (Python Developer),autodesk india pvt ltd,2025-09-05,Pune,6-9 Years,"software troubleshooting, cloud automation, windows networking, scripting languages, customer liaison, contractor, cad, civil 3d, autocad, mitigation, engineering, revit"
Python Automation Testing Specialist,AT&T,2025-09-04,Bengaluru,4-7 Years,"automation testing, python programming, api testing, data management, test framework development, rest api, sql, java, git, devops, linux, debugging, telecom, maven, eclipse, unix"
"Sr. BOT Developer (Chatbot, AIML, Python) Job Details | Gainwell Technologies LLC",Gainwell Technologies,2025-09-04,Chennai,7-14 Years,"bot development, classic aiml, natural language processing, rest api integration, cloud technologies, python, css, xml, json, html"
Hiring For C   or Python or Java on Linux environment,krazy mantra hr solutions,2025-09-04,Bengaluru,0-9 Years,"c, python, java, shell scripting, storage virtualization, linux operating system, perl"
Hiring For C   or Python or Java on Linux environment,krazy mantra hr solutions,2025-09-04,Bengaluru,2-5 Years,"c programming, python programming, java programming, linux environment, networking, git, perl"
"Sr. BOT Developer (Chatbot, AIML, Python) Job Details | Gainwell Technologies LLC",Gainwell Technologies,2025-09-04,Chennai,7-14 Years,"bot development, classic aiml, natural language processing, rest api integration, cloud technologies, python, css, xml, json, html"
Hiring For Python   Spark/Scala,krazy mantra hr solutions,2025-09-04,Mumbai,1-5 Years,python programming spark/scala development kafka integration azure cloud storage data processing
Hiring For Python Lead Developer,krazy mantra hr solutions,2025-09-04,Chennai,7-9 Years,"python, django/flask, oracle pl/sql, unix, ui programming"
Hiring For Data Bricks with Python/Pyspark,krazy mantra hr solutions,2025-09-04,Bengaluru,8-11 Years,"azure data factory, databricks, sql, nosql, hadoop, python, storage, big data"
"Hiring For Python developer with Jango flask, SQL Strong and API Development",krazy mantra hr solutions,2025-09-04,Gurgaon,1-9 Years,"python development, django flask, api development, immediate hiring"
Hiring For Sr Python Automation Engineer,krazy mantra hr solutions,2025-09-04,Bengaluru,2-5 Years,"python, automation, programming, web application automation, testing methodologies, appium, test management, qa, selenium, bug tracking, jenkins"
Hiring For Data Engineer- Databricks   Azure Data Factory   Python,krazy mantra hr solutions,2025-09-04,Kolkata,2-5 Years,"azure databricks, azure data factory, python, data migration solutions, data warehousing, hive, scala, nosql, java, hadoop, big data"
Hiring For Python/Back End Developer,krazy mantra hr solutions,2025-09-04,Chennai,2-6 Years,"python, fast api, docker, kubernetes, sql database, postgresql"
Hiring For Python   Spark/Scala,krazy mantra hr solutions,2025-09-04,Mumbai,1-5 Years,python programming spark/scala development kafka integration azure cloud storage data processing
Hiring For Python LLM - GPT engineer,krazy mantra hr solutions,2025-09-04,Pune,7-9 Years,"python programming, git, machine learning, llm libraries, conversational ai, nlp, software engineering"
Python Architect,Headhuntersinc consultancy Private Limited,2025-09-04,Chennai,10-13 Years,"hive, c, sql, java, linux, hadoop, big data, c#, global delivery, python, edi, hl7, .net, unix"
Python (AI / ML) Developer - TechValens,Techvalens Software Pvt Ltd,2025-09-04,Indore,3-6 Years,"python development, flask framework, restful apis, machine learning, openai integration, algorithms, github, sql, nosql, security"
Hiring For Sr. Python & Groovy Framework Developer,krazy mantra hr solutions,2025-09-04,Bengaluru,4-6 Years,"python, groovy, ci/cd, docker/kubernetes, node.js package/module creation., svn, javascript, git, linux"
Hiring For Lead Python & Groovy Framework Developer,krazy mantra hr solutions,2025-09-04,Bengaluru,6-9 Years,"python scripting, groovy scripting, ci/cd, docker/kubernetes, node.js package/module creation, orchestration, javascript"
Python (AI / ML) Developer - TechValens,Techvalens Software Pvt Ltd,2025-09-04,Indore,3-6 Years,"python development, flask framework, restful apis, machine learning, openai integration, algorithms, github, sql, nosql, security"
Hiring For NLP Engineer,krazy mantra hr solutions,2025-09-04,Pune,3-5 Years,"nlp, python programming, tensorflow, pytorch, machine learning"
Senior Data Engineer with Python & PySpark,CGI Information Systems and Management Consultants Pvt Ltd,2025-09-04,Hyderabad,6-8 Years,"data engineering, python programming, kafka streaming, apache spark, software development, cgi, senior software engineer"
Hiring For Python/Back End Developer,krazy mantra hr solutions,2025-09-04,Chennai,2-6 Years,"python, fast api, docker, kubernetes, sql database, postgresql"
Hiring For Python Test,krazy mantra hr solutions,2025-09-04,Pune,2-5 Years,"embedded testing, python, pytest framework, firmware testing, rtos, linux, agile, jira"
Hiring For Python LLM - GPT engineer,krazy mantra hr solutions,2025-09-04,Pune,7-9 Years,"python programming, git, machine learning, llm libraries, conversational ai, nlp, software engineering"
Hiring For Snowflake  Python,krazy mantra hr solutions,2025-09-04,Chennai,3-5 Years,"snowflake db, snowflake, teradata / oracle / sql, scripts unix, python, cloud computing architecture, etl tools, git, snowflake architecture and warehouse implementation and management"
Senior Python Developer,CGI Information Systems and Management Consultants Pvt Ltd,2025-09-04,Pittsburgh,5-10 Years,"python development, software architecture, agile methodology, team collaboration, workflow automation, cgi"
Hiring For Python developer,krazy mantra hr solutions,2025-09-04,Chennai,1-9 Years,"python, django, oops, pl/sql, rest api, html5, shell scripting, unix, docker"
Hiring For Azure data factory with Python and Pyspark,krazy mantra hr solutions,2025-09-04,Coimbatore,3-8 Years,"azure data factory, python, pyspark, azure databricks, azure sql db, oracle, postgresql, mysql"
Hiring For Python Lead,krazy mantra hr solutions,2025-09-04,Gurgaon,3-8 Years,"python, python web framework, orm, javascript, html5, css3, sql"
Hiring For New Relic/Python Scripting/other APM tools,krazy mantra hr solutions,2025-09-04,Chennai,4-10 Years,"new relic, apm tools, apm architect, microservices architectures, cloud technologies"
Data Engineer - (Hadoop/Hive/python/Spark/Scala),CAPCO,2025-09-03,Bengaluru,5-8 Years,"data pipeline management, sql proficiency, big data tools, software development, problem solving, algorithms, dml, java, software engineering, api, hadoop, python, mining"
ETL Python Developer,virtusa consulting services pvt. ltd.,2025-09-02,Chennai,6-9 Years,"etl development, python programming, data analysis, agile methodologies, technical documentation, java, data transformation"
ETL Python Developer,virtusa consulting services pvt. ltd.,2025-09-02,Chennai,6-9 Years,"python programming, etl development, data transport, agile methodologies, data analysis, java, data transformation"
Senior Software Engineer  Dev Python Odoo  REQ/0760 | Sysvine Technologies,Sysvine Technologies,2025-09-02,Chennai,5-9 Years,"odoo development, python programming, data structures, tdd practices, senior software engineer, postgresql, oops, games, mysql, oracle, mobile"
Product Growth Manager,LAKSH HUMAN RESOURCE,2025-09-02,Mumbai,2-5 Years,"rest, python, sql"
Lead Engineer -DevOps,PerfectVIPs,2025-09-02,Bengaluru,4-6 Years,"python, system administration, git, python scripting, linux administration, devops, linux, shell scripting"
"Sr Automation Engineer-Python, SDET",blue yonder,2025-09-02,Bengaluru,4-7 Years,"quality assurance, test automation, python programming, api testing, ci/cd familiarity, performance testing, regression testing, test cases, test scripts, test data, selenium, jenkins, software quality assurance, robot framework, software testing, sdlc, test tools"
Python Developer,zenga tv,2025-09-02,Gurgaon,2-5 Years,"python, django, html5, javascript"
Sr. Software Engineer - Python Job Job Details | Yash Technologies,Yash Technologies Pvt Ltd,2025-09-02,Bengaluru,4-7 Years,"python development, data analytics, ci/cd pipelines, powerbi configuration, database management, nosql, software engineer"
Python Developer - (Senior Software Engineer / Team Lead),INDIAPROPERTY.COM,2025-09-02,Hyderabad,4-6 Years,"python developer, software engineer, operations management"
Python Developer,LAKSH HUMAN RESOURCE,2025-09-02,Mumbai,1-3 Years,"rest, python, django, git"
Python/Django Developer,"Verificient Technologies, Inc.",2025-09-02,Pune,4-7 Years,"python, css, tornado, javascript, jquery, database, django, cassandra, html, mysql, api"
Python Automation Engineer,Magic Finserv,2025-09-02,Noida,2-5 Years,"python, machine learning, artificial intelligence"
Full-Stack Developer - Python,ULTISOURCE Pvt Ltd.,2025-09-02,Mumbai,5-8 Years,"algorithms, css, software design, bootstrap, git, html, data structures, python, director, javascript, django"
"Jr. Data Analyst (Python, SQL, Power BI) Job Details | Gainwell Technologies LLC",Gainwell Technologies,2025-09-02,Bengaluru,1-4 Years,"data analysis, sql proficiency, python programming, power bi reporting, dashboard development"
Associate Team Lead /Lead Software Engineer - Python   React/Typescript,nec software solutions (india) pvt ltd,2025-09-02,Mumbai,10-15 Years,"python development react framework team leadership api development cloud infrastructure, storage, software engineer, image processing, solution architect, problem solving, javascript, gateway"
Python Developer Job Details | ExxonMobil,Exxonmobil Company India Pvt Ltd,2025-09-01,Hungary,1-5 Years,"python development, application security, api design, cloud concepts, git version control, java, perl, c#, github, microsoft azure, javascript, ruby, infrastructure, .net"
Python Internship in Pune,Maxgen Technologies,2025-09-01,Pune,0-1 Years,"django, ml"
Python Internship in Pune,Maxgen Technologies,2025-09-01,Pune,0-1 Years,"django, ml"
Senior Software Engineer - Python,BAKER HUGHES,2025-09-01,Mumbai,7-10 Years,"python backend development, machine learning expertise, design and code reviews, cloud application development, senior software engineer, docker, devops, software engineering, infrastructure, software developer"
Hiring For Python Squish-Test Specialist Role,krazy mantra hr solutions,2025-08-31,Bengaluru,2-5 Years,"python automation, squish testing, gui testing, jenkins ci/cd, jira management, test management, automation testing, healthcare, windows os, linux"
Python Pyspark Data Engineer,DXC Technologies,2025-08-30,Chennai,5-10 Years,"python programming, pyspark data processing, aws data services, etl/elt workflow development, oracle, iam, devops"
Python Developer - 2 - 3 Years - Mumbai (Onsite) job in India,crescendo global,2025-08-28,Mumbai,2-3 Years,"python development, django framework, sql/postgresql expertise, api integration, application debugging, windows, linux, json"
"Consultant - Product Management - AI/ML (Python, SQL, Tableau, GenAI)",Verizon Data Services India Pvt Ltd,2025-08-28,Chennai,7-10 Years,"ai technologies, product management, data analytics, bb acumen, strategic thinking, sql, data extraction, design thinking, consulting, predictive analytics, statistical analysis"
Python Developer  GLOINNT Solutions Pvt Ltd,GLOINNT Solutions Pvt. Ltd.,2025-08-28,Bengaluru,4-7 Years,"python programming, object oriented design, ci/cd processes, agile methodologies, version control, algorithms, git, linux, data structures"
