Title,Company,Posted on,Location,Experience,Skills
Java - Developer,Valtech,2025-09-22,Gandhinagar,5-10 Years,"java applications development microservice architecture design implementing design patterns web technologies expertise kubernetes deployments management, telematics, hibernate, security, mqtt, rest, software integration, spring boot"
Software Engineer (Java   Kafka),NICE,2025-09-22,Pune,4-8 Years,"java development, spring boot, microservices architecture, aws technologies, ci/cd pipelines, software design, sql, apache, git, iam, software professional, big data, github, team player, java developer, java programming"
Diveristy Java developer,SYNECHRON,2025-09-22,Bengaluru,4-10 Years,"java programming expertise, agile software development, java se, cloud computing, gtp, oracle, software delivery"
Senior Technical Lead (Core Java),PTC,2025-09-22,Pune,5-8 Years,"core java development, microservices architecture, sql query optimization, agile methodologies, security, git, software integration, java developer"
Java Full Stack Developer,UBS,2025-09-22,Switzerland,5-9 Years,"java programming, microservices architecture, devops practices, restful apis, agile methodologies, information technology, intellij, hibernate framework, sql, apache, teamcity, html, maven, spring boot, infrastructure"
"Senior Software Engineer - Java, AWS",NIELSEN,2025-09-22,Mumbai,5-9 Years,"microservices development, cloud computing, aws expertise, ci/cd processes, problem solving, senior software engineer, storage, security, java, linux, hbase, junit, messaging, infrastructure"
Hiring For Java Kafka Azure,krazy mantra hr solutions,2025-09-22,Chennai,3-5 Years,"java development, spring boot, microservices architecture, azure cosmos db, kafka messaging, j2ee, jdbc, docker"
"Technical Lead (Java, C  , GO)",PTC,2025-09-22,Pune,2-5 Years,"code development, agile methodologies, microservices architecture, infrastructure automation, c, docker, java, devops, api"
Senior Software Engineer (Java Kafka),NICE,2025-09-22,Pune,4-8 Years,"java development, spring boot, microservices architecture, aws technologies, ci/cd pipelines, software design, sql, apache, git, iam, software professional, big data, github, team player, java developer, java programming"
Sr. Software Architect - Java Development,Bright Vision Technologies,2025-09-22,Bengaluru,1-4 Years,"java development, software architecture, agile methodologies, cloud platforms, team leadership, software design, hibernate, docker, sql, spring, oop, security, database, git, devops, software engineering, jpa, data structures, nosql"
Senior Lead Software Engineer-Java,Clarivate,2025-09-22,Belgium,5-9 Years,"java development, springboot applications, object oriented programming, software development principles, version control systems, hibernate, git, linux, software engineer, mongodb, svn"
"Senior Software Engineer - Java, AWS",NIELSEN,2025-09-22,Gurgaon,5-8 Years,"microservices architecture, aws cloud services, java development, ci/cd processes, senior software engineer, storage, security, linux, hbase, junit, messaging, infrastructure"
Java Developer,Bright Vision Technologies,2025-09-22,Hyderabad,9-15 Years,"java development, collaborative teamwork, problem solving, immigration, h1b, compensation"
JAVA Developer,HARMAN INTERNATIONAL,2025-09-22,Pune,4-7 Years,"software development, api development, agile methodologies, cloud technologies, frontend frameworks, docker, sql, react.js, java, postgresql, python, github, software delivery, javascript, nosql, spring boot, node.js, openstack, software developer"
Java Full Stack Developer,UBS,2025-09-22,Switzerland,5-8 Years,"java & microservices, restful apis, devops & ci/cd, agile methodologies, banking domain, information technology, intellij, hibernate framework, sql, apache, teamcity, html, maven, spring boot, infrastructure"
"Java Developer (Java 1.8, Spring Boot & Microservices)",SYNECHRON,2025-09-22,Chennai,7-10 Years,"java development, spring boot, microservices architecture, messaging systems, sql databases, information technology, software requirements, intellij idea, git, software engineering, mq, maven, java developer, nosql, eclipse, gradle"
Java Lead Engineer,Bright Vision Technologies,2025-09-22,Delhi,5-10 Years,"software engineering, microservices development, agile methodologies, cloud technologies, orchestration, hibernate, spring, database, java, postgresql, jpa, mongodb, junit"
Java Full Stack Developer,UBS,2025-09-22,Switzerland,5-8 Years,"java development microservices architecture restful apis devops practices agile methodologies, information technology, intellij, hibernate framework, sql, apache, teamcity, html, maven, spring boot, infrastructure"
Java Developer,Fulcrum Digital,2025-09-22,Pune,5-6 Years,"java development, spring framework, microservices architecture, test driven development, api integration, sql, security, git, debugging, jpa, mvc, spring boot, gateway"
Senior Java Fullstack Developer (Java/Angular/Rest API)_7 Yrs_Bangalore,Worldpay,2025-09-22,Bengaluru,5-10 Years,"angular development, reactjs/vue framework, java backend development, spring boot apis, cloud platform exposure, css, aop, html5, rest api, bootstrap, hibernate, intellij idea, security, spring mvc, j2ee, software engineer, jpa, mysql, oracle, javascript, spring security, ioc, ionic framework"
Senior Java Full Stack Developer,institutional shareholder services,2025-09-22,Mumbai,3-6 Years,"java development, sql optimization, angular architecture, technical leadership, software testing, security, git, web development, sql database"
Senior Java Backend Developer,Allstate,2025-09-22,Bengaluru,6-9 Years,"continuous integration, microservices architecture, test driven development, java development, event driven architecture, telematics, software engineer, imaging, spring boot, consultant, service design"
Senior Java Backend Developer,ORACLE INDIA PVT LTD,2025-09-22,Bengaluru,4-6 Years,"springboot, sql, spring mvc, spring security, kafka, micro services"
Java Developer,PTC,2025-09-22,Gurgaon,3-5 Years,"java development, jee expertise, sql proficiency, spring framework, problem solving, bootstrap, debugging"
Java Developer with Linux,CONCENTRIX,2025-09-22,Hyderabad,3-5 Years,"sql, apache, debugging, big data, python, javascript, java developer, groovy"
Java Developer,Increasingly,2025-09-22,Bengaluru,5-8 Years,"java development, spring boot, microservices architecture, apache kafka, system security, sso, messaging, spring security, software engineering"
"SDET(Java,Selenium,Cucumber)Pune",Worldpay,2025-09-22,Pune,5-8 Years,"test automation frameworks, java coding expertise, selenium web driver, ci tool proficiency, cucumber, test lead, test cases, software quality, security, jenkins, mobile, agile"
"Senior Software Engineer - Java, AWS",NIELSEN,2025-09-22,Bengaluru,5-8 Years,"microservices architecture, cloud optimization, aws expertise, ci/cd processes, problem solving, senior software engineer, storage, security, java, linux, hbase, junit, messaging, infrastructure"
Sr. Software Architect - Java Development,Bright Vision Technologies,2025-09-22,Visakhapatnam,1-4 Years,"java development, software architecture, cloud platforms, agile methodologies, code reviews, software design, hibernate, docker, sql, spring, oop, security, database, git, devops, software engineering, jpa, data structures, nosql"
Java Developer,Bright Vision Technologies,2025-09-22,Hyderabad,3-5 Years,"java development programming excellence team collaboration immigration support client interaction, java developer"
Java Developer,Fulcrum Digital,2025-09-22,Pune,5-6 Years,"java development, spring framework, microservices architecture, test driven development, api integration, sql, security, git, debugging, jpa, mvc, spring boot, gateway"
Sr. Software Architect - Java Development,Bright Vision Technologies,2025-09-22,Chennai,1-4 Years,"java development, software architecture, cloud platforms, agile methodologies, team leadership, software design, hibernate, docker, sql, spring, oop, security, database, git, devops, software engineering, jpa, data structures, nosql"
Java Automation Engineer,Arivon Technologies,2025-09-22,Bengaluru,2-6 Years,"rest, javascript, docker, react.js, security, java"
Senior Specialist Software Engineer (Java   Angular),NICE,2025-09-22,Pune,1-4 Years,"java development, spring framework, frontend technologies, restful apis, cloud infrastructure, j2ee, data structures, big data, javascript, nosql, ooad, java programming, algorithms, hibernate, security, software engineer, ioc"
Specialist Java Engineer -5  Years,FIS,2025-09-22,Chennai,4-9 Years,"java programming expertise, microservices architecture, unix/linux proficiency, risk monitoring solutions, coding and debugging, fundamentals, algorithms, c, senior software engineer, security, unix shell scripting, data structures, windows"
Java Lead Engineer,Bright Vision Technologies,2025-09-22,Pune,10-13 Years,"software engineering, microservices development, agile methodologies, cloud technologies, database management, orchestration, hibernate, spring, java, postgresql, jpa, mongodb, junit"
Hiring For Java API Integration,krazy mantra hr solutions,2025-09-22,Chennai,5-7 Years,"api development, spring webflux, microservices architecture, cloud platforms, devops ci/cd, database management, java api"
Java Lead Engineer,Bright Vision Technologies,2025-09-22,Jaipur,5-10 Years,"java development, microservices architecture, agile methodologies, database management, orchestration, hibernate, spring, postgresql, software engineering, jpa, mongodb, junit"
Java Lead Engineer,Bright Vision Technologies,2025-09-22,Bengaluru,5-10 Years,"software development, microservices architecture, agile methodology, database management, team leadership, orchestration, hibernate, spring, java, postgresql, software engineering, jpa, mongodb, junit"
"Java Developer (Java, Spring Boot Microservices Architecture)",SYNECHRON,2025-09-22,Chennai,7-10 Years,"java development, spring boot, microservices architecture, messaging systems, agile/scrum methodology, information technology, software requirements, sql, intellij idea, git, software engineering, mq, maven, java developer, nosql, eclipse, gradle"
Java Lead Engineer,Bright Vision Technologies,2025-09-22,Jaipur,5-10 Years,"java development, microservices architecture, agile methodologies, database management, team leadership, orchestration, hibernate, spring, postgresql, software engineering, jpa, mongodb, junit"
"Senior Java Developer (Java, Kafka, AWS, Microservices)_8  Yrs_Bangalore/Pune/Indore",Worldpay,2025-09-22,Bengaluru,5-10 Years,"java development, kafka expertise, agile practices, devops tools, senior software engineer, apex, spring, security, java developer, messaging, spring boot"
Java Developer  - W6381,Nisum,2025-09-22,Chile,6-9 Years,"java development, microservices architecture, spring framework, sql/nosql technologies, ci/cd pipeline, soa, information technology, apache, camel, xml, j2ee, software engineering, api, oracle, maven, soap, mockito, git, jpa, rest, svn, team player, gradle, spring boot"
Core JAVA Technical Lead,Sopra Steria,2025-09-22,Bengaluru,6-8 Years,"java development, eclipse rcp, restful api, agile methodology, maven & jenkins, c, forms"
Sr. Software Architect - Java Development,Bright Vision Technologies,2025-09-22,Delhi,1-4 Years,"java development, software architecture, agile methodologies, cloud platforms, code review, software design, hibernate, docker, sql, spring, oop, security, database, git, devops, software engineering, jpa, data structures, nosql"
Senior Software Engineer- JAVA (Full Stack),Clarivate,2025-09-22,Bengaluru,4-7 Years,"java/jee development, angular framework, spring boot expertise, sql database management, css, senior software engineer, intellij, apache, j2ee, software engineering, html, linux shell scripting, oracle, maven, javascript, visual studio, eclipse, unix/linux, soap"
"Java Software Engineer, AVP",NatWest Group,2025-09-22,Chennai,5-8 Years,"core java engineering, software design architecture, selenium web driver, devops methodology, agile practices, software engineer, software engineering, teamcity"
Senior Software Engineer - Java,HIGHRADIUS,2025-09-22,Hyderabad,5-10 Years,"java development, payment processing, financial regulations, microservices architecture, security best practices, storage, docker, database, mysql, api, problem solving, spring boot"
Java Developer  - WB6364,Nisum,2025-09-22,Chile,5-8 Years,"java development, spring framework, microservices architecture, sql/nosql technologies, testing frameworks, soa, information technology, mockito, git, j2ee, jpa, software engineering, api, rest, oracle, maven, svn, gradle, spring boot, soap"
Java Lead Engineer,Bright Vision Technologies,2025-09-22,Bengaluru,5-10 Years,"software development leadership, microservices architecture, agile methodologies, cloud technologies, database management, orchestration, hibernate, spring, java, postgresql, software engineering, jpa, mongodb, junit"
Java Lead Engineer,Bright Vision Technologies,2025-09-22,Jaipur,5-10 Years,"software development, microservices architecture, agile methodologies, database design, team leadership, orchestration, hibernate, spring, java, postgresql, software engineering, jpa, mongodb, junit"
Java Lead Engineer,Bright Vision Technologies,2025-09-22,Pune,5-10 Years,"java development, microservices architecture, team leadership, agile methodologies, database design, orchestration, hibernate, spring, postgresql, software engineering, jpa, mongodb, junit"
Senior Java Developer  - WB6363,Nisum,2025-09-22,Chile,7-10 Years,"java development, spring framework, microservices architecture, unit testing, ci/cd pipeline, soa, information technology, apache, camel, xml, j2ee, software engineering, api, oracle, maven, nosql, soap, mockito, git, jpa, rest, svn, team player, gradle, spring boot"
Lead - Core Java Application Engineer,FIDELITY INTERNATIONAL,2025-09-22,Gurgaon,8-11 Years,"core java development, multithreading expertise, algorithm implementation, cloud best practices, algorithms, database, devops, software engineer, software delivery, machine learning, messaging, java programming"
Java Developer  - W6381,Nisum,2025-09-22,Chile,6-9 Years,"java development, microservices architecture, spring framework, sql/nosql technologies, ci/cd pipeline, soa, information technology, apache, camel, xml, j2ee, software engineering, api, oracle, maven, soap, mockito, git, jpa, rest, svn, team player, gradle, spring boot"
Sr Java Developer,Fulcrum Digital,2025-09-22,Pune,3-5 Years,"java development, spring framework, test driven development, api implementation, sql, security, git, debugging, jpa, mvc, spring boot, gateway"
Senior Lead- Java Support,PTC,2025-09-22,Pune,3-5 Years,"cloud computing, java development, technical troubleshooting, sql proficiency, shell scripting, fundamentals, orchestration, information technology, docker, system administration, database, security, devops, linux, html, oracle, os, javascript, infrastructure"
Java Lead Engineer,Bright Vision Technologies,2025-09-22,Mumbai,5-10 Years,"microservices development, agile methodologies, database management, orchestration, hibernate, spring, java, postgresql, jpa, mongodb, junit"
Senior Java Engineer,CDK Global,2025-09-22,Hyderabad,0-2 Years,"java programming, spring framework, sql databases, problem solving"
Java Lead Engineer,Bright Vision Technologies,2025-09-22,Pune,5-10 Years,"java development, microservices architecture, agile methodologies, database management, cloud technologies, orchestration, hibernate, spring, postgresql, software engineering, jpa, mongodb, junit"
Java Lead Engineer,Bright Vision Technologies,2025-09-22,Delhi,10-13 Years,"software development, microservices architecture, agile environment, team leadership, database management, orchestration, hibernate, spring, java, postgresql, software engineering, jpa, mongodb, junit"
Java Lead Engineer,Bright Vision Technologies,2025-09-22,Chennai,5-10 Years,"software engineering agile development microservices development database management team leadership, orchestration, hibernate, spring, java, postgresql, jpa, mongodb, junit"
Java Lead Engineer,Bright Vision Technologies,2025-09-22,Delhi,5-10 Years,"software engineering, microservices development, team leadership, agile methodologies, cloud technologies, orchestration, hibernate, spring, database, java, postgresql, jpa, mongodb, junit"
Senior Software Engineer-Java,Clarivate,2025-09-22,Bengaluru,4-7 Years,"java development, spring framework, angular framework, sql server, unit testing, css, senior software engineer, hibernate, docker, git, devops, linux, html, oracle, svn, javascript, web technologies"
Java Developer,CONNECTING 2 WORK,2025-09-21,Thiruvananthapuram,2-5 Years,"object oriented analysis, front end, software development, design documentation, orm, sql, memory management, java, infrastructure, design patterns, computer programmer"
Java Developer,CONNECTING 2 WORK,2025-09-21,Thiruvananthapuram,0-3 Years,"gwt, jee, hibernate, java developer, sql, wicket, spring framework, memory management, java, spring mvc, java ee, jsf"
Java & API Developer,DXC Technologies,2025-09-21,Noida,5-10 Years,"java development, api development, sql database, agile methodologies, team leadership, websphere, rest api, hibernate, spring, j2ee, oracle, struts"
JAVA FULL STACK DEVELOPER,CONNECTING 2 WORK,2025-09-21,Kollam,3-5 Years,"css, oracle, javascript, database, java, php, .net, html, mysql, mongodb, computer programmer"
Senior Java,LINKTAG,2025-09-21,Delhi,7-10 Years,"senior programmer, hibernate, spring, java, struts, j2ee"
JAVA DEVELOPER,CONNECTING 2 WORK,2025-09-21,Cochin,1-4 Years,"hibernate, java developer, spring, multimedia, advanced java, java, infrastructure, servlets, debugging, mysql"
JAVA FULL STAKE Developer,M/s Fast and Furious Consulting,2025-09-21,Jaipur,0-3 Years,"rest, css, jsp, triggers, javascript, jquery, java, xml, web technologies, servlets, json, data structures, html, service oriented architecture, soap"
JAVA DEVELOPER,CONNECTING 2 WORK,2025-09-21,Thiruvananthapuram,3-6 Years,"rest, hibernate, hibernate framework, spring, spring boot, java, spring security, spring mvc, mvc"
Senior Software Engineer - Java,HIGHRADIUS,2025-09-21,Hyderabad,4-9 Years,"java programming, software development, code reviews, cloud technologies, hibernate, sql, spring, elastic search, git, junit"
Java Developer,HARMAN INTERNATIONAL,2025-09-21,Bengaluru,5-8 Years,"java/kotlin programming, spring boot framework, webflux and reactor, kafka messaging, nosql mongodb"
Software Engineer-Java Developer,FACTSET,2025-09-21,Hyderabad,3-7 Years,"java programming, relational databases, cloud technologies, restful apis, identity management, oop, iam, postgresql, software engineer, mysql, access management, java developer"
Software Engineer (Java Developer),Diebold Nixdorf,2025-09-21,Mumbai,2-4 Years,"software engineering principles, system design & development, coding & testing, technical support & troubleshooting, cross functional collaboration, security"
Java/J2EE Developer,LINKTAG,2025-09-21,Bengaluru,3-6 Years,"jsp, hibernate, j2ee developer, spring, java, j2ee, jpa, oracle, sybase, weblogic, svn, struts, jsf"
Senior Software Engineer - Java,HIGHRADIUS,2025-09-21,Hyderabad,4-9 Years,"java programming, software development, code reviews, cloud technologies, hibernate, sql, spring, elastic search, git, junit"
Java Developer,TransUnion,2025-09-21,Hyderabad,3-5 Years,"java programming, big data technologies, data pipeline development, etl data flows, data analysis, hive, scala, team player, software engineer"
Software Engineer (Java Developer),Diebold Nixdorf,2025-09-21,Mumbai,2-4 Years,"software engineering principles, system design & development, coding & testing, technical support & troubleshooting, cross functional collaboration, security"
Java Developer,Drawsera,2025-09-21,Mumbai,1-5 Years,"css, ajax, jquery, sql, database, java, j2ee, mysql, html, oracle, j2se, javascript, java developer, website development"
Senior Software Engineer - Java,HIGHRADIUS,2025-09-21,Hyderabad,4-9 Years,"core java development, hibernate framework, spring framework, sql database management, elastic search, git, junit"
"Software Engineer, Java, AVP",NatWest Group,2025-09-21,Bengaluru,8-11 Years,"java programming, spring boot, microservices architecture, devops methodologies, automated testing frameworks, software design, software engineer, software engineering, nosql"
Java Developer (Spring Boot),CONNECTING 2 WORK,2025-09-21,Thiruvananthapuram,3-6 Years,"css, rest api, html5, jsp, bootstrap, hibernate, jquery, spring, database, java, git, spring mvc, j2ee, jpa, mysql, rest, junit, rdbms, javascript, jstl, spring boot, spring security, servlets, soap"
Full Stack Java Developer,cloudxlab,2025-09-21,Bengaluru,6-9 Years,"rest, css, rdbms, hibernate, spring, spring boot, java, git, spring mvc, devops, html, jpa"
UI Developer with Java,INTERSOFTKK (INDIA) PVT. LTD.,2025-09-21,Bengaluru,0-3 Years,"soa, ece, ajax, java, unix shell scripting, apache, camel, technology consulting, j2ee, eclipse, spring framework, struts, websphere, bootstrap, jboss application server, jquery, spring mvc, debugging, rest, weblogic, problem solving, servlets, richfaces"
Lead Developer-Java/.NET,FINITE HR CONSUTING PVT LTD,2025-09-21,Pune,10-13 Years,"java, c, web technologies"
"Java Developer 2yrs  experience  J2EE, Struts, Core Java, JSP, Servlets",JOBNATH HR SERVICES,2025-09-21,Noida,2-5 Years,"jsp, hibernate, advanced java, java, struts, xml, vxml, ccxml, j2ee, servlets, telecom, ejb"
Java Developer (Intermediate Level),SYNECHRON,2025-09-21,Gurgaon,4-6 Years,"java programming, spring framework, microservices architecture, aws cloud services, ci/cd tools, software requirements, docker, debugging, jpa, api, junit, maven, java developer, gradle"
Java/Python/C Intern,HARMAN INTERNATIONAL,2025-09-21,Bengaluru,0-1 Years,"java programming, python proficiency, oops concepts, agile methodologies, software testing, software engineering"
Java Developer,LINKTAG,2025-09-21,Dallas,7-10 Years,"websphere, websphere mq, css, gwt, jsp, jdbc, hibernate, ajax, spring, java, uml, oops, j2ee, multithreading, html, software engineering, weblogic, extjs, javascript, oracle 11g, struts, jsf, soap"
Sr. Java Developer,CONNECTING 2 WORK,2025-09-21,Thiruvananthapuram,5-7 Years,"rest, gwt, hibernate, java developer, android development, java, spring mvc, struts, j2ee, jpa, html, soap"
java developer,FINITE HR CONSUTING PVT LTD,2025-09-21,Hyderabad,7-10 Years,"rest, html5, javascript, jquery, sql, spring, database, java, dao, mvc, soap"
Java Technical Architect,FINITE HR CONSUTING PVT LTD,2025-09-21,Mumbai,10-13 Years,"bug fixing, hibernate, sql, spring, advanced java, database, java, mysql, mongodb, oracle, maven, ant, eclipse"
Senior Java Developer,CONNECTING 2 WORK,2025-09-21,Cochin,2-5 Years,"java programming, spring/spring boot, troubleshooting, problem solving, database, software engineering, api, mongodb"
Senior Java Developer,CONNECTING 2 WORK,2025-09-21,Cochin,2-5 Years,"java programming, spring/spring boot, troubleshooting, problem solving, database, software engineering, api, mongodb"
Java Developer - C2H,LINKTAG,2025-09-21,United,3-4 Years,"java, web services, technical skill"
SENIOR JAVA DEVELOPER,KG TIGER,2025-09-21,United,2-5 Years,"curl, html5, spring, java, devops, mysql, web development, api, vms, oracle, ubuntu, maven, javascript, java developer, eclipse, angularjs, fundamentals, sharepoint, bootstrap, mockito, jquery, intellij idea, docker, sql, grunt, git, postgresql, linux, mongodb, rest, junit, mobile, windows"
Lead Java Developer,FINITE HR CONSUTING PVT LTD,2025-09-21,Hyderabad,7-10 Years,"rest, html5, javascript, jquery, sql, spring, database, java, dao, mvc, soap"
Java Consultants,LINKTAG,2025-09-21,Bengaluru,4-5 Years,"soa, jdbc, hibernate, spring, jaxb, java, uml, xml, j2ee, jpa, junit, ant, weblogic, jstl, spring framework, struts, xml schema, java programming, soap"
Core Java Developer,FINITE HR CONSUTING PVT LTD,2025-09-21,Hyderabad,0-3 Years,"css, html5, jquery, sql, oop, java, apache, xml, java ee, j2ee, html, object oriented programming, oracle, maven, svn, problem solving, team player, javascript, java developer, wicket, swing"
Senior Java Architect,Gainwell Technologies,2025-09-21,Bengaluru,7-17 Years,"java expertise, microservices design, kubernetes management, aws cloud solutions, solutions architecture, user documentation, production support, application support"
Java Developer,FINITE HR CONSUTING PVT LTD,2025-09-21,Hyderabad,0-3 Years,"css, html5, maven, svn, problem solving, team player, javascript, jquery, sql, wicket, oop, swing, java, xml, j2ee, html"
Java Developer,CONNECTING 2 WORK,2025-09-21,Cochin,0-3 Years,"rest, docker, spring framework, spring, spring boot, java, postgresql, json, api, mongodb"
Senior Software Engineer (Java Developer),Diebold Nixdorf,2025-09-21,Mumbai,4-6 Years,"software development life cycle, system integration expertise, secure coding practices, project leadership, security, software engineering"
Java Trainer Developer,Bhatia Consultancy Services,2025-09-21,Ludhiana,1-2 Years,"java, java swing, jsp, j2ee, .net, eclipse"
Senior Software Engineer - Java-1,MASTERCARD,2025-09-21,Navi,4-8 Years,"software development life cycle, java application development, system maintenance management, technical leadership mentoring, quality assurance processes, information technology, system development, software engineering, test design, solution delivery, sdlc, performance testing, matrix, security"
