Title,Company,Posted on,Location,Experience,Skills
Junior AI Research Scientist,SEVEN CONSULTANCY,2025-09-19,Chennai,5-8 Years,"natural language processing, machine learning, artificial intelligence, opencv"
Senior AI Data Scientist,SEVEN CONSULTANCY,2025-09-19,Mumbai,2-3 Years,"c, artificial intelligence, burning platform"
Generative AI Specialist (English),Google India Pvt Ltd,2025-09-19,Bengaluru,3-5 Years,"generative ai development, cloud solutions design, customer relationship management, data pipeline management, data visualization techniques, hive, data warehousing, storage, pig, apache, flume, hadoop, cloud computing, big data, mapreduce, infrastructure"
Junior AI Research Scientist,SEVEN CONSULTANCY,2025-09-19,Mumbai,0-3 Years,"natural language processing, machine learning, artificial intelligence, consultant, opencv"
Generative AI Data Scientist,CGI Information Systems and Management Consultants Pvt Ltd,2025-09-19,Canada,5-10 Years,"generative ai development, data analytics expertise, advanced ai solutions, risk mitigation strategies, advanced analytics, cgi, data scientist"
"Technology Practice Lead, AI",Google India Pvt Ltd,2025-09-19,Singapore,1-4 Years,"ai solutions adoption, cloud architecture, technical engagements, data analytics expertise, stakeholder influence, job posting, recruitment, workforce, decision making"
AI Safety Data Scientist,Google India Pvt Ltd,2025-09-19,Bengaluru,5-8 Years,"data analysis techniques, project management, machine learning applications, programming proficiency, threat analysis expertise, c, sql, database, security, python"
AI Developer Technology Engineer,Nvidia Graphics Pvt Ltd,2025-09-19,Japan,3-9 Years,"deep learning techniques, gpu architectures, ai algorithms, parallel programming, cuda c/c, software design, system software, artificial intelligence, problem solving, machine learning"
Senior AI Research Scientist,SEVEN CONSULTANCY,2025-09-19,Delhi,2-3 Years,"natural language processing, machine learning, artificial intelligence, consultant, opencv"
Senior AI Developer,SEVEN CONSULTANCY,2025-09-19,Chennai,5-8 Years,"algorithms, python, artificial intelligence"
AI Research Scientist,SEVEN CONSULTANCY,2025-09-19,Mumbai,5-8 Years,"natural language processing, machine learning, artificial intelligence, consultant, opencv"
AI Data Scientist,SEVEN CONSULTANCY,2025-09-19,Bengaluru,2-3 Years,"originate new analytics, delivery methods"
Senior AI Developer,SEVEN CONSULTANCY,2025-09-19,Delhi,0-3 Years,"algorithms, python, artificial intelligence, pytorch"
Junior AI Data Scientist,SEVEN CONSULTANCY,2025-09-19,Chennai,5-8 Years,"artificial intelligence, data scientist, machine learning"
Junior Product Manager(AI),SEVEN CONSULTANCY,2025-09-19,Delhi,0-3 Years,"sales head, product sales, product manager, sales, account management, market, marketing, market share"
Senior AI Data Scientist,SEVEN CONSULTANCY,2025-09-19,Bengaluru,0-3 Years,"c, artificial intelligence, data assets"
Senior AI Research Scientist,SEVEN CONSULTANCY,2025-09-19,Chennai,4-7 Years,"natural language processing, machine learning, artificial intelligence, consultant, opencv"
AI Research Scientist,SEVEN CONSULTANCY,2025-09-19,Hyderabad,1-2 Years,"c, signal processing, artificial intelligence, java, hadoop, big data, mongodb, python, machine learning, consultant, cassandra, infrastructure"
AI Innovation Engineer,HITACHI,2025-09-19,Bengaluru,7-10 Years,"ai powered solutions, generative models optimization, multimodal ai integration, ai agents configuration, api development, css, artificial intelligence, telecom, python, machine learning, hitachi"
SAP Analytics  AI Lead,ASTRAZENECA,2025-09-19,Chennai,5-8 Years,"ai techniques, business process ai, ai insights application, ai governance, engineering practices, closing, sox, reporting, verification, o2c, erp, sap, p2p, r2r, financial management, finance"
Junior AI Research Scientist,SEVEN CONSULTANCY,2025-09-19,Bengaluru,4-8 Years,"natural language processing, machine learning, artificial intelligence, consultant, opencv"
GEN AI- Sr Architect,Birlasoft,2025-09-19,Mumbai,7-10 Years,"ai solution design, programming proficiency, machine learning expertise, algorithms, artificial intelligence, java, devops, big data, python, natural language processing"
Product Manager(AI),SEVEN CONSULTANCY,2025-09-19,Chennai,5-8 Years,"nlp technologies, appraising new product"
AI/ ML Architect,APPLYCUP HIRING SOLUTIONS LLP,2025-09-19,Pune,8-12 Years,"system building, computer vision, deep learning, signal processing, software development, fundamentals, algorithms, c, image processing, python, kernel, algorithm development, machine learning"
Solution Architect - Agentic AI,Nvidia Graphics Pvt Ltd,2025-09-19,Japan,5-8 Years,"gpu accelerated computing, machine learning support, python coding expertise, technical presentations, algorithms, c, artificial intelligence, linux, debugging, solution architect, computer graphics"
CAD AI Engineer,MICRON TECHNOLOGY,2025-09-19,Hyderabad,3-5 Years,"ai solutions development, memory systems innovation, data acceleration techniques, storage technology expertise, engineering problem solving, technology leadership, mobile, artificial intelligence"
CAD AI Engineer,MICRON TECHNOLOGY,2025-09-19,Hyderabad,3-5 Years,"ai system development, memory solutions expertise, storage systems engineering, data processing methods, software engineering principles, technology leadership, mobile, artificial intelligence"
AI Research Scientist,SEVEN CONSULTANCY,2025-09-19,Hyderabad,5-10 Years,"c, signal processing, artificial intelligence, java, hadoop, big data, mongodb, python, machine learning, consultant, cassandra, infrastructure"
Product Manager(AI),SEVEN CONSULTANCY,2025-09-19,Navi,2-3 Years,"product strategy, assesses market competition, product market share"
Junior AI Developer,SEVEN CONSULTANCY,2025-09-19,Mumbai,0-3 Years,"algorithms, python, machine learning, artificial intelligence, consultant"
Senior AI Engineer,ASTRAZENECA,2025-09-19,Bengaluru,5-10 Years,"machine learning expertise, python programming, ai solution engineering, data science proficiency, artificial intelligence, docker, security, database, devops, software engineering, shell scripting"
AI Research Scientist,SEVEN CONSULTANCY,2025-09-19,Mumbai,0-3 Years,"natural language processing, machine learning, artificial intelligence, consultant, opencv"
Senior AI Developer,SEVEN CONSULTANCY,2025-09-19,Bengaluru,2-3 Years,"algorithms, python, artificial intelligence"
Senior AI Developer,SEVEN CONSULTANCY,2025-09-19,Mumbai,0-3 Years,"algorithms, python, artificial intelligence, architecture principles"
AI Data Scientist,SEVEN CONSULTANCY,2025-09-19,Hyderabad,8-12 Years,"algorithms, c, business rules, data warehousing, sql, java, perl, big data, python, c, sas, machine learning, ruby, consultant"
AI Data Scientist,SEVEN CONSULTANCY,2025-09-19,Chennai,5-8 Years,"artificial intelligence, originate new analytics, solution analytics, led programs"
CAD AI Engineer,MICRON TECHNOLOGY,2025-09-19,Hyderabad,3-5 Years,"ai systems development, memory and storage, software engineering, data analysis techniques, performance optimization, technology leadership, mobile, artificial intelligence"
AI Research Scientist,SEVEN CONSULTANCY,2025-09-19,Hyderabad,15-20 Years,"c, signal processing, artificial intelligence, java, hadoop, big data, mongodb, python, machine learning, consultant, cassandra, infrastructure"
AI Research Scientist,SEVEN CONSULTANCY,2025-09-19,Hyderabad,5-10 Years,"c, signal processing, artificial intelligence, java, hadoop, big data, mongodb, python, machine learning, consultant, cassandra, infrastructure"
Product Manager(AI),SEVEN CONSULTANCY,2025-09-19,Bengaluru,5-8 Years,"product strategy, determines customers"
Product Manager(AI),SEVEN CONSULTANCY,2025-09-19,Navi,2-3 Years,"product strategy, assesses market competition, product market share"
AI Data Scientist,SEVEN CONSULTANCY,2025-09-19,Hyderabad,5-8 Years,"algorithms, c, business rules, data warehousing, sql, java, perl, big data, python, c, sas, machine learning, ruby, consultant"
Junior AI Developer,SEVEN CONSULTANCY,2025-09-19,Mumbai,0-3 Years,"algorithms, python, machine learning, artificial intelligence, consultant"
AI Engagement Manager,Adobe Systems Ltd,2025-09-19,France,4-10 Years,"ai powered solutions, digital transformation, customer leadership, agile methodologies, jira, engagement manager, director, metrics"
AI Data Scientist,SEVEN CONSULTANCY,2025-09-19,Hyderabad,5-8 Years,"algorithms, c, business rules, data warehousing, sql, java, perl, big data, python, c, sas, machine learning, ruby, consultant"
AI Research Scientist,SEVEN CONSULTANCY,2025-09-19,Bengaluru,4-8 Years,"natural language processing, machine learning, artificial intelligence, consultant, opencv"
"Manager, AI Support",Google India Pvt Ltd,2025-09-19,Bengaluru,5-10 Years,"team leadership, ai expertise, stakeholder influence, problem solving, job posting, recruitment, workforce, decision making"
Product Manager(AI),SEVEN CONSULTANCY,2025-09-19,Bengaluru,5-8 Years,"product strategy, determines customers"
AI Developer,SEVEN CONSULTANCY,2025-09-19,Hyderabad,12-15 Years,"natural language processing, machine learning, artificial intelligence, opencv"
AI Developer,SEVEN CONSULTANCY,2025-09-19,Chennai,3-6 Years,"python, architecture principles, learning algorithms"
AI Developer,SEVEN CONSULTANCY,2025-09-19,Hyderabad,10-13 Years,"natural language processing, machine learning, artificial intelligence, opencv"
AI Developer,SEVEN CONSULTANCY,2025-09-19,Hyderabad,12-15 Years,"artificial intelligence, data scientist, machine learning, ai development"
AI Developer,SEVEN CONSULTANCY,2025-09-19,Hyderabad,12-15 Years,"artificial intelligence, data scientist, machine learning"
AI Developer,SEVEN CONSULTANCY,2025-09-19,Delhi,1-3 Years,"architecture principles, algorithms necessary"
AI Developer,SEVEN CONSULTANCY,2025-09-19,Delhi,0-3 Years,"algorithms, python, machine learning, artificial intelligence, consultant"
AI Developer,SEVEN CONSULTANCY,2025-09-19,Chennai,4-7 Years,"artificial intelligence, data scientist, machine learning, ai development"
AI Developer,SEVEN CONSULTANCY,2025-09-19,Bengaluru,4-8 Years,"architecture principles, algorithms necessary"
AI Developer,SEVEN CONSULTANCY,2025-09-19,Mumbai,2-3 Years,"architecture principles, algorithms necessary"
Agentic AI/GEN AI trainer - Senior Consultant,virtusa consulting services pvt. ltd.,2025-09-18,Chennai,5-10 Years,"transformer models expertise, python coding proficiency, ai ethics awareness, curriculum development, science"
AI Workforce Specialist - Education,Microsoft India Pvt Ltd,2025-09-18,Japan,5-7 Years,"ai integration expertise, digital transformation strategies, solution selling techniques, workforce"
Applied AI Engineer II,Microsoft India Pvt Ltd,2025-09-18,Redmond,2-3 Years,"machine learning expertise, mlops workflow management, data science acumen, model evaluation techniques, production, innovation, cutting"
Novel AI Testing Analyst,Google India Pvt Ltd,2025-09-18,Seattle,4-5 Years,"ai testing strategies, data analytics expertise, problem solving abilities, job posting, recruitment, workforce, compensation"
AI Applied Scientist,Microsoft India Pvt Ltd,2025-09-18,Bengaluru,3-4 Years,"machine learning expertise, data science proficiency, generative ai familiarity, production, manufacturing, model development, innovation, documentation, data collection, cutting"
Senior Solutions Architect - AI,Nvidia Graphics Pvt Ltd,2025-09-18,Canada,5-8 Years,"machine learning expertise, ai software tools, data science languages, high performance computing, cuda, python, c, artificial intelligence, docker, fortran"
Cloud Engineer AI,Google India Pvt Ltd,2025-09-18,Bengaluru,3-5 Years,"machine learning solutions, python programming, data structures, cloud computing, big data, algorithms, scala, software design, data warehousing, storage, infrastructure"
AI Safety Data Scientist,Google India Pvt Ltd,2025-09-18,Bengaluru,5-8 Years,"project management, machine learning application, programming proficiency, statistical methods, c, sql, database, security, python"
Cloud Engineer AI,Google India Pvt Ltd,2025-09-18,Bengaluru,3-5 Years,"machine learning solutions, python programming, data structures, cloud computing, big data, algorithms, scala, software design, data warehousing, storage, infrastructure"
Python-AI developer,CGI Information Systems and Management Consultants Pvt Ltd,2025-09-17,Chennai,4-6 Years,"python programming, ai development, software engineering, problem solving, team collaboration, cgi"
Principal Enterprise Architect - AI,the abt group,2025-09-17,Bengaluru,8-10 Years,"ai/ml frameworks expertise, model governance understanding, ethical ai compliance"
Manager-Data/AI Engineering,AT&T,2025-09-17,Bengaluru,9-14 Years,"team leadership, ai solutions architecture, data engineering expertise, project management, learning, performance review, processing, disciplinary action"
Generative AI Specialist (English),Google India Pvt Ltd,2025-09-17,Bengaluru,2-5 Years,"generative ai solutions, data pipeline expertise, large language models, customer relationship management, hive, data warehousing, storage, pig, apache, flume, hadoop, big data, mapreduce, infrastructure"
Gen AI Engineer,Thoucentric,2025-09-17,UK,5-9 Years,"ai solution delivery, generative ai development, machine learning expertise, python programming, mlops implementation, falcon, docker, infrastructure"
AI Engineer,Best InfoSystems Ltd.,2025-09-17,Chennai,5-10 Years,ai engineer
AI/ML Engineer,ap moller-maersk shipping,2025-09-17,Bengaluru,1-3 Years,"data analytics expertise, machine learning applications, algorithm development, statistical modelling, supply chain insights, algorithms, artificial intelligence"
Python-AI developer,CGI Information Systems and Management Consultants Pvt Ltd,2025-09-17,Chennai,4-6 Years,"python programming, ai development, software engineering, problem solving, team collaboration, cgi"
"Recruiter, Google Cloud AI",Google India Pvt Ltd,2025-09-17,San,5-8 Years,"talent strategy development, recruitment metrics analysis, client relationship management, negotiation expertise, hr, job posting, workforce, immigration, employer branding, compensation, interview"
Senior AI Systems Engineer,Nvidia Graphics Pvt Ltd,2025-09-17,Israel,5-9 Years,"ai innovation, python programming, software engineering, machine learning, data management, fundamentals, algorithms, orchestration, senior software engineer, sql, git, data structures, nosql"
Engineer AI/ML,EMPOWER,2025-09-16,Bengaluru,3-5 Years,"python programming, machine learning models, data pipeline management, ai/ml frameworks, analytical thinking, innovation, production, enhancements, model development"
AI Engagement Manager,Adobe Systems Ltd,2025-09-16,Japan,4-10 Years,"customer engagement, ai/ml expertise, agile methodologies, digital strategy, cloud deployments, sharepoint, devops, engagement manager, director"
AI Platform Director,Freescale Semiconductor India Pvt Ltd,2025-09-15,Bengaluru,12-20 Years,"ai/ml solutions, software development, ci/cd processes, cloud engineering, data security, information technology, storage, git, iam, perforce, drm, director, svn, logical thinking, infrastructure"
AI Platform Director,Freescale Semiconductor India Pvt Ltd,2025-09-15,Bengaluru,12-20 Years,"ai/ml solutions, software development, ci/cd processes, cloud engineering, data security, information technology, storage, git, iam, perforce, drm, director, svn, logical thinking, infrastructure"
Senior AI Architect,Microsoft India Pvt Ltd,2025-09-14,Japan,5-8 Years,"ai & machine learning, python development, azure platform expertise, agentic ai frameworks, ci/cd & mlops practices, devops, github, solution architect, kernel, javascript, node.js, consultant, .net"
Data & AI - Intern,Guardian,2025-09-14,Gurgaon,0-1 Years,"data analytics, data wrangling, python programming, machine learning, data visualization, data mining, bi, data science, use cases, data analysis, tableau"
AI Product Engineer,Pfizer,2025-09-14,Chennai,8-11 Years,"machine learning expertise, natural language processing, generative ai solutions, digital assistant development, performance testing, software development life cycle, ui, lex, agile"
Senior AI Engineer,Bajaj Finserv Lending Ltd,2025-09-14,Pune,2-8 Years,"speech ai expertise, llm optimization techniques, emotion detection systems, edge ai deployment, algorithms, orchestration, security, natural language processing, machine learning, biometrics"
Software Architect - AI Specialist,"cvent india pvt ltd,",2025-09-14,Canada,10-13 Years,"ai solutions design, software development, large language models, technical oversight, stakeholder management, algorithms, artificial intelligence, java, data structures"
Program Manager - AI,OpenText,2025-09-14,Bengaluru,10-13 Years,"ai fundamentals, project management, problem solving, collaboration techniques, program management, pmo, resource allocation, project manager, program manager, information management, professional services"
Senior AI Engineer,Bajaj Finserv Lending Ltd,2025-09-14,Pune,2-8 Years,"ai model optimization, speech technology r&d, conversational intelligence, voice biometrics security, emotion detection techniques, algorithms, orchestration, python, natural language processing, machine learning"
PSSM Generative AI Practitioner,Pfizer,2025-09-14,Chennai,9-12 Years,"drug formulation development, pharmaceutical stability analysis, experimental design techniques, data analysis proficiency, regulatory submission expertise, critical analysis, thermodynamics, chemical engineering, ideas, aspen, planning, technical expert, amp, product development"
Lead AI Developer,OpenText,2025-09-14,Bengaluru,7-10 Years,"application security, machine learning, software development, java programming, deep learning, artificial intelligence, devops, software engineer, big data, python, information management, natural language processing"
AI Integration Engineer,AT&T,2025-09-14,Hyderabad,5-8 Years,"python development, api integration, jupyter notebooks, log management, version control, orchestration, data warehousing, docker, security, git, devops, debugging, github, cloud services, natural language processing, machine learning"
Senior AI Engineer,Bajaj Finserv Lending Ltd,2025-09-14,Pune,2-8 Years,"voice ai solutions, llm/slm optimization, conversational intelligence, speech technologies, emotion detection models, algorithms, orchestration, security, python, natural language processing, machine learning, biometrics"
Senior AI Engineer,Bajaj Finserv Lending Ltd,2025-09-14,Pune,2-8 Years,"speech ai technologies, model optimization techniques, llm/slm proficiency, emotion modeling, python programming, algorithms, orchestration, security, natural language processing, machine learning, biometrics"
"Principal Architect, AI Networking",Nvidia Graphics Pvt Ltd,2025-09-13,Canada,12-15 Years,"ai workload understanding, machine learning proficiency, c/c software development, networking technologies research, fundamentals, storage, cache, computer graphics, infrastructure"
"Engineering Manager, AI Innovation and Research, AI/ML",Google India Pvt Ltd,2025-09-13,Bengaluru,8-11 Years,"machine learning design, infrastructure optimization, model deployment, team leadership, recommendation systems, job posting, recruitment, workforce, decision making"
Forward Deployed AI Engineer,Adobe Systems Ltd,2025-09-13,France,3-5 Years,"full stack development, ai technologies proficiency, ci/cd pipeline expertise, customer centric mindset, orchestration, aem, storage, docker, react.js, java, iam, devops, xml, html, vms, rest, github, javascript, spring boot, node.js, technical consultant"
"Manager, AI Support",Google India Pvt Ltd,2025-09-13,Bengaluru,10-13 Years,"team management, ai/ml expertise, stakeholder influence, problem solving, job posting, recruitment, workforce, decision making"
AI Engagement Manager,Adobe Systems Ltd,2025-09-13,Australia,4-10 Years,"ai engagement strategies, digital transformation leadership, customer centric approach, agile software development, data integration expertise, sharepoint, devops, engagement manager, director"
Cloud Engineer AI,Google India Pvt Ltd,2025-09-13,Bengaluru,1-5 Years,"machine learning solutions, python programming, data analysis techniques, technical customer support, data structures, big data, algorithms, scala, software design, data warehousing, storage, infrastructure"
"Software Engineer, AI Foundations",Google India Pvt Ltd,2025-09-13,Taiwan,2-3 Years,"model evaluation methodologies, data analysis techniques, algorithm implementation, cross functional collaboration, algorithms, storage, artificial intelligence, security, software engineer, natural language processing, information retrieval, mobile"
AI Content Expert,AMAZON INDIA PVT LTD,2025-09-12,Chennai,2-5 Years,"content generation, data analysis, quality checks, judgment decisions, tool improvement"
AI Content Expert,AMAZON INDIA PVT LTD,2025-09-12,Chennai,2-5 Years,"data annotation, content generation, quality assurance, critical thinking, problem solving"
Gen AI Platform Engineer,Thoucentric,2025-09-12,Singapore,5-8 Years,"api development, llm integration, data security, restful services, azure services, orchestration, devops, cloud services, enterprise security"
AI Content Expert,AMAZON INDIA PVT LTD,2025-09-12,Chennai,1-5 Years,"content creation, data annotation, quality assurance, problem solving, technical writing"
AI Specialist,headhunters inc,2025-09-12,Bengaluru,5-8 Years,"artificial intelligence, machine learning, neural networks, ml ops, data modeling, python, natural language processing"
AI Content Expert,AMAZON INDIA PVT LTD,2025-09-12,Chennai,2-5 Years,"data annotation, content generation, quality checks, logical decision making, tool improvement"
"Technology Practice Lead, AI",Google India Pvt Ltd,2025-09-11,Singapore,10-13 Years,"ai solutions adoption, cloud architecture expertise, stakeholder engagement, data analytics proficiency, cross functional collaboration, job posting, recruitment, workforce, decision making"
"Software Engineer, AI Foundations",Google India Pvt Ltd,2025-09-11,Taiwan,2-5 Years,"mobile algorithms design, ai/ml product evaluation, data analysis techniques, performance optimization, storage, artificial intelligence, security, software engineer, natural language processing, information retrieval, android development, infrastructure"
"Manager, AI Support",Google India Pvt Ltd,2025-09-11,Bengaluru,10-13 Years,"team management, ai/ml expertise, stakeholder influence, problem solving, job posting, recruitment, workforce, decision making"
"Technology Practice Lead, AI",Google India Pvt Ltd,2025-09-11,Singapore,10-13 Years,"ai solutions adoption, cloud architecture expertise, stakeholder engagement, data analytics proficiency, cross functional collaboration, job posting, recruitment, workforce, decision making"
"Engineering Manager, AI Innovation and Research, AI/ML",Google India Pvt Ltd,2025-09-11,Bengaluru,8-11 Years,"technical leadership, machine learning, model deployment, team management, stakeholder influence, job posting, recruitment, workforce, decision making"
AI Engineers,Dignitas Digital,2025-09-11,Delhi,0-1 Years,"ai/ml concepts, python programming, deep learning frameworks, algorithms understanding, rest apis exposure, rdbms, nosql"
"AI Recruiter, Google Cloud AI",Google India Pvt Ltd,2025-09-11,San,5-8 Years,"recruitment strategies, client relationship management, negotiation expertise, hr, job posting, workforce, immigration, employer branding, compensation, interview"
AI Safety Data Scientist,Google India Pvt Ltd,2025-09-11,Bengaluru,5-8 Years,"data analysis techniques, machine learning proficiency, programming languages expertise, statistical methods application, c, sql, database, security, python"
"Engineering Manager, AI Innovation and Research, AI/ML",Google India Pvt Ltd,2025-09-11,Bengaluru,8-11 Years,"technical leadership, machine learning, model deployment, team management, stakeholder influence, job posting, recruitment, workforce, decision making"
AI Content Expert,AMAZON INDIA PVT LTD,2025-09-10,Chennai,1-3 Years,"content generation, data annotation, quality audits, detail orientation, tool improvement"
"Engineering Manager, AI Innovation and Research, AI/ML",Google India Pvt Ltd,2025-09-10,Bengaluru,8-11 Years,"ai/ml leadership, model deployment, recommendation systems, technical mentorship, data processing, job posting, recruitment, workforce, decision making"
AI Next-gen Enthusiast,klizos solutions pvt ltd,2025-09-10,Kolkata,2-3 Years,"generative ai expertise, ai tool familiarity, artificial intelligence, python, machine learning"
AI Safety Data Scientist,Google India Pvt Ltd,2025-09-10,Bengaluru,5-8 Years,"data analysis techniques, machine learning application, project management, programming proficiency, statistical methods, c, sql, database, security, python"
AI Content Expert,AMAZON INDIA PVT LTD,2025-09-10,Chennai,1-3 Years,"data annotation, content generation, quality auditing, data analysis, tool improvement"
"Software Engineer, AI/ML, AI Innovation and Research",Google India Pvt Ltd,2025-09-10,Bengaluru,2-3 Years,"software development, machine learning, data analysis, model optimization, reinforcement learning, algorithms, storage, artificial intelligence, security, system development, debugging, software engineer, software engineering, data structures, natural language processing"
Senior Researcher  Multimodal AI  Microsoft Research AI Frontiers,Microsoft India Pvt Ltd,2025-09-10,Redmond,2-5 Years,"generative ai, multimodal models, computer vision, research publications, ideas, safety, cutting, action"
