Title,Company,Posted on,Location,Experience,Skills
Career Opportunities: Java Architect (45567),Incedo Inc,2025-10-06,Mexico,5-10 Years,"java programming, spring framework, database management, agile methodologies, code review, hibernate, sql, postgresql, program manager, telecom, mysql, oracle, nosql"
Career Opportunities: Java Tech Lead (45278),Incedo Inc,2025-10-06,Mexico,8-10 Years,"fullstack development, java/python/javascript proficiency, front end technologies, back end frameworks, team leadership, css, program manager, telecom, html, spring boot, node.js"
Career Opportunities: Java Developer (45288),Incedo Inc,2025-10-06,Mexico,5-10 Years,"data science, digital transformation, engineering expertise, problem solving, technology services, consulting, domain expert, program manager, telecom"
Career Opportunities: Java Developer (45586),Incedo Inc,2025-10-06,Mexico,3-5 Years,"java programming, spring framework, hibernate framework, sql/nosql databases, agile methodologies, postgresql, program manager, telecom, software engineer, mysql, oracle"
JAVA Back end Developer,CGI Information Systems and Management Consultants Pvt Ltd,2025-10-06,Chennai,6-10 Years,"java development, spring boot framework, cloud computing, database management, api development, python, cgi, sql, security"
JAVA Back end Developer,CGI Information Systems and Management Consultants Pvt Ltd,2025-10-06,Chennai,6-10 Years,"java development, spring boot framework, cloud computing, database management, api development, python, cgi, sql, security"
Hiring For JAVA   REACT FULLSTACK,krazy mantra hr solutions,2025-10-05,Bengaluru,3-8 Years,"java, angular, react, core java, spring boot, rest, css, javascript, multimedia, git, management systems, mysql, html, middleware"
Java Developer,Headhuntersinc consultancy Private Limited,2025-10-05,Chennai,6-10 Years,"gwt, senior software engineer, ajax, java developer, java, j2ee, sql database"
Hiring For Full stack Java Enterprise,krazy mantra hr solutions,2025-10-05,Hyderabad,2-8 Years,"java full stack, front end build, struts framework, hibernate, restful web services, spring framework, spring boot, spring mvc, sql"
Java developer,Headhuntersinc consultancy Private Limited,2025-10-05,Chennai,3-6 Years,"rest, jsp, telecom domain, hibernate, javascript, spring, database, java, json, j2ee architecture, soap"
Career Opportunities: Java Tech Lead (45612),Incedo Inc,2025-10-05,Mexico,11-12 Years,"java programming spring framework hibernate framework sql databases restful apis, postgresql, program manager, telecom, mysql, oracle, nosql"
Senior Java Software Engineer,vcarve rcm private limited,2025-10-05,United,0-3 Years,"websphere, sybase, oracle, mq, windows, j2ee, unix"
Hiring For Java Full Stack,krazy mantra hr solutions,2025-10-05,Bengaluru,2-5 Years,"object oriented design, java and spring framework, javascript, html and css, mysql, mongodb and kafka, docker"
Career Opportunities: Java Tech Lead (45278),Incedo Inc,2025-10-05,Mexico,8-10 Years,"fullstack development, front end technologies, back end technologies, team leadership, code review, css, java, program manager, telecom, html, python, javascript, spring boot, node.js"
Hiring For JAVA with React JS,krazy mantra hr solutions,2025-10-05,Chennai,1-4 Years,"java, springboot, react, microservices, mongodb, rest, git"
Career Opportunities: Java Architect (45567),Incedo Inc,2025-10-05,Mexico,5-10 Years,"java programming, spring framework, hibernate framework, sql & nosql, agile methodologies, postgresql, program manager, telecom, mysql, oracle"
Java Software Developer,vcarve rcm private limited,2025-10-05,United,1-3 Years,"websphere, css, jsp, jdbc, hibernate, sql, spring, database, java, spring mvc, uml, j2ee, json, html, jpa, pl/sql, ejb, rest, oracle, maven, weblogic, mvc architecture, triggers, javascript, eclipse, struts, servlets, software developer, forms"
Hiring For JAVA -Angular Engineer,krazy mantra hr solutions,2025-10-05,Bengaluru,4-6 Years,"java, javascript, angularjs, spring, hibernate, rest, spring framework, spring boot, jpa, api, java web services"
Staff Software Engineer I (Java),blue yonder,2025-10-05,Hyderabad,10-13 Years,"software development, automated testing, microservices architecture, cloud computing, devops practices, c, rest api, java, j2ee, web development, software engineering, mvc architecture, nosql, struts, unix, hibernate, database, git, linux, debugging, portal server, json, rdbms, problem solving, windows"
Java Backend Developer,indifi technologies pvt ltd,2025-10-05,Gurgaon,4-7 Years,"rest, rdbms, software design, spring, spring boot, elastic search, advanced java, java, postgresql, system development, linux, mysql, cloud computing, mongodb"
Java Developer,Headhuntersinc consultancy Private Limited,2025-10-05,Chennai,3-7 Years,"mobile, team player, java developer, spring boot, security, java, spring mvc, soap web services"
Hiring For Java   API Automation,krazy mantra hr solutions,2025-10-05,Bengaluru,2-5 Years,"java programming, api test automation, rest assured, cucumber bdd, selenium, sql, nosql, git"
Hiring For Java   API Automation,krazy mantra hr solutions,2025-10-05,Bengaluru,2-5 Years,"java programming, api test automation, rest assured, cucumber bdd, selenium, sql, nosql, git"
Career Opportunities: Java Developer (45586),Incedo Inc,2025-10-05,Mexico,3-5 Years,"java programming, spring framework, hibernate framework, sql databases, restful apis, postgresql, program manager, telecom, software engineer, mysql, oracle, nosql"
Career Opportunities: Java Developer (45288),Incedo Inc,2025-10-05,Mexico,3-5 Years,"data science expertise, digital transformation, client engagement, consulting, domain expert, program manager, telecom"
Senior Software Developer (Java Backend),NASDAQ,2025-10-05,Bengaluru,7-10 Years,"java development, sql & nosql, cloud solutions, agile methodologies, git, senior software developer, devops, system development, perl, maven, messaging, gradle, spring boot, unix"
Hiring For Java   React JS,krazy mantra hr solutions,2025-10-05,Chennai,6-10 Years,"java react js, spring boot & spark, microservices and osgi, soa & microservices, aws, gwt, jee, hibernate framework, wicket, nosql, spring framework, spring mvc, debugging, jsf, jse"
Senior Java Developer Job Details | ArisGlobal,ArisGlobal LLC,2025-10-05,China,8-12 Years,"java technology expertise, microservices development, sql and nosql proficiency, css, rest api, senior software engineer, artificial intelligence, spring, j2ee, html, javascript, java developer, hibernate, mockito, database, json, jpa, junit"
Career Opportunities: Java Tech Lead (45660),Incedo Inc,2025-10-05,Mexico,8-10 Years,"fullstack development, team leadership, code review, ci/cd pipelines, secure coding practices, css, java, program manager, telecom, html, python, javascript, spring boot, node.js"
Hiring For JAVA FULLSTACK,krazy mantra hr solutions,2025-10-05,Chennai,4-7 Years,"angular6, react, core java, spring boot, mysql, css, rest api, html, javascript"
Java developer,Headhuntersinc consultancy Private Limited,2025-10-05,Chennai,0-3 Years,"spring, rest, java, mobile, telecom, soap, java developer"
Hiring For JAVA FULLSTACK,krazy mantra hr solutions,2025-10-05,Chennai,8-11 Years,"angular6, react, core java, spring boot, mysql, sql queries, html, css, javascript, rest api"
Hiring For Java Architect,krazy mantra hr solutions,2025-10-05,Chennai,5-10 Years,"core java, kafka, reactjs/angular js, graphql, javascript/html, mongodb"
Hiring For JAVA fullstack,krazy mantra hr solutions,2025-10-05,Chennai,0-3 Years,"angular 12, microservices & cloud infrastructure, typescript, angular material, high charts, ag grid, google api components, npm, webpacks, html, css, java"
Senior Java Developer,vcarve rcm private limited,2025-10-05,United,1-3 Years,"rest, html5, jsp, java beans, hibernate, java developer, spring, java, struts, j2ee, jpa, angularjs"
Java Full Stack Developer,SYNECHRON,2025-10-05,Mumbai,5-7 Years,"java development, angular development, automated testing, cloud migration, software design, css, bug fixing, software requirements, artificial intelligence, database application, html, mobile, team player, javascript, infrastructure"
Hiring For JAVA FULLSTACK,krazy mantra hr solutions,2025-10-05,Chennai,8-11 Years,"angular6, react, core java, spring boot, mysql, rest api, css, html, javascript"
Senior Software Engineer (Java),Bottomline Technologies,2025-10-05,Bengaluru,4-9 Years,"java, spring/springboot, postgresql, micro services, docker & kubernetes, message broker, senior software engineer, jpa, oracle, mq, maven, problem solving, messaging, production support, spring boot"
Java / Lead Developer,Headhuntersinc consultancy Private Limited,2025-10-05,Chennai,6-9 Years,"html5, jsp, hibernate, java, apache, spring mvc, couchbase, linux, debugging, telecom, j2ee architecture, mysql, mongodb, rest, oracle, javascript, java developer, nosql, spring boot, angularjs, soap, unix"
Java Developer,ITSWS Technologies Pvt. Ltd.,2025-10-05,Noida,1-2 Years,"css, scala, jsp, jdbc, ajax, javascript, jquery, java developer, sql, database, java, servlets, j2ee, mysql, html"
Java Lead Developer,grawlix software private limited pune,2025-10-05,United,11-14 Years,"rest api, docker, spring, security, database, java, devops, j2ee, api, mongodb, mq, maven, nosql, gradle, spring boot, unix"
Java Developer,Headhuntersinc consultancy Private Limited,2025-10-05,Chennai,6-9 Years,"oracle pl/sql, jsp, hibernate, ajax, jquery, sql, spring, java, senior software developer, oops, j2ee, debugging, mysql, mvc, oracle, struts, software developer, ioc, j2ee technologies"
Hiring For JAVA FULLSTACK,krazy mantra hr solutions,2025-10-05,Chennai,4-7 Years,"angular, react, core java, spring boot, mysql, css, rest api, html, javascript"
Java Developer,origin hr,2025-10-04,Mumbai,5-8 Years,"java development, oracle database, api integrations, agile methodologies, problem solving, pl/sql, java developer"
Java - Azure Cloud Engineer || Chennai,Fiserv India Pvt Ltd,2025-10-04,Chennai,5-8 Years,"java development, azure services, api development, reactjs frontend, cloud integration, orchestration, bi, storage, sql, docker, devops, adf, python, mobile, microsoft azure, java developer, infrastructure, sql database"
Java Fullstack Developer,Team Computers Pvt Ltd,2025-10-04,Bengaluru,2-5 Years,"java development, spring framework, web applications, code quality, team collaboration, spring mvc, jsp, servlets, spring boot"
Career Opportunities: Java Developer (45586),Incedo Inc,2025-10-04,Mexico,3-5 Years,"java programming expertise, hibernate framework familiarity, software development lifecycle, postgresql, program manager, telecom, software engineer, mysql, oracle"
Career Opportunities: Java Developer (45288),Incedo Inc,2025-10-04,Mexico,3-6 Years,"digital transformation, data science expertise, technology services, domain understanding, consulting, domain expert, program manager, telecom"
Binance Accelerator Program - Software Engineer (Java),Binance,2025-10-04,Taiwan,0-1 Years,"java programming, spring framework, microservices architecture, mysql database, problem solving, logical thinking, software engineer, multithreading, middleware"
SENIOR SOFTWARE ENGINEER - JAVA,Caterpillar Inc.,2025-10-04,Slovakia,5-7 Years,"software development lifecycle, agile methodologies, cloud computing (aws/azure), restful api development, sql query writing, senior software engineer, java, devops, software packages, software engineering, html, github, oracle, telematics, testing tools, problem solving, software integration"
Senior Principal Consultant - PLSQL /Java,ORACLE,2025-10-04,Bengaluru,6-10 Years,"oracle sql, pl/sql development, java/jee application, restful webservices, microservices architecture, principal consultant, rest api, sso, plsql, unix shell scripting, devops, j2ee, html, mq, javascript, eclipse, soap, docker, security, git, middleware, junit, weblogic"
Career Opportunities: Java Tech Lead (44163),Incedo Inc,2025-10-04,Mexico,8-10 Years,"java programming, spring framework, hibernate framework, sql/nosql databases, devops practices, postgresql, program manager, telecom, mysql, oracle"
Java Full Stack Developer,ORACLE,2025-10-04,Mumbai,6-10 Years,"java development, spring boot, aws management, python scripting, oracle sql, security, api, pl/sql, big data, cloud services, gateway"
Career Opportunities: Java Architect (45567),Incedo Inc,2025-10-04,Mexico,5-10 Years,"java programming, spring framework, hibernate expertise, sql/nosql databases, agile methodologies, postgresql, program manager, telecom, mysql, oracle"
Senior QA Engineer (Java Coding),Binance,2025-10-04,Singapore,6-9 Years,"software qa automation, backend testing, sql proficiency, root cause analysis, analytical trouble shooting, test cases, software quality, functional testing, security, java, writing, mobile applications, test scenarios, qa engineer, logical thinking"
Dveloppeur Java Full-Stack Sr,CGI Information Systems and Management Consultants Pvt Ltd,2025-10-04,Canada,5-10 Years,"java development, fullstack expertise, problem solving, team collaboration, continuous learning, cgi"
Career Opportunities: Java Backend Developer (45467),Incedo Inc,2025-10-04,Mexico,4-6 Years,"server side programming, scalable systems development, database technologies, senior software engineer, sql, java, program manager, telecom, mongodb, python, ruby, nosql"
Staff Software Engineer I (Java),blue yonder,2025-10-04,Hyderabad,10-13 Years,"software development, java expertise, microservices architecture, cloud computing, devops practices, c, rest api, j2ee, web development, software engineering, mvc architecture, nosql, struts, unix, hibernate, database, git, linux, debugging, portal server, json, rdbms, problem solving, windows"
Jr.Java Developer,Faichi Solutions,2025-10-03,Pune,4-6 Years,"junior developer, jdbc, team player, hibernate, javascript, java developer, spring, java, web technologies, j2ee, api"
Career Opportunities: Java Architect (45567),Incedo Inc,2025-10-03,Mexico,5-10 Years,"java programming, spring framework, hibernate framework, database management, agile methodologies, sql, postgresql, program manager, telecom, mysql, oracle, nosql"
Java Developer fresher,Tech Narayana,2025-10-03,Bengaluru,2-7 Years,"spring, java, oracle, hybris, j2ee, hibernate, javascript, jquery, sql"
Core Java Developer,LAKSH HUMAN RESOURCE,2025-10-03,Pune,5-8 Years,"hibernate, java developer, spring, database, swing, java, bw, crm"
Java Fresher Required,CONCOURSE SOLUTIONS PRIVATE LIMITED,2025-10-03,Nagpur,0-3 Years,"oracle, jsp, hibernate, ajax, jquery, java developer, spring, java, ooad, oops, j2ee, mysql, pl/sql"
Junior Java Developer,Papasiddhi,2025-10-03,Udaipur,2-5 Years,"c, python, c, information technology, cgi, business rules, team player, java developer, java, xml, j2ee"
Senior Java Developer,Tech Narayana,2025-10-03,Bengaluru,2-7 Years,"spring, java, oracle, hybris, j2ee, hibernate, javascript, jquery, sql"
Career Opportunities: Java Tech Lead (45660),Incedo Inc,2025-10-03,Mexico,8-10 Years,"fullstack development, team leadership, code review processes, ci/cd pipelines, secure coding practices, css, java, program manager, telecom, html, python, javascript, spring boot, node.js"
Java Technical Lead,Ideapoke,2025-10-03,Bengaluru,6-9 Years,"algorithms, hibernate framework, sql, spring, java, postgresql, j2ee, data structures, mysql, web development, rest, cassandra, openstack, soap, sql database"
Team Lead  JAVA,ShepHertz Technologies,2025-10-03,United,4-5 Years,"jee, jquery, database, java, spring mvc, oops, j2ee, debugging, multithreading, html, mysql, grails, nosql, cassandra, struts"
Java Developer,Team Computers Pvt Ltd,2025-10-03,Mumbai,0-3 Years,"gwt, jee, hibernate, java developer, sql, wicket, spring framework, memory management, java, spring mvc, java ee, jsf"
Hiring For Java OTN/ NMS EMS,krazy mantra hr solutions,2025-10-03,Chennai,1-3 Years,"core java development, spring boot framework, network management systems, linux operating system, nms, fcaps"
Career Opportunities: Java Tech Lead (45278),Incedo Inc,2025-10-03,Mexico,8-10 Years,"front end development, back end development, programming languages, code review practices, team leadership, css, java, program manager, telecom, html, python, javascript, spring boot, node.js"
Career Opportunities: Java Developer (45288),Incedo Inc,2025-10-03,Mexico,3-5 Years,"data science expertise, digital transformation, engineering proficiency, client engagement, consulting, domain expert, program manager, telecom"
Tech Lead - Java,OMNIE SOLUTIONS INDIA PVT. LTD.,2025-10-03,Noida,7-10 Years,"jsp, jdbc, bootstrap, sql, java, git, xml, rest, oracle, weblogic, team player, problem solving, application support, it strategy, j2ee technologies, java web services, soap"
Java Trainee Required,CONCOURSE SOLUTIONS PRIVATE LIMITED,2025-10-03,Delhi,0-3 Years,"sql, data quality, data extraction, java, data"
Java Developer,NUWARE SYSTEMS PVT LTD,2025-10-03,Bengaluru,5-8 Years,"java development, gwt framework, mvc architecture, mysql, hibernate orm, aws, java developer, senior software developer"
Senior Software Developer - Java,E-QL Business Solutions,2025-10-03,Pune,2-5 Years,"birt, itext, jasper reports, wicket, database, java, apache, postgresql, j2ee, jsf"
Java Developer,MindWorx Software Services,2025-10-03,Pune,2-5 Years,"css, hibernate, jquery, sql, spring boot, database, java, spring mvc, j2ee, html, api, angularjs"
Principal Software Engineer ( Java Architect),blue yonder,2025-10-03,Dallas,12-15 Years,"cloud native architecture, microservices design, event driven systems, api management, devops practices, rest api, java, nosql, hibernate, docker, git, software engineer, enterprise java, rdbms, gradle, spring boot, identity management, infrastructure, gateway"
Career Opportunities: Java Developer (45586),Incedo Inc,2025-10-03,Mexico,3-5 Years,"java programming, spring framework, hibernate framework, sql databases, restful apis, postgresql, program manager, telecom, software engineer, mysql, oracle, nosql"
Senior Software Engineer - Java (Gurgaon),"cvent india pvt ltd,",2025-10-03,Gurgaon,4-7 Years,"javascript programming, html/css development, ui/ux design, agile methodologies, code optimization, html5, react.js, json, oojs, problem solving"
Java  Angular Full stack,SYNECHRON,2025-10-03,Mumbai,7-12 Years,"angular development, state management, restful api integration, full stack development, java/jee expertise, artificial intelligence, spring, xml, j2ee, sybase, javascript, hibernate, xpath, git, mobile, spring boot, j2ee technologies"
Java Developer,LAKSH HUMAN RESOURCE,2025-10-03,Pune,3-6 Years,"c, bootstrap, technology, java developer, spring, java, oops, j2ee, angularjs"
Java Developer,Mtree Software,2025-10-03,Delhi,2-4 Years,"rest, hibernate, spring, node.js, database, java, django, struts, j2ee, mysql, mongodb"
Senior Backend Developer - Java,ULTISOURCE Pvt Ltd.,2025-10-03,Hyderabad,0-3 Years,"sql, security, java, git, json, debugging, html, rest, problem solving, team player, javascript, node.js, web technologies, angularjs"
Java Lead,Magic Finserv,2025-10-03,United,8-10 Years,"css, mq, svn, spring, java, git, oops, j2ee, web api, html"
Java Developer,DXC Technologies,2025-10-03,Noida,5-10 Years,"java development, sql database management, agile methodologies, rest api development, software architecture design, websphere, hibernate, spring, git, unix shell scripting, xml, j2ee, json, mongodb, oracle, rdbms, eclipse, struts, soap"
Java Developer,origin hr,2025-10-03,Mumbai,5-8 Years,"java development, pl/sql proficiency, api integrations, agile methodologies, problem solving, oracle, java developer"
Java Developer,ShepHertz Technologies,2025-10-03,United,3-4 Years,"css, jee, jquery, database, spring mvc, oops, j2ee, debugging, multithreading, html, mysql, oracle, rdbms, grails, nosql, struts"
Java Trainer,ANR SOFTWARE PVT LTD,2025-10-03,Noida,2-5 Years,"css, maven, svn, team player, eclipse, advanced java, database, java, jpa, html"
Java Experienced Required,CONCOURSE SOLUTIONS PRIVATE LIMITED,2025-10-03,Nagpur,0-4 Years,"database, java, oops, multithreading, java developer"
Java Developer,Faichi Solutions,2025-10-03,Pune,8-10 Years,"junior developer, jdbc, team player, hibernate, javascript, java developer, spring, java, web technologies, j2ee, api"
Java Backend Developer,CGI Information Systems and Management Consultants Pvt Ltd,2025-10-03,Colombia,8-11 Years,"java development, web services integration, database management, object oriented design, version control systems, cgi, sql, docker, git, postgresql, devops, soap web services, debugging, software engineering, mysql, oracle, java developer, jdk"
Sr. Java Back end Developer,LAKSH HUMAN RESOURCE,2025-10-03,Pune,3-6 Years,"fundamentals, security compliance, css, html5, scala, hosting, hibernate, ajax, jquery, spring, database, java, git, xml, oops, json, jpa, mvc, rest, rdbms, mobile, mvc architecture, grails, javascript, nosql, environment, struts, vs"
Java Developer,Gauge Data Solutions,2025-10-03,Noida,1-3 Years,"rdbms, jsp, lucene, team player, hibernate, java developer, nosql, database, java, spring mvc, j2ee, mysql"
Software Engineer III - Java,Policygenius,2025-10-02,Hyderabad,5-10 Years,"backend technologies, java programming, agile methodologies, technical documentation, team collaboration, soa, jee, spring, system analysis, dao, apache, camel, devops, j2ee, object oriented programming, maven, docker, git, oops, rest, ant, spring boot"
Sr. Java/Python Developer,FISERV,2025-10-02,Noida,5-9 Years,"full stack development, python proficiency, sql expertise, front end technologies, agile methodologies, java, defect management, jira, testing, software test, test case design, test data, security, test strategy, jenkins, test planning, debugging, mobile"
SENIOR SOFTWARE ENGINEER-JAVA,Caterpillar Inc.,2025-10-02,Chennai,5-10 Years,"java development, cloud technologies, web services, object oriented design, agile methodologies, authoring, ajax, spring, j2ee, cli, maven, software project, java developer, eclipse, jdbc, hibernate, sql, security, git, iam, json, debugging, jpa, mvc, rest, junit, infrastructure, j2ee technologies"
Career Opportunities: Java Developer (45288),Incedo Inc,2025-10-02,Mexico,5-10 Years,"digital transformation, data science expertise, technical architecture, business impact maximization, consulting, domain expert, program manager"
JAVA TECH LEAD,Apexon,2025-10-02,Bengaluru,5-10 Years,"java springboot development, angular application development, microservices architecture, integration solutions design, performance optimization techniques, hosting, devops, api, rest, mobile, infrastructure, soap"
Career Opportunities: Java Developer (45586),Incedo Inc,2025-10-02,Mexico,3-5 Years,"java programming, spring framework, hibernate framework, database management, agile methodologies, sql, postgresql, program manager, telecom, software engineer, mysql, oracle, nosql"
Career Opportunities: Java Architect (45567),Incedo Inc,2025-10-02,Mexico,6-9 Years,"java programming, spring framework, hibernate framework, sql and nosql, agile methodologies, postgresql, program manager, telecom, mysql, oracle"
Hiring For Java Architect,krazy mantra hr solutions,2025-10-01,Bengaluru,5-10 Years,"hive, rest, database, apache, hadoop"
QA - Java and Selenium,mindera,2025-10-01,Chennai,2-5 Years,"java programming, selenium webdriver, test automation, agile development, software testing, san, qa engineer, manual testing, test case management, mobile, software engineering"
Hiring For Java cloud,krazy mantra hr solutions,2025-10-01,Chennai,3-5 Years,"java development, spring boot, kafka messaging, kotlin programming, mongodb databases"
Sr. Software Engineer (Java/Go Looker),Uniphore Software Systems,2025-10-01,Chennai,4-10 Years,"software development, java spring boot, rest apis, agile methodology, microservices architecture, algorithms, hibernate, sql, apache, linux, j2ee, data structures, mongodb, python, struts, database development"
Technical Lead -Java Full stack developer,UNIVERSAL ELECTRONICS,2025-10-01,Bengaluru,7-10 Years,"aws cloud development, full stack development, java programming, restful api architecture, ci/cd tools, intellij, storage, software requirements, sql, security, linux, debugging, mysql, shell scripting, mobile, windows, bluetooth"
senior java developer,Randstad MENA,2025-10-01,Hyderabad,5-7 Years,"java development, spring boot, microservice architecture, restful apis, cloud services, machine learning, git"
Hiring For Java full stack developer,krazy mantra hr solutions,2025-10-01,Chennai,1-9 Years,"fullstack java enterprise, core java (java), spring core, junit test cases, restful web services, jdbc, jpa, hibernate"
Hiring For Java OTN Developer,krazy mantra hr solutions,2025-10-01,Bengaluru,1-5 Years,"core java, spring boot, network management, optical testing, otn configuration, nms, network management system, linux, telecom, fcaps"
"Technical Consultant (WMS, Java, PLSQL)",blue yonder,2025-10-01,Bengaluru,5-9 Years,"wms solutions design, software development, global team collaboration, architecture artifacts creation, customer engagement"
Senior Software Engineer - Java FullStack,Merck Ltd,2025-10-01,Bengaluru,5-9 Years,"react development, rest services, microservices architecture, automation frameworks, agile methodologies, css, senior software engineer, sql, spring, java, devops, software engineering, html, big data, github, oracle, javascript, spring boot, web technologies"
Hiring For Java Production Support,krazy mantra hr solutions,2025-10-01,Chennai,1-3 Years,"java full stack, spring boot, angular development, restful services, test driven development, junit, oracle, bootstrap, production support, git, html"
Java/Python Developer,origin hr,2025-10-01,Mumbai,4-7 Years,"java development, python programming, oop concepts, web applications, oops, j2ee"
