Title,Company,Posted on,Location,Experience,Skills
Senior Database Administrator SQL Server,BAKER HUGHES,2025-08-24,Gurgaon,7-8 Years,"sql server administration, performance tuning, cloud devops automation, t sql scripting, data security management, disaster recovery, dba, database security, ssms, query optimization, senior database administrator, performance monitoring, sql server dba, replication, sql database"
"Java Developer - Spring boot, Microservices, Oracle SQL",SYNECHRON,2025-08-25,Pune,6-9 Years,"java programming, spring boot, microservices architecture, oracle sql, restful apis, information technology, database, git, java developer"
Product Analyst/Business Analyst - SQL/Power BI/Power Query -,crescendo global,2025-08-01,Bengaluru,2-7 Years,"sql proficiency, power bi expertise, business requirements analysis, stakeholder engagement, kpi monitoring, business analyst, use cases, brd, product analyst, frs, gap analysis, business analysis, user training"
Dot Net Developer,SAFFRON TECH PVT.LTD,2025-09-04,United,6-8 Years,"mobile, mvc, sql"
Microsoft.Net Azure Developer,BUSISOL SOURCING INDIA PVT. LTD,2025-09-07,Mumbai,2-7 Years,"c#, entity framework, microsoft.net, storage, nosql, sql, linq, sql azure, asp.net, .net"
Senior Oracle PL SQL Developer,DXC Technologies,2025-08-25,Chennai,10-13 Years,"database management, security, oracle sql developer, triggers, oracle pl sql developer"
"Sr. SW Test Engineer (3 - 6 years of experience in ORMB Testing, Functional Testing, SQL)",Visa Inc.,2025-09-08,Bengaluru,5-10 Years,"oracle revenue management, qa methodologies, automation testing, problem solving, cross functional collaboration, performance testing, software testing, qa engineer, test cases, software quality, oracle applications, testing tools"
SDE Executive,avenues payments india pvt. ltd,2025-09-20,Bengaluru,6-9 Years,"fundamentals, algorithms, sql, oops, data structures, software engineering, rdbms, problem solving, web technologies, unix / linux, sql database"
Binance Accelerator Program - Risk Operations Specialist (SQL),Binance,2025-08-29,Taiwan,0-1 Years,"risk assessment, sql proficiency, data monitoring, trend analysis, decision making, reports, loss, reporting, accounts"
Software Engineer - Bigdata (Java/Scala and SQL),NIELSEN,2025-08-26,Bengaluru,3-5 Years,"cloud implementation, software development, big data processing, agile methodologies, automation tools, orchestration, java, apache, devops, shell scripting, mysql, python, messaging, unix/linux, software developer, scala, storage, security, postgresql, json"
"Service Delivery Analyst II (Java Application Support, SQL, Oracle)- 3-5years Exp- Indore- Rotational Shift",Worldpay,2025-09-22,Indore,2-3 Years,"relational database design, operational unix commands, sql server management, object oriented programming, software development lifecycle, security, java, oracle"
".Net Fullstack Developer (.NET, C#, Sql, AWS, Angular & WebAPI)",CARRIER,2025-09-23,Hyderabad,6-11 Years,"cloud application development .net framework expertise aws solutions design agile development methodologies microservices architecture, software engineering, c#, cache, oracle, messaging, microsoft technologies, sql, elastic search, database, git, debugging, mobile"
Sr. QA Business Systems,Vaal Triangle Systems,2025-09-19,Pune,2-4 Years,"test case execution, test cases, test scripts, sql, writing, sql queries, testing, stlc, sdlc"
Developer,SEVEN CONSULTANCY,2025-08-25,Panjim,5-8 Years,"oracle sql developer, oracle bi, pl/sql, sql"
"Lead Software Engineer (C  , C#, MFC, SQL, and OOPS) job in Bangalore, Karnataka, India | Engineering jobs at Danaher",DANAHER CORPORATION,2025-08-31,Bengaluru,8-12 Years,"software development, c programming, unit testing, problem solving, sql, devops, oops, debugging, software engineer, software engineering, c#, cloud services, mfc, windows, visual studio"
Senior Production Software Engineer,ORACLE,2025-09-23,Kolkata,3-5 Years,"sql & database programming, database design & optimization, t sql expertise, performance tuning, etl & data warehouse, t-sql, devops, ssrs, oracle, triggers, business objects, reporting tools, debugging, software engineer, infrastructure"
"Sr SQL Developer - SSIS,SSRS - 5  Years - Bangalore job in",crescendo global,2025-09-20,Bengaluru,5-6 Years,"sql server management, etl workflow design, data modeling techniques, ssis/ssrs/ssas expertise, agile development practices, bi, data warehousing, business intelligence, etl developer, data transformation, data quality, data integration"
"Infogain looking for BI Reports Developer (Senior), Bangalore, India 6-8 Years Experience in BI & Visualization Develop",Infogain Corporation,2025-09-21,Bengaluru,6-8 Years,"high performance sql, sql performance tuning, power bi, azure sql, data modeling, visualization, business requirements, dashboards, software engineering, telecom, cpg, functional specifications, business objects"
".NET Full Stack Developer - .NET Core, MVC, Angular, and SQL",SYNECHRON,2025-08-25,Bengaluru,7-15 Years,"net core development, mvc framework proficient, angular front end development, sql database management, agile methodologies understanding, .net technologies, software engineering, web api, mysql, c#, gtp, entity framework"
Sr. Data Analyst (Power BI developer ),highrise solutions llp,2025-09-20,Pune,3-4 Years,"power bi, sql, data analysis, excel, mathematics, symfony, ssrs, sql developer, software engineer, mysql, mvc, php"
WCF Developer (.NET),PI TECHNIQUES,2025-09-20,Mumbai,3-6 Years,"c#, fundamentals, algorithms, entity framework, t-sql, microsoft .net, data structures, sql programming"
Senior Software Engineer  ( SQL ),Zenoti,2025-08-25,Hyderabad,4-7 Years,"sql server expertise, microsoft, net development, t sql proficiency, analytical problem solving, agile development practices, t-sql, jquery, microsoft .net, api, crm, c#, python, mobile, windows, infrastructure, angularjs"
"Technical Architect Cloud (Gen AI, Python, SQL)",blue yonder,2025-08-01,Bengaluru,8-11 Years,"ai/ml solutions, cloud computing, nlp technologies, data pipelines, software development, information technology, rest api, bi, artificial intelligence, sql, docker, git, apache, hadoop, big data, lex, python, machine learning, javascript, gateway"
Finance - Technical SQL - Assistant Manager,Paytm,2025-09-23,Noida,6-9 Years,"data analysis, ms excel proficiency, sql expertise, business intelligence, commerce, corporate finance, financing, external audit, business finance"
Senior ETL Developer,codebees technologies private limited,2025-09-19,Hyderabad,5-7 Years,"information technology, data warehousing, t-sql, sql, database, data extraction, ssrs, sql developer, debugging, sql server development"
Consultant - Business Intelligence,Germane Analytics Pvt Ltd,2025-09-21,Bengaluru,0-3 Years,"c, bi, business intelligence, sql, consultant, dwh, etl tool, pl/sql"
Converse Placement Services India Pvt. Ltd.,Converse Placement services,2025-09-21,Chennai,6-9 Years,"oracle retail, technical lead, sql/plsql, retail integration, api development, rest api, java, shell scripting, software engineer, pl/sql, weblogic, infrastructure, oracle sql, software developer"
database Oracle & SQL Developer,SEVEN CONSULTANCY,2025-08-25,Navi,3-5 Years,"sql development, oracle, sql developer, database developer, sql"
"Implementation Engineer- SQL, Networks, VOIP",nec software solutions (india) pvt ltd,2025-09-09,Mumbai,2-5 Years,"sql configuration, network implementation, voip solutions, client liaison, project management, information technology, security, implementation engineer, author, problem solving, infrastructure"
"Senior Software Developer - Java and React/Angular, SQL, API",MASTERCARD,2025-07-25,Pune,5-8 Years,"css, software design, database, security, senior software developer, debugging, html, big data, oracle, javascript, nosql, unix"
Key Skills Requirements: Angular JS / Angular C#.NET SQL Server / MongoDB 2  years to 4 years of experience working in,samskriti business solutions pvt ltd.,2025-09-20,Hyderabad,2-4 Years,"angular js, c#, net, sql server, object oriented javascript, responsive web design, entity framework, svn, ajax, jquery, logical thinking, linq, git, asp.net, html, mvc, c#.net, angularjs, mongodb, oojs"
NOC Engineer,HARMAN INTERNATIONAL,2025-09-22,Pune,1-3 Years,"sql query writing, unix/linux commands, / availability, quick learner, sql queries, agile"
Solution Architect,"o9 Solutions, Inc.",2025-09-20,Netherlands,7-10 Years,"supply chain planning, statistical analysis, optimization techniques, agile methodology, sql database management, t-sql, mysql, sas"
"App Support - Unix,SQL,Shell Scripting -24 /7 Rotational Shifts",FIS,2025-09-20,Bengaluru,3-6 Years,"application support, unix scripting, sql database, incident troubleshooting, docker/kubernetes, websphere, orchestration, sso, security, unix shell scripting, java, xml, camel, j2ee, json, mediation, rest, adapters, mq, production support, esb, infrastructure, service fulfillment, soap"
"Data Engineer,GCP - SQL,Python -5 Years - Gurgaon job in",crescendo global,2025-09-20,Gurgaon,5-8 Years,"data engineering, sql expertise, python programming, gcp proficiency, data pipeline optimization, security"
MS SQL Developer & Administrator (AMEA region),SECURITAS,2025-08-26,Gurgaon,5-7 Years,"sql development, database administration, power bi modelling, azure cloud solutions, data extraction optimization, data architecture, etl, data quality, database servers, ssis, data integration, data warehousing, security, business applications"
"Software Engineer (Full Stack - Java/Python, React JS, SQL, AWS)",autodesk india pvt ltd,2025-08-24,Pune,2-5 Years,"data processing pipelines, distributed systems design, sql proficiency, automation frameworks, cloud infrastructure management, fundamentals, hive, soa, java, git, software engineer, mvc, hadoop, cloud computing, python, consultant, angularjs"
SQL Database Developer_Bangalore/Mumbai Location_Great opportunity to work in Utility Domain_Experience 5-8Years_CTC 13,Angel and Genie,2025-09-12,Mumbai,5-8 Years,"ms sql server, t sql development, database design, performance tuning, ssis management, storage, t-sql, ssrs, software engineer, triggers, sql database"
Azure Cloud DBA (MS SQL),Fulcrum Digital,2025-09-22,Coimbatore,5-8 Years,"sql server administration, t sql scripting, database design, performance tuning, disaster recovery, information technology, bi, t-sql, security, devops, ssrs, debugging, mysql, mongodb, triggers, sql database"
"Senior Data Engineer - (Big Data, Spark, Scala, Java, Python, Cassandra, Elasticserach, AWS, Airflow, RDBMS, SQL)",NIELSEN,2025-08-26,Bengaluru,4-8 Years,"cloud implementation expertise, big data development, software development proficiency, orchestration, information technology, apache, java, devops, software engineering, shell scripting, mysql, python, oracle, messaging, cassandra, unix/linux"
"Data Engineer-Biq Query, SQL-4  Years- Gurgaon job in",crescendo global,2025-09-20,Gurgaon,4-7 Years,"bigquery expertise, sql proficiency, data pipeline design, data quality assurance, leadership hiring, learning, recruitment"
Data Base Administrator,full potential solutions,2025-09-09,United,0-3 Years,"oracle, sybase, rdbms, information technology, dbms, sql server, sql, database design, database, system development"
Database,IVITESSE TECHNOLOGIES PVT LTD,2025-09-20,Pune,5-8 Years,"rdbms, sql, database, mysql, pl/sql"
"Senior Data Engineer - (Data pipelines, Payload design) Java, Apache Beam/Flink, Kafka, and SQL",SYNECHRON,2025-08-25,Bengaluru,7-10 Years,"data streaming pipelines, java programming, apache beam/flink, kafka messaging, sql database management, information technology, api, github, oracle, maven, nosql, docker, postgresql, jdk"
Applications Developer 3,ORACLE,2025-09-23,Hyderabad,5-8 Years,"data manipulation, sql proficiency, etl development, shell scripting, dml, sql/plsql, java, pl/sql, python, oracle, unix/linux, exception handling, storage, implementation engineer, ddl"
"Software Engineer ( Java , Python , SQL , AWS / Oracle)",NIELSEN,2025-08-26,Bengaluru,3-5 Years,"software development, agile methodologies, technical documentation, cloud integration, legacy technology, scala, sql, java, postgresql, devops, shell scripting, mysql, big data, python, oracle, grails, javascript, messaging, struts, unix/linux"
Application Support,PISOFTEK,2025-09-02,Noida,3-5 Years,"application support, html, sql"
Project Manager,MEDICOSA,2025-09-20,Noida,7-12 Years,"python, c, oracle pl/sql, c, lamp, sql, j2me, java, postgresql, debian, shell scripting"
System Analyst,Bajaj Finserv Lending Ltd,2025-09-13,Pune,7-8 Years,"advanced database architecture, sql and pl/sql development, query optimization techniques, azure data factory, data warehousing solutions, system analyst, postgresql, sql developer"
Senior Engineer: Java/J2ee REST SQL Product Development,ORACLE,2025-09-23,Bengaluru,4-7 Years,"software development, java and jee, sql and rdbms, agile/scrum methodology, troubleshooting and debugging, soa, xml, j2ee, software engineering, adf, oracle, mvc architecture, jdeveloper, middleware"
"Senior Solutions Architect, Analytics Customer Excellence(OASE)",ORACLE,2025-09-23,Bengaluru,7-10 Years,"oracle analytics expertise, bi/data warehouse analysis, data modeling techniques, sql and pl/sql proficiency, etl, data profiling, data quality, odi, oracle sql, data integration"
Business Analyst  Capital Markets | SQL   Agile 5  Yrs Bangalore &,crescendo global,2025-09-21,Coimbatore,5-8 Years,"sql database management, data analysis techniques, agile methodologies, xml, python, sybase, unix, bi, xsd, fx, sas, problem solving, production support"
Senior SQL Server (SSIS/SSRS) Support Engineer,DXC Technologies,2025-08-28,Chennai,2-5 Years,"sql server expertise, ssis package management, data transformation techniques, incident management support, security, infrastructure"
"Pro*C, C, UNIX, SQL",Gainwell Technologies,2025-09-20,Bengaluru,5-8 Years,"c programming, unix development, sql proficiency, shell scripting, product lifecycle, linux, c developer, proc"
SSIS SQL Developer - Pan India,Tech Mahindra Ltd,2025-09-18,Bengaluru,5-8 Years,"database, xml"
"Sr. Systems Architect (Cloud) - MS SQL, DBA",blue yonder,2025-09-05,Bengaluru,9-13 Years,"sql server optimization, performance tuning, database security, automation development, troubleshooting expertise, supply chain solutions"
Technical Support Escalation Engineer- SQL VM/MI,Microsoft India Pvt Ltd,2025-08-27,Malaysia,3-5 Years,"problem solving abilities, azure sql expertise, customer success orientation, css, information technology, security"
DB2 DBA,LINKTAG,2025-09-21,Bengaluru,2-7 Years,"performance monitoring, performance tuning, restore, sql tuning, disaster recovery, db2 dba, sql"
Key Skills Requirements: Angular 4 & above C#.NET SQL Server / MongoDB NodeJS / React 5  years to 12 years of experienc,samskriti business solutions pvt ltd.,2025-09-20,Hyderabad,5-12 Years,"angular, c#, net, sql server / mongodb, nodejs / react, object oriented javascript, ajax, jquery, git, asp.net, html, mvc, oojs, rest, entity framework, svn, logical thinking, linq, c#.net, angularjs"
"Principal Solutions Architect, Oracle Analytics",ORACLE,2025-09-23,Bengaluru,10-13 Years,"oracle analytics cloud, bi/data warehouse analysis, data analysis & integration, sql & pl/sql proficiency, ai & ml solution development, oracle pl/sql, artificial intelligence, solution architect, machine learning, oracle sql"
"Rackspace - Oracle EBS Developer IV - IN ( SQL, PL/SQL, Reports, BI Publisher)",rackspace technology,2025-09-19,Gurgaon,1-4 Years,"sql development, pl/sql programming, bi publisher reports, oracle workflow, data conversion, bom, customization, security, java, oaf, mobile, ebs"
Qlik Senior Consultant,GainInsights Solutions,2025-09-02,Gurgaon,4-7 Years,"sql, qlikview, database, etl"
Professional Services,ANR SOFTWARE PVT LTD,2025-09-02,Noida,0-1 Years,"technical support, infrastructure, sql queries"
Right Angle Support Specialist,CAPCO,2025-08-24,Bengaluru,2-10 Years,"right angle expertise, api proficiency, oop understanding, t-sql, java, ssrs, debugging, pl/sql, c#, oracle, forms"
Assistant Manager/ Manager,Boyen Haddin Consultants LLP,2025-09-20,Mumbai,0-3 Years,"oracle, ece, sql, database, oracle sql"
"Senior Lead Analyst - Managed Service Change(Intellimatch,SQL)",FIS,2025-09-20,Pune,4-8 Years,"reconciliation development, sql database management, uat testing support, change implementation, client relationship building, regression testing, security, waterfall, jira, data integrity, windows, agile, health benefits"
SQL Developer,highrise solutions llp,2025-09-20,Pune,3-7 Years,"sql server, ssis, etl, ssrs, power bi, etl development, rdbms, ssas, business intelligence tools, integration services"
"Software Engineer  Java FullStack, React.Js, SQL",unitedhealth group information services,2025-07-25,Gurgaon,2-5 Years,"java development, agile processes, design solutions, reactjs expertise, business environment, spring boot"
Hiring For Oracle SCM Technical Developer,krazy mantra hr solutions,2025-09-04,Bengaluru,8-11 Years,"oracle scm, pl/sql, sql, workflow, forms, oracle applications, shell scripting, unix/linux, soap"
T-SQL Database Systems Administration,kyndryl,2025-09-23,Bengaluru,10-13 Years,"database management, t sql & ssrs, power bi reporting, high availability/disaster recovery, microsoft azure expertise, security compliance, t-sql, problem solving, reporting tools"
SQL Developer | Top IT Company In Gurgaon | AHOM,AHOM Technologies Private Limited,2025-09-19,Gurgaon,1-5 Years,"sql development, database design, t sql, data migration, performance optimization, software testing, t-sql, sql developer, web development"
"Data Engineer,GCP - SQL,Python -5 Years - Gurgaon job in",crescendo global,2025-09-20,Gurgaon,5-8 Years,"data engineering, sql expertise, python programming, gcp proficiency, data pipeline optimization, security"
SQL Developer,highrise solutions llp,2025-09-20,Pune,3-5 Years,"sql, ssrs, wpf, mvc, database design, symfony, system development, mysql, c#, .net, bi, database development, sql developer, visual basic, software engineer, team player, database developer, cobol, infrastructure, php, sql database"
Data Analytics (Visualization) Specialist - SQL & Tableau,SYNECHRON,2025-08-25,Bengaluru,4-7 Years,"data analytics, sql proficiency, tableau development, data visualization, stakeholder management, information technology, data mining, bi, dashboards, data extraction, data science, data analysis"
Senior Java Full Stack Developer,institutional shareholder services,2025-09-22,Mumbai,3-6 Years,"java development, sql optimization, angular architecture, technical leadership, software testing, security, git, web development, sql database"
Power BI   SQL   Excel - Bangalore Assistant Manager-Analytics,WNS (Holdings) Ltd,2025-09-20,Bengaluru,1-3 Years,"sql programming, data visualization, analytical thinking, dashboard development, statistical techniques, business requirements, bi, dashboards, data science, design thinking, business environment, tableau, business process management"
Converse Placement Services India Pvt. Ltd.,Converse Placement services,2025-09-21,Chennai,6-9 Years,"oracle retail, technical lead, sql/plsql, retail integration, api development, rest api, java, shell scripting, software engineer, pl/sql, weblogic, infrastructure, oracle sql, software developer"
SQL Developer,Headhuntersinc consultancy Private Limited,2025-09-04,Chennai,5-8 Years,"sql development, ssrs, sql developer, triggers, sql"
Data Engineer (SQL and DAX),highrise solutions llp,2025-09-20,Pune,6-8 Years,"sql, dax, etl, mysql, data engineering, symfony, apache, java, ssrs, python, scala, bi, database, security, postgresql, sql developer, software engineer, mvc, microsoft azure, infrastructure, php"
Manager - Data Engineer,COMMONWEALTH BANK,2025-09-23,Bengaluru,10-14 Years,"sql and t sql expertise, data flow analysis, data quality assessment, stakeholder engagement, information technology, bi, t-sql, ssrs, python"
Database Administrator,Wonese India Pvt Ltd.,2025-09-07,Hyderabad,0-3 Years,"oracle, mysql, sql"
"Technical Consultant - Oracle, PL/SQL, Informatica, Fund Accouting",infinity business solutions pvt ltd,2025-09-20,Gurgaon,10-13 Years,"oracle, pl/sql, informatica, fund accounting, technical leadership, autosys, data warehousing, control-m, plsql, unix scripting, perl, pl/sql, oracle, production support, technical consultant, oracle sql"
Data Analyst,Hexanika,2025-09-20,Pune,0-3 Years,"test data, sql queries, testing, sql"
Java Microservices Developer,ORACLE,2025-09-23,Bengaluru,3-5 Years,"java development, springboot framework, microservices architecture, devops tools, oracle, debugging, oracle sql"
Senior OAS Engineer,"Milestone Technologies, Inc.",2025-09-14,Hyderabad,5-8 Years,"obiee/oas expertise, oracle sql/pl sql, sql query writing, rpd development, bi publisher reports, security, database, oracle bi, pl/sql, sql development, triggers"
Senior Java & Appian Developer - Investment Account Services - Manager,State Street,2025-09-19,Bengaluru,5-12 Years,"java development, appian development, api integration, microservices architecture, artificial intelligence, j2ee, pl/sql, mq, sql / plsql, nosql, sql programming, fundamentals, technical specialist, docker, database, debugging"
SQL DEVELOPER,pam technologies pvt. ltd.,2025-08-26,Ahmedabad,2-3 Years,"sql developer, ms sql server, stored procedures, functions, triggers, database performance tuning, maintenance plans, backup, indexes, constraints, replication, log shipping, mirroring, server security, database encryption., database security"
Sr Engineer-Data Engg,Birlasoft,2025-09-19,Hyderabad,4-7 Years,"microsoft sql databases, ssis development, t sql troubleshooting, performance optimization, data warehousing, mysql db, sql coding, windows, t-sql"
Senior SQL Server Architect and SQL Developer,BAKER HUGHES,2025-08-24,Hyderabad,8-11 Years,"sql database development database optimization techniques advanced sql querying cloud database migration database security management, information technology, sql developer, rdbms, triggers"
Looking for Microsoft SQL Server Programer for Bangalore location,TandA HR Solutions,2025-08-04,Bengaluru,1-2 Years,"power bi development python programming sql querying data analytics techniques etl process management, information technology, postgresql, big data, sql database"
Tableau Developer - Tableau/SQL - 3  Years - Kolkata job in Calcutta,crescendo global,2025-08-27,Kolkata,3-6 Years,"tableau development, sql proficiency, data visualization, dashboard design, leadership hiring, recruitment"
Software Developer 2 - BI Developer using OAC,ORACLE,2025-09-23,Bengaluru,2-5 Years,"business intelligence tools, sql/pl sql expertise, dashboard development, troubleshooting and debugging, javascript programming, bi, oracle, infrastructure"
Right Angle Support Specialist,CAPCO,2025-08-24,Bengaluru,2-10 Years,"right angle expertise, api proficiency, oop understanding, t-sql, java, ssrs, debugging, pl/sql, c#, oracle, forms"
"Senior Software Engineer (Java, Spring Boot, Microservices, SQL)",Uzio Technology pvt Ltd.,2025-09-13,Noida,4-7 Years,"java development, spring boot, microservices architecture, sql proficiency, restful apis, cursor, senior software engineer, hibernate, docker, postgresql, devops, software engineering, oracle, team player, infrastructure, web technologies"
"Senior Software Engineer - Bigdata ( Java / Scala / Python , Spark, SQL , AWS)",NIELSEN,2025-08-24,Mumbai,4-8 Years,"cloud architecture big data analytics agile methodologies software development team mentorship, orchestration, information technology, apache, java, devops, software engineering, shell scripting, mysql, python, oracle, messaging, unix/linux, hive, scala, docker, security, git, postgresql"
Hiring For CRMNext application L2 support,krazy mantra hr solutions,2025-09-04,Mumbai,0-9 Years,"crmnext l2 support, sql db, pl sql, iis, .net, unix commands"
"Senior Software Engineer (Full stack - Java/Python, ReactJS, SQL, AWS)",autodesk india pvt ltd,2025-08-24,Pune,5-9 Years,"distributed systems, data processing, cloud computing, automation frameworks, scalability engineering, fundamentals, hive, soa, senior software engineer, sql, java, git, mvc, hadoop, python, consultant, infrastructure, angularjs"
Senior Developer - SQL Database Engineer,Access Healthcare,2025-09-20,Mumbai,3-6 Years,"data warehousing, sql, database, git, xml, json, software engineering, mysql, rest, python, odbc, triggers, database developer, sql server administration, sql database"
SQL Developer - IT Services and Consulting - 5  Years - Bangalore job,crescendo global,2025-08-14,Bengaluru,5-8 Years,"sql development database design data analysis performance tuning data security, leadership hiring, learning, recruitment, compensation"
SQL Server DBA,Surtel Technologies Pvt. Ltd.,2025-09-20,Indore,3-6 Years,"sql server database administrator, sql tuning, sql server dba, disaster recovery, patching, sql, database, linux, mirroring, replication, dts, sybase, performance tuning, windows, database administration, log shipping"
Database Administrator -Logical DBA (SQL),Koch,2025-09-14,Bengaluru,8-11 Years,"sql server implementation, database design & troubleshooting, performance tuning & optimization, query optimization & monitoring, stored procedures, security, rdbms, ms sql server"
Associate - Technology (Sitecore),PENNYWISE SOLUTIONS PVT LTD,2025-09-02,Hyderabad,3-6 Years,"soa, ajax, asp.net, pl/sql, c#, javascript, software implementation, .net, jquery, sql, security, database, debugging, mvc, sql development, entity framework, problem solving"
IT Manager DataMgmt SQL Server,LINKTAG,2025-09-21,Pune,4-7 Years,"performance tuning, sql server dba, debugging, sql programming"
