Title,Company,Posted on,Location,Experience,Skills
Software Developer - Java / AngularJS,mspring infotech,2025-09-19,Chennai,2-6 Years,"java, angularjs, javascript, spring mvc, sql server, css, salesforce, git, html, software engineer, software engineering, grails, struts, php, software developer, forms"
Fullstack Java Architect - Assistant Vice President,State Street,2025-09-19,Hyderabad,7-10 Years,"oops concepts, software architecture, full stack development, api design patterns, agile methodology, css, aop, html5, spring, java, apache, devops, j2ee, multithreading, mysql, python, oracle, mq, javascript, spring security, cassandra, soap, scala, jsp, exception handling, java beans, message broker, jdbc"
Java Developer - Assistant Manager,State Street,2025-09-19,Bengaluru,5-10 Years,"sql/plsql, senior software engineer, artificial intelligence, spring, api, oracle, struts, git, sql developer, middleware, rdbms"
Senior Developer- Java,ORACLE,2025-09-19,Mumbai,6-9 Years,"core java development, sql database management, software architecture design, troubleshooting and debugging, web services integration, html5, ajax, xml, j2ee, software engineering, oracle, javascript, soap, jsp, hibernate, jquery, docker, xpath, rest, weblogic, servlets"
Senior Java Consultant,ORACLE,2025-09-19,Mumbai,3-5 Years,"java programming, jee technologies, database management, api development, ci/cd familiarity, jsp, jdbc, hibernate, spring, git, java se, devops, java ee, debugging, junit, oracle, jax-ws, weblogic, svn, eclipse, jdk, jdeveloper, j2ee technologies, soap"
Java Cloud Developer,ORACLE,2025-09-19,Bengaluru,6-8 Years,"java/jee development, microservices architecture, restful api integration, cloud computing, frontend technologies, css, orchestration, html5, ajax, artificial intelligence, xml, j2ee, pl/sql, oracle, javascript, angularjs, fundamentals, jsp, jquery, docker, java ee, json, cloud services"
"Dveloppeur Senior - C#, Java, TypeScript",CGI Information Systems and Management Consultants Pvt Ltd,2025-09-19,Canada,5-10 Years,"c# development, java programming, typescript expertise, software solutions, client consultation, cgi"
"Senior Software Engineer (Java, AWS)",autodesk india pvt ltd,2025-09-19,Pune,6-9 Years,"java development, aws expertise, spring framework, ci/cd pipelines, terraform utilization, senior software engineer, git, iam, shell scripting, rest, cloud services, team player, spring boot, consultant, infrastructure"
Java Fullstack Developer | Offshore,Photon,2025-09-19,Chennai,5-10 Years,"java development, microservices architecture, frontend technologies, database management, devops tools, css, soa, jdbc, hibernate, mockito, jquery, sql, docker, spring, oop, jpa, html, api, github, junit, python, oracle, maven, javascript, spring boot, ooad, splunk"
Java Full Stack Developer,e-Zest Solutions,2025-09-19,Pune,3-8 Years,"rest, python, knockoutjs, javascript, ruby, security, java, php, .net, angularjs"
Sr.SolutionArchitect-Java Microservice,enflexis solutions pvt ltd pune,2025-09-19,United,12-15 Years,"rest api, hibernate, docker, spring, elastic search, java, git, couchbase, multithreading, data structures, big data, cloud computing, solution architect, problem solving, team player, nosql, spring boot, cassandra"
Backend - Senior Software Engineer ( Java ),Paytm,2025-09-19,Noida,3-6 Years,"server side development, java programming, spring boot, microservices architecture, performance tuning, senior software engineer, storage, brewing, api, rdbms, mobile, messaging"
Fullstack Java Developer - Assistant Manager,State Street,2025-09-19,Bengaluru,5-10 Years,"java spring boot, react js development, rest apis design, code reviews, team leadership, css, javascript, git, asp.net, web api, multithreading, jpa, html, web development"
Java Developer Job Details | SAP,SAP Ariba,2025-09-19,Bengaluru,4-8 Years,"object oriented programming, core java expertise, database technologies, microservices development, java developer, nosql, algorithms, odata, rest, infrastructure"
Binance Accelerator Programm - Java Engineer,Binance,2025-09-19,Taiwan,0-1 Years,"java programming, microservices architecture, database management, team collaboration, sql, logical thinking, spring, multithreading, mysql, middleware"
Java Developer With Jasperreports,smartnet it solutions,2025-09-19,Hyderabad,6-9 Years,"jsp, jdbc, team player, hibernate, java developer, spring, java, struts, servlets"
JAVA Architect,PH7,2025-09-19,United,0-3 Years,"rdbms, oracle, bi, advanced java, debugging, telecom, mysql, service oriented architecture"
JAVA Programmer,Dynakode Technology Pvt. Ltd.,2025-09-19,Delhi,0-3 Years,"udp, rest, jsp, java developer, markup languages, java programmer, xml, linux, servlets, json, multithreading, service oriented architecture, sockets, soap"
Java Developer,zakapps software pvt. ltd.,2025-09-19,Chennai,0-1 Years,"software applications, software developer, test"
Java Developer,dagslore technology solutions,2025-09-19,Coimbatore,0-1 Years,"css, jsp, jdbc, hibernate, ajax, jquery, java, html, mvc, hadoop, javascript, struts, servlets, jsf"
Industry Immersion Fellowship - Java Script/Java,volvo group india pvt ltd,2025-09-19,Bengaluru,1-3 Years,"java backend development, frontend development, full stack development, software architecture, agile devops practices, react.js, rest, javascript, spring boot, infrastructure"
JAVA - AWS,ORACLE,2025-09-19,Mumbai,3-5 Years,"front end development, back end development, object oriented concepts, microservices architecture, cloud technologies, soa, mockito, sql, spring, java, git, postgresql, rest, junit, oracle, mq, ant, maven, spring boot, soap"
Sr Manager - Blockchain ( Java ),SEVEN CONSULTANCY,2025-09-19,Chennai,5-8 Years,"algorithms, c, cryptography, javascript, java, data structures"
Java Developer | Java Development Services | AHOM,AHOM Technologies Private Limited,2025-09-19,Gurgaon,2-4 Years,"java development, spring boot, sql proficiency, web services, css, hibernate, ajax, apache tomcat, wsdl, j2ee, web development, jpa, mysql, html, oracle pl, software testing, maven, weblogic, javascript, java developer, eclipse, oracle pl / sql, soap"
Java Developer,girnar newtel solutions pvt ltd,2025-09-19,Bengaluru,0-3 Years,"css, jsp, jdbc, jee, hibernate, jquery, sql, spring, java, spring mvc, debugging, html, mysql, mvc, log4j, rest, mvc framework, rdbms, maven, javascript, java developer, jstl, osgi, struts, soap"
Senior Java Angular Developer,ORACLE,2025-09-19,Bengaluru,5-7 Years,"front end development, back end development, ui frameworks expertise, java microservices architecture, soa, html5, bootstrap, spring, linux, rest, oracle, problem solving, javascript, spring boot, angularjs, unix, soap"
Senior Application Developer - Java,ORACLE,2025-09-19,Bengaluru,1-5 Years,"cloud solutions, diverse perspectives, employee benefits, accessibility assistance, equal employment, oracle"
Senior Java Support Engineer,ORACLE,2025-09-19,Mumbai,3-5 Years,"technical support expert, customer interaction, saas services proficiency, rest api, cake, pl/sql, spring framework, spring boot, web technologies"
java blockchain developer,SEVEN CONSULTANCY,2025-09-19,Chennai,5-8 Years,"rest, java developer, database, security, java, infrastructure, j2ee"
Senior Java Developer,ideation technology solutions private limited,2025-09-19,Kolkata,7-10 Years,"rest, hibernate, sql, spring, database, java, j2ee, hadoop, soap"
Full Stack Developer (Java/React),CGI Information Systems and Management Consultants Pvt Ltd,2025-09-19,Colombia,3-5 Years,"full stack development, java spring boot, react, js proficiency, relational databases, rest api integration, cgi, sql, docker, react.js, git, postgresql, software engineering, mysql"
Java Full Stack Developer - Senior Associate,State Street,2025-09-19,Hyderabad,5-7 Years,"agile development, java/jee expertise, react ui framework, cloud technologies, pl/sql & nosql, html5, artificial intelligence, j2ee, mq, problem solving, javascript, messaging"
Tech Leads Java,nextgen telesolutions pvt. ltd.,2025-09-19,Noida,5-7 Years,"ajax, java, xml, j2ee, software engineering, html, web development, mysql, eclipse, messaging, websphere, jsp, hibernate, database, wml, linux, telecom, gprs, netbeans, nextgen, mobile, weblogic, problem solving, windows, jbuilder, servlets"
Java Developers,effitrac solutions pvt ltd,2025-09-19,Coimbatore,1-5 Years,"spring, java, spring mvc, j2ee, jpa, hibernate, sql"
Plsql Java Product Support Engineer,ORACLE,2025-09-19,Bengaluru,3-5 Years,"software programming, database performance, client interaction, problem solving, rest api, java, devops, xml, j2ee, pl/sql, oracle, javascript, technical consultant, oracle sql, testing tools, team player"
Java Technical Lead - Senior Manager,State Street,2025-09-19,Hyderabad,5-10 Years,"core java development, microservices architecture, restful services implementation, oracle sql proficiency, test driven design, spring, git, j2ee, shell scripting, pl/sql, junit, mq, unix"
"Software Engineer - Java, Microservices,Spring",blue yonder,2025-09-19,Hyderabad,2-3 Years,"software development, java application, microservices architecture, incident resolution, rest api, jsp, hibernate, jquery, spring, git, j2ee, junit, oracle, ant, maven, problem solving, jstl"
JAVA Trainer,blend infotech,2025-09-19,Pune,2-5 Years,"spring, java, jsp, struts, servlets, ejb, hibernate"
Senior Java Microservices Engineer,ORACLE,2025-09-19,Mumbai,6-10 Years,"java development, cloud solutions, ci/cd pipelines, shell scripting, api security, autosys, docker, iam, devops, rest, python, oracle, access management, siteminder, production support, identity management, infrastructure, soap"
Software Developer - JAVA,power2sme pvt ltd,2025-09-19,Gurgaon,0-3 Years,"css, hibernate, sql, spring, java, html, mysql, api, mq, nosql, spring framework, software developer"
JAVA RCP Lead,kyndryl,2025-09-19,Bengaluru,8-11 Years,"core java development, spring framework proficiency, microservices architecture, restful api design, database management, orchestration, apache, devops, software engineering, mysql, big data, maven, nosql, web technologies, hibernate, mockito, docker, security, git, postgresql, json, mongodb, junit"
Principal Consultant Java,ORACLE,2025-09-19,Mumbai,1-4 Years,"java development, cloud native solutions, ci/cd automation, shell scripting, api security, principal consultant, devops, python, oracle, soap, autosys, docker, iam, rest, access management, siteminder, production support, identity management, infrastructure"
Java Senior Developer,CITI,2025-09-19,Pune,7-10 Years,"applications programming, java expertise, database management, cloud development, risk management, spring, apache, api, cache, python, oracle, nosql, senior programmer, docker, debugging, mongodb, rest, infrastructure"
Sr. Software Engineer (Java   React),Visa Inc.,2025-09-19,Bengaluru,5-8 Years,"full stack development, java/jee proficiency, react ui/ux design, agile methodologies, object oriented programming, software management, oop, system development, j2ee, software engineer, mysql, rest, team player, java developer, spring boot"
ReactJS and Java Developer,ORACLE,2025-09-19,Mumbai,6-10 Years,"reactjs development, java backend integration, frontend optimization, agile methodologies, html5, security, devops, oracle, javascript, java developer"
Sr. Software Engineer (Java   React),Visa Inc.,2025-09-19,Bengaluru,5-8 Years,"full stack development, java/jee programming, ui/ux design, restful services, object oriented programming, software management, oop, system development, j2ee, software engineer, mysql, team player, java developer, spring boot"
Java Tech Lead | Transunion | Bangalore,Photon,2025-09-19,Bengaluru,8-11 Years,"java development, microservices architecture, agile software development, ci/cd automation, orchestration, ajax, spring, apache, camel, xml, mqtt, j2ee, oracle sql developer, maven, javascript, eclipse, groovy, jdbc, storage, docker, security, git, json, debugging, jpa, telecom, mvc"
Java Developer,mspring infotech,2025-09-19,Bengaluru,6-10 Years,"oops concepts, design pattern, java, j2ee development, sql, css, html5, hibernate, ajax, jquery, spring, database, rest, oracle, java developer, struts, soap"
Fullstack Java Developer - IT,Flex,2025-09-19,Coimbatore,2-5 Years,"full stack development, web application development, sql query writing, html5, cq5, bootstrap, hibernate, wsdl, xml, soap web services, j2ee, project life cycle, web development, rest, oracle, weblogic, java developer, logical thinking, spring boot"
Java Developer,mspring infotech,2025-09-19,Bengaluru,6-10 Years,"oops concepts, design pattern, java, j2ee development, sql, css, html5, hibernate, ajax, jquery, spring, database, rest, oracle, java developer, struts, soap"
Java Developer,OM SOFTWARES,2025-09-19,Pune,3-6 Years,"gwt, jee, hibernate, sql, memory management, java, spring mvc, java ee, java developer, wicket, spring framework, delivery management, jsf"
Consulting Technical Manager - Java & AWS,ORACLE,2025-09-19,Bengaluru,5-7 Years,"data platform architecture, big data systems, sql programming, data governance implementation, information technology, scala, java, data structures, python, rdbms, oracle"
WSI | Java Developer,Photon,2025-09-19,Chennai,3-5 Years,"digital modernization, team leadership, process improvement, project management"
Manager Java development,TransUnion,2025-09-19,Chennai,1-4 Years,"team building, agile processes, technical leadership, cloud environments, software development, algorithms, security, java, devops, data structures"
Java Blockchain Develope,SEVEN CONSULTANCY,2025-09-19,Pune,5-8 Years,"java, information technology, infrastructure, java developer"
Java Blockchain Developer,SEVEN CONSULTANCY,2025-09-19,Delhi,5-8 Years,"cryptography, javascript, java developer, spring, java, consultant"
JAVA TECHNICAL LEAD,paycraft solutions pvt. ltd.,2025-09-19,Mumbai,7-10 Years,"java programming, multi threading expertise, database management, business environment, elastic search, cassandra, mqtt, debugging, data structures"
Java Tech Lead,CITI,2025-09-19,Pune,10-13 Years,"java programming, application development, systems architecture, cloud technologies, risk management, spring, apache, api, cache, python, oracle, java developer, nosql, docker, debugging, mongodb, rest, infrastructure"
Java Senior Developer,CITI,2025-09-19,Pune,7-9 Years,"java development, api design, problem solving, cloud computing, risk management, spring, apache, cache, python, oracle, nosql, senior programmer, docker, debugging, mongodb, rest, infrastructure"
Java Developer,mindworx software services pvt.ltd.,2025-09-19,Pune,2-5 Years,"css, hibernate, jquery, sql, spring boot, database, java, spring mvc, j2ee, html, api, angularjs"
Java Developer/Sr.Java Developer,TBI Technologies pvt ltd bhopal,2025-09-19,Bhopal,1-4 Years,"authoring, team player, jquery, java developer, sql, spring framework, spring, multimedia, java, mysql, object oriented programming"
Senior Java Developer,CGI Information Systems and Management Consultants Pvt Ltd,2025-09-19,Portugal,3-5 Years,"java development, l support, reengineering components, issue identification, solution proposing, java developer"
Senior Java Developer,izaap technologies,2025-09-19,Bengaluru,2-3 Years,"software testing, business rules, java developer, database development, security, java, git, xml, linux, shell scripting, forms"
Senior Application Developer - Java,ORACLE,2025-09-19,Bengaluru,5-8 Years,"cloud solutions, employee benefits, diversity inclusion, work life balance, innovation management, oracle"
Sr. Solution Architect- Java Microservice,enflexis solutions pvt ltd pune,2025-09-19,United,12-15 Years,"rest api, hibernate, docker, spring, elastic search, java, git, couchbase, multithreading, data structures, big data, cloud computing, problem solving, team player, nosql, spring boot, cassandra"
Java Developer,Sourcetrace Systems pvt.ltd,2025-09-19,Coimbatore,0-3 Years,"service oriented, soa, ece, spring, java, j2ee, mysql, pl/sql, oracle, maven, java developer, struts, jsf, hibernate, software requirements, sql, unix scripting, database, soap web services, linux, rest, rdbms, svn"
Java Developer,ideation technology solutions private limited,2025-09-19,Kolkata,0-3 Years,"html5, jsp, problem solving, ajax, javascript, java developer, spring, node.js, java, spring security, spring mvc, oops, java ee, j2ee, multithreading, data structures"
Java Fullstack - AWS - Tech Lead,State Street,2025-09-19,Hyderabad,8-10 Years,"react js expertise, java spring boot, micro service development, rest apis construction, artificial intelligence, python, mq, messaging, oracle sql, software developer, jpa, cloud services, team player, production support"
Java FullStack Developer - Manager,State Street,2025-09-19,Bengaluru,5-10 Years,"object oriented programming, full stack development, api development, software architecture, devops tools, css, aop, html5, artificial intelligence, spring, java, apache, j2ee, multithreading, mysql, oracle, mq, javascript, spring security, cassandra, soap, jsp, exception handling, java beans"
Software Developer - Java,interface infosoft solutions pvt ltd,2025-09-19,Pune,2-4 Years,"jsp, problem solving, jdbc, hibernate, product delivery, spring, database, java, spring security, servlets, mysql, software developer, j2ee technologies"
Senior Software Engineer - Java Backend,MASTERCARD,2025-09-18,Pune,6-8 Years,"core java development, spring framework, restful web services, database management, agile methodologies, css, business rules, senior software engineer, jee, apache, oracle, maven, nosql, sql scripting, cassandra, jsp, storage, hibernate, security, linux, json, junit, drools, production support"
"Platform Engineering (Java, Springboot)",MASTERCARD,2025-09-18,Pune,5-7 Years,"internet traffic engineering, rest api development, java programming, automation scripting, cloud native applications, fundamentals, algorithms, senior software engineer, sql, database, security, data structures, python, nosql"
Principal Software Engineer - Java,MASTERCARD,2025-09-18,Pune,1-4 Years,"java programming, spring boot development, microservices architecture, api development (rest), ci/cd processes, security, database, software engineer, microsoft azure, production support"
Java Tech Lead- with UI,CGI Information Systems and Management Consultants Pvt Ltd,2025-09-18,Pittsburgh,5-10 Years,"java development, ui design, technical leadership, solution architecture, team collaboration, cgi, consultant"
Lead Software Engineer (Java Developer),MASTERCARD,2025-09-18,Pune,5-8 Years,"java development, software engineering, quality assurance, solution architecture, project management, information technology, system development, metrics, sdlc, performance testing, matrix, security, system testing, integration testing"
java developer 6576,Hiring company7,2025-09-17,Burdwan,1-2 Years,"javascript, node.js, mongodb"
Portfolio Architect - Java,EMPOWER,2025-09-17,Bengaluru,10-13 Years,"portfolio architecture, service oriented architecture, cloud computing, api integration, full stack development, orchestration, soa, spring, java, xml, devops, big data, python, github, messaging, nosql, odata, security, json, bpm, rest, natural language processing, infrastructure, it strategy, gateway"
Software Engineer-Java Developer,CGI Information Systems and Management Consultants Pvt Ltd,2025-09-16,Chennai,3-7 Years,"java programming, application development, software development lifecycle, high performance computing, java ee expertise, global delivery, cgi, java developer, software engineer"
Software Engineer L2 (Java),Twilio Inc.,2025-09-16,Ireland,2-5 Years,"java software development, aws cloud solutions, rest apis design, microservices architecture, object oriented programming, data warehousing, database management, apache, linux, debugging, software engineer, python, spring boot, infrastructure"
Java Google Cloud Platform Developer,CGI Information Systems and Management Consultants Pvt Ltd,2025-09-16,Canada,10-13 Years,"java development, cloud microservices, incident resolution, team leadership, production management, software development, enterprise applications"
Java ETL Developer,CGI Information Systems and Management Consultants Pvt Ltd,2025-09-16,Canada,3-5 Years,"java programming, etl processes, data integration, software development, agile methodologies, etl developer"
"Principal Engineer (Java, DB, AWS)",autodesk india pvt ltd,2025-09-15,Pune,1-4 Years,"distributed systems, database engineering, java/jee development, cloud services (aws, azure), code review leadership, algorithms, j2ee, software engineer, data structures, team player, consultant"
Senior Java Engineer,DXC Technologies,2025-09-15,Chennai,5-9 Years,"java development, angular java, sql expertise, microservices fundamentals, database, git, devops, linux, shell scripting, python, spring framework, application support, unix/linux"
"Principal Engineer (Java, AWS, Search)",autodesk india pvt ltd,2025-09-15,Pune,10-13 Years,"java development, aws technologies, spring framework, terraform usage, scalable systems, elastic search, database, git, iam, software engineer, rest, cloud services, consultant, infrastructure"
Principal Engineer/Leader - Java &BigData,Binance,2025-09-15,Taiwan,5-7 Years,"core java proficiency, mysql expertise, nosql familiarity, distributed systems design, performance tuning, security, middleware, java developer, messaging"
Senior Java Engineer,DXC Technologies,2025-09-15,Chennai,5-9 Years,"java development, microservices fundamentals, database management, shell scripting, devops practices, sql, git, linux, python, spring framework, application support, unix/linux"
Senior Java Engineer,DXC Technologies,2025-09-15,Chennai,5-8 Years,"java development, angular java, spring framework, microservices fundamentals, sql database expertise, git, devops, linux, shell scripting, python, application support, unix/linux"
Hiring For Java,krazy mantra hr solutions,2025-09-15,Bengaluru,3-5 Years,"java development, spring boot, microservices architecture, rest api design, aws deployment, python, docker, database, neo4j, iam, infrastructure, couchbase, mysql"
Lead Software Engineering - Java Fullstack,AT&T,2025-09-14,Hyderabad,5-7 Years,"full stack development, restful api design, java/jee framework, angular and react, unit testing frameworks, bootstrap, mockito, docker, git, j2ee, json, software engineer, project life cycle, junit, development testing, spring boot"
Software Engineer (Java Full Stack),OpenText,2025-09-14,Bengaluru,3-5 Years,"java/java ee, angular development, restful apis, database design, code repository management, css, sql/plsql, intellij, xml technologies, hibernate, spring, git, software engineer, html, jpa, pl/sql, information management, svn, team player, javascript, eclipse, spring boot, jbuilder, oracle 11g"
Core Java Engineer,Guardian,2025-09-14,Gurgaon,3-5 Years,"java development, microservices architecture, sql and nosql, ci/cd tools, unit testing, css, intellij, mockito, spring, react.js, security, git, j2ee, data structures, html, rest, lld, maven, javascript, eclipse, spring boot, splunk, soap"
Java Developer - Engineer - IT,Guardian,2025-09-14,Gurgaon,5-8 Years,"java/jee development, spring boot framework, unit testing frameworks, restful & soap apis, agile project coordination, software design, mockito, sso, sql, database, git, xml, oops, linux, j2ee, json, play framework, junit, oracle, lld, svn, windows, nosql, spring framework, unix"
Technical Support Engineer(Java),SEVEN CONSULTANCY,2025-09-14,Navi,4-7 Years,"hibernate, oop, java, git, xml, json, jpa, mysql, rest, maven, nosql, gradle, spring boot"
Sr. Software Engineer- Java Angular,OpenText,2025-09-14,Bengaluru,5-8 Years,"full stack development, angular/react proficiency, system design understanding, css, html5, security, java, devops, web development, big data, information management, machine learning, javascript, node.js"
Lead Software Engineering - Java Fullstack,AT&T,2025-09-14,Hyderabad,5-8 Years,"full stack development, restful api design, java/jee frameworks, ci/cd pipeline management, unit testing automation, bootstrap, mockito, docker, git, j2ee, json, software engineer, project life cycle, junit, development testing, spring boot"
Java SDET,InfoTree Solutions,2025-09-13,Poland,0-3 Years,"load testing, java, selenium, sdet, white box testing, automation testing, testing, test cases, qtp, ds"
JAVA ENGINEER,Caterpillar Inc.,2025-09-13,Slovakia,3-5 Years,"java development, restful api, microservices architecture, software testing, aws deployment, telematics, debugging, mysql, html, oracle"
Java Full Stack Developer,Dell India,2025-09-13,Bengaluru,9-12 Years,"automated vulnerability remediation, secure development lifecycle, ci/cd pipeline implementation, front end application development, scripting expertise (python, linux), react.js, security, java, devops, software engineer, software engineering, linux shell scripting, windows, spring boot"
Full stack Java  React Developer.,Trigyn Technologies Ltd,2025-09-13,Mumbai,3-5 Years,"java development, spring boot, microservices architecture, reactjs frontend, agile methodology, testing, qa, jenkins, jira"
"Principal Engineer (Java, AWS)",autodesk india pvt ltd,2025-09-13,Pune,1-9 Years,"java development, aws technologies, spring/spring boot framework, rest services, elastic search, database, git, iam, software engineer, cloud services, problem solving, consultant"
Lead Coach - Java,Ethnus,2025-09-12,Bengaluru,4-5 Years,"oops expertise, java proficiency, problem solving, project mentoring, advanced java"
