Title,Company,Posted on,Location,Experience,Skills
Java Developer/Sr. Java Developer,gohil technologies,2025-08-29,Other,0-10 Years,"core java, jee, data structure/algorithm, design pattern, spring/hibernate framework, algorithms, rest api, problem solving, java developer, ds, j2ee, multithreading, data structures, software engineering"
Java Developer,CONNECTING 2 WORK,2025-09-21,Thiruvananthapuram,0-3 Years,"gwt, jee, hibernate, java developer, sql, wicket, spring framework, memory management, java, spring mvc, java ee, jsf"
Java Developer,Logilite Technologies,2025-09-20,Surat,3-5 Years,"oracle pl/sql, java swing, jdbc, ajax, apache tomcat, java, xml, j2ee, rest, problem solving, javascript, osgi, database programming, java programming"
Java Developer,BUSISOL SOURCING INDIA PVT. LTD,2025-09-07,Mumbai,2-3 Years,"css, jsp, jdbc, hibernate, ajax, jquery, sql, spring, database, java, j2ee, json, mysql, html, director, xml/xsl, javascript, java developer, .net, software developer"
Java Developer,E Hook Systems,2025-09-20,Delhi,2-7 Years,"websphere, websphere mq, rest, jsp, bootstrap, hibernate, ajax, javascript, java developer, spring, java, j2ee, html, angularjs, soap"
Java Developer,Ctd Techs Private Limited,2025-09-21,Chennai,3-5 Years,"css, html5, bootstrap, hibernate, ajax, jquery, javascript, java developer, sql, spring, java, struts, xml, oops, j2ee, html"
Java Developer/Sr.Java Developer,TBI Technologies pvt ltd bhopal,2025-09-19,Bhopal,1-4 Years,"authoring, team player, jquery, java developer, sql, spring framework, spring, multimedia, java, mysql, object oriented programming"
Java Architect / Java Lead / Java Designer,infinity business solutions pvt ltd,2025-09-20,Bengaluru,8-12 Years,"java, architect, lead, designer, team management, object oriented analysis, mentor, technical leadership, application design, database design, java, technology management, uml, design patterns, system development, data structures, client server, mentoring, application development, system architecture, ooad"
Java Developer,Drawsera,2025-09-21,Mumbai,1-5 Years,"css, ajax, jquery, sql, database, java, j2ee, mysql, html, oracle, j2se, javascript, java developer, website development"
Java Developer,mindworx software services pvt.ltd.,2025-09-19,Pune,2-5 Years,"css, hibernate, jquery, sql, spring boot, database, java, spring mvc, j2ee, html, api, angularjs"
Java Developer,Paragyte Technologies,2025-09-20,Pune,2-3 Years,"algorithms, information technology, jsp, hibernate, sql, spring, java, git, oops, mqtt, j2ee, debugging, multithreading, data structures, software engineering, maven, j2se, svn, problem solving, javascript, java developer, gradle, infrastructure, angularjs"
Java Developer,5exceptions software solution pvt ltd indore,2025-09-20,Indore,0-3 Years,"rest, jsp, hibernate, java developer, spring boot, database, java, soap web services, j2ee, mysql"
Senior Java,LINKTAG,2025-09-21,Delhi,7-10 Years,"senior programmer, hibernate, spring, java, struts, j2ee"
Java Developer,Headhuntersinc consultancy Private Limited,2025-09-04,Chennai,6-9 Years,"oracle pl/sql, jsp, hibernate, ajax, jquery, sql, spring, java, senior software developer, oops, j2ee, debugging, mysql, mvc, oracle, struts, software developer, ioc, j2ee technologies"
Java Developer,CONNECTING 2 WORK,2025-09-21,Thiruvananthapuram,4-7 Years,"fundamentals, algorithms, python, problem solving, java developer, java, java ee, data structures, software engineering"
Java Developer,Vitrana,2025-09-20,Bengaluru,1-3 Years,"jee, hibernate, jquery, sql, memory management, java, java ee, oracle, mobile, java developer, spring framework, hl7"
Java Developer,AAR Technologies and Software Solution Pvt. Ltd.,2025-09-20,Kolkata,0-3 Years,"spring framework, java ee, java developer, sql"
Java Developer,Softvan,2025-09-20,Ahmedabad,3-5 Years,"gwt, jee, hibernate, java developer, sql, wicket, spring framework, memory management, java, spring mvc, java ee, jsf"
JAVA DEVELOPER,BUSISOL SOURCING INDIA PVT. LTD,2025-09-07,Mumbai,2-3 Years,"css, jsp, jdbc, hibernate, ajax, jquery, sql, database, java, j2ee, json, mysql, html, xml/xsl, javascript, java developer, .net, software developer"
Java Trainer,3RI Technologies Pvt Ltd,2025-09-06,Pune,2-4 Years,"css, hibernate, jquery, sql, spring, react.js, git, j2ee, mysql, html, rest, maven, javascript, java developer, eclipse, spring boot, soap"
Java Developer,CONNECTING 2 WORK,2025-09-21,Cochin,0-3 Years,"algorithms, spring boot, multimedia, java, postgresql, infrastructure, soap web services, java ee, debugging, data structures, mysql"
Java Developer,ShepHertz Technologies,2025-09-02,United,3-4 Years,"css, jee, jquery, database, spring mvc, oops, j2ee, debugging, multithreading, html, mysql, oracle, rdbms, grails, nosql, struts"
Java Developer,Faichi Solutions,2025-09-02,Pune,8-10 Years,"junior developer, jdbc, team player, hibernate, javascript, java developer, spring, java, web technologies, j2ee, api"
Java Developer,FINITE HR CONSUTING PVT LTD,2025-09-21,Hyderabad,5-8 Years,"sql, salesforce, java, git, xml, j2ee, rest, oracle, svn, javascript, java developer, soap"
Java Developer,BUSISOL SOURCING INDIA PVT. LTD,2025-09-07,Bengaluru,3-6 Years,"oracle, html5, hibernate framework, ajax, java developer, sql, struts, java ee, .net"
Java Developer,SYNECHRON,2025-08-25,Mumbai,5-8 Years,"java/jee technologies, multi threaded applications, core java development, agile methodologies understanding, spring, security, j2ee, python, spring boot"
java developer,FINITE HR CONSUTING PVT LTD,2025-09-21,Hyderabad,7-10 Years,"rest, html5, javascript, jquery, sql, spring, database, java, dao, mvc, soap"
Java Developer,FINITE HR CONSUTING PVT LTD,2025-09-21,Hyderabad,5-8 Years,"sql, salesforce, java, git, xml, j2ee, rest, c, oracle, svn, javascript, java developer, soap"
Java Developer,Ingrain Systems Inc.,2025-09-20,United,5-8 Years,"spring, san, java, j2ee, hibernate, java developer"
Java Developer,CONNECTING 2 WORK,2025-09-21,Cochin,3-6 Years,"rest, oracle, microsoft azure, sql, spring, security, java, git, postgresql, debugging"
Java developer,FINITE HR CONSUTING PVT LTD,2025-09-21,Hyderabad,7-10 Years,"rest, html5, javascript, jquery, sql, spring, database, java, dao, mvc, soap"
Java Developer,OM SOFTWARES,2025-09-19,Pune,3-6 Years,"gwt, jee, hibernate, sql, memory management, java, spring mvc, java ee, java developer, wicket, spring framework, delivery management, jsf"
Java Developer,M/s Fast and Furious Consulting,2025-09-21,Noida,0-3 Years,"css, jsp, jdbc, bootstrap, jquery, spring, database, java, apache, git, spring mvc, oops, linux, j2ee, html, mysql, api, mvc, rest, c, ant, maven, java developer, eclipse"
Java Developer,Bright Vision Technologies,2025-09-22,Hyderabad,3-5 Years,"java development programming excellence team collaboration immigration support client interaction, java developer"
Java Developer,BUSISOL SOURCING INDIA PVT. LTD,2025-09-07,Mumbai,2-3 Years,"css, jsp, jdbc, hibernate, ajax, jquery, sql, database, java, j2ee, json, mysql, html, director, xml/xsl, javascript, java developer, .net, software developer"
Java Developer,Bright Vision Technologies,2025-09-22,Hyderabad,9-15 Years,"java development, collaborative teamwork, problem solving, immigration, h1b, compensation"
Java Developer,CodeCrux Web Technologies(P) Ltd.,2025-09-21,Hyderabad,4-5 Years,"java developer, docker, spring, security, java, api"
Java Developer,CONNECTING 2 WORK,2025-09-21,Cochin,0-3 Years,"rest, docker, spring framework, spring, spring boot, java, postgresql, json, api, mongodb"
JAVA BACKEND,CONNECTING 2 WORK,2025-09-21,Thiruvananthapuram,8-11 Years,"rest, spring boot, java, oracle, apache, ireport, birt, jdbc, sql"
Java Developer,ideation technology solutions private limited,2025-09-19,Kolkata,0-3 Years,"html5, jsp, problem solving, ajax, javascript, java developer, spring, node.js, java, spring security, spring mvc, oops, java ee, j2ee, multithreading, data structures"
JAVA Developer,HARMAN INTERNATIONAL,2025-09-22,Pune,4-7 Years,"software development, api development, agile methodologies, cloud technologies, frontend frameworks, docker, sql, react.js, java, postgresql, python, github, software delivery, javascript, nosql, spring boot, node.js, openstack, software developer"
Java Developer,CONNECTING 2 WORK,2025-09-21,Thiruvananthapuram,1-3 Years,"spring, advanced java, java, servlets, mysql, hibernate"
Java Developer,Fulcrum Digital,2025-09-22,Pune,5-6 Years,"java development, spring framework, microservices architecture, test driven development, api integration, sql, security, git, debugging, jpa, mvc, spring boot, gateway"
Java Developer,mspring infotech,2025-09-19,Bengaluru,6-10 Years,"oops concepts, design pattern, java, j2ee development, sql, css, html5, hibernate, ajax, jquery, spring, database, rest, oracle, java developer, struts, soap"
Java Developer,HARMAN INTERNATIONAL,2025-09-21,Bengaluru,4-6 Years,"java development, big data hadoop, streaming platforms, cloud technologies, multi threading, scala, nosql, database, mapreduce"
Java Developer,Mtree Software,2025-09-02,Delhi,2-4 Years,"rest, hibernate, spring, node.js, database, java, django, struts, j2ee, mysql, mongodb"
Java Developer,Doodleblue Innovations Pvt Ltd,2025-08-28,Chennai,0-3 Years,"spring, rest, java, j2ee, debugging, mvc, pl/sql, mongodb, soap, java developer, sql"
Java Developer,CONNECTING 2 WORK,2025-09-21,Thiruvananthapuram,0-3 Years,"java developer, multimedia, database, java, infrastructure, debugging"
Java Developer,tbm technologies,2025-09-20,Delhi,2-4 Years,"c, jsp, hibernate, spring, java, xml, linux, j2ee, ejb, crm, c, ivr, client server, java security, wap, windows, java developer, messaging, multimedia, struts, servlets"
Java Developer,FINITE HR CONSUTING PVT LTD,2025-09-21,Hyderabad,4-7 Years,"python, github, mobile, problem solving, team player, ruby, java, cassandra, php"
Java developer,M/s Fast and Furious Consulting,2025-09-21,Chicago,0-3 Years,"websphere, jsp, sharepoint, jee, bootstrap, ajax, jquery, sql, spring, java, git, linux, soap web services, json, pl/sql, ejb, rest, oracle, mq, weblogic, svn, javascript, java developer, nosql, messaging, eclipse, spring boot, production support, node.js, struts, tibco ems, soap, unix"
JAVA Trainer,blend infotech,2025-09-19,Pune,2-5 Years,"spring, java, jsp, struts, servlets, ejb, hibernate"
Java Developer,INTERSOFTKK (INDIA) PVT. LTD.,2025-09-21,Bengaluru,0-3 Years,"spring, database, java, technology consulting, web development, perl, c#, rdbms, sybase, .net, unix/linux"
JAVA DEVELOPER,v support solutions,2025-09-20,Coimbatore,3-6 Years,"css, jsp, jquery, spring, markup languages, oop, java, xml, debugging, json, html, rest, problem solving, team player, javascript, java developer, struts, web technologies, servlets, software developer, soap"
JAVA Developer,Infinizi Consulting Pvt. Ltd.,2025-09-20,Noida,2-5 Years,"css, jsp, java applets, jquery, spring, markup languages, java, xml, json, html, javafx, big data, problem solving, javascript, java developer, eclipse, struts, web technologies, servlets, java programming"
Java Developer,AugmatrixGo,2025-08-29,Mumbai,0-3 Years,"css, rest api, html5, ubuntu, jsp, maven, problem solving, hibernate, jquery, eclipse, spring, java, spring security, git, spring mvc, j2ee, debugging, mysql"
Java Developer,covalense global,2025-09-20,Hyderabad,6-9 Years,"algorithms, python, c, java, api, javascript, docker"
Java Developer,sacumen,2025-09-20,Bengaluru,0-3 Years,"rest, access management, security, java, soap web services, j2ee, api"
JAVA Developer,Brightcode Software Services Pvt. Ltd.,2025-09-20,Ranchi,1-3 Years,"oracle, java web services, jdbc, hibernate, javascript, java developer, sql, spring, database, oops, multithreading, mvc"
Java Developer,Cotocus,2025-09-20,Bengaluru,3-6 Years,"css, information technology, jsp, php developer, jquery, docker, markup languages, spring, oop, java, xml, debugging, json, html, javascript, java developer, struts, web technologies, servlets, java programming"
Java SDE,Arete Careers (OPC) Pvt Ltd,2025-09-20,Bengaluru,5-8 Years,"cryptography, mining, nosql, java, infrastructure, openstack"
Java Consultants,LINKTAG,2025-09-21,Bengaluru,4-5 Years,"soa, jdbc, hibernate, spring, jaxb, java, uml, xml, j2ee, jpa, junit, ant, weblogic, jstl, spring framework, struts, xml schema, java programming, soap"
JAVA Developer,Yaali Bizappln Solutions,2025-09-20,Chennai,1-3 Years,"c, css, github, c, html5, svn, javascript, jquery, java developer, spring, spring framework, react.js, java, postgresql, struts, oops, j2ee, json, mysql"
Java Developer,CITI,2025-09-23,Malaysia,4-8 Years,"spring, j2ee, python"
Java Developer,ORACLE,2025-09-19,Mumbai,3-5 Years,"core java development, jee frameworks, web services integration, shell scripting automation, database management, xml, devops, j2ee, multithreading, oracle, maven, java developer, spring framework, struts, soap, jsp, exception handling, jdbc, jboss application server, hibernate, sql, docker"
Java Developer,techieshubhdeep it solutions pvt. ltd,2025-09-20,Gwalior,2-3 Years,"html5, hibernate, j2ee developer, javascript, web programming, spring, java, struts, infrastructure, oops, linux, mysql, multithreading, hadoop"
Java Developer,Arivon Technologies,2025-09-22,Bengaluru,3-8 Years,"css, html5, jdbc, ajax, jquery, docker, spring, grunt, java, git, xml, j2ee, json, sockets, pl/sql oracle, maven, problem solving, extjs, javascript, java developer, gradle, spring boot, groovy, angularjs"
Java Microservices,savitr software services pvt ltd,2025-09-20,Hyderabad,6-9 Years,"jee, mockito, docker, spring, java, git, j2ee, rest, junit, maven, java developer, spring boot, java web services"
Java Developer,Creed Global Technologies,2025-09-19,Bengaluru,0-2 Years,"css, aop, html5, jsp, hibernate, ajax, jquery, spring, security, java, spring mvc, senior software developer, j2ee, jpa, ejb, ant, maven, javascript, java developer, eclipse, struts, jdeveloper, jsf, ioc, java programming, soap"
Java Programmer,expro informatics india private limited,2025-09-20,Hyderabad,2-4 Years,"fundamentals, css, jsp, hibernate, ajax, javascript, jquery, spring, java, java programmer, struts, j2ee, servlets, html"
Java Developer,"pegasus knowledge solutions india pvt ltd.,",2025-09-20,Bengaluru,0-3 Years,"css, python, rest api, bootstrap, ajax, javascript, java developer, sql, nosql, spring, spring boot, java, django, html, angularjs"
Java Developer,M/s Fast and Furious Consulting,2025-09-08,Mumbai,2-5 Years,"java development, jee framework, spring technology, middleware components, creative solutions, hibernate, java developer, j2ee"
Java Developer,ORACLE,2025-09-19,Mumbai,3-5 Years,"core java development, jee frameworks, web services integration, shell scripting automation, database management, xml, devops, j2ee, multithreading, oracle, maven, java developer, spring framework, struts, soap, jsp, exception handling, jdbc, jboss application server, hibernate, sql, docker"
Java Developer,LINKTAG,2025-09-21,Dallas,7-10 Years,"websphere, websphere mq, css, gwt, jsp, jdbc, hibernate, ajax, spring, java, uml, oops, j2ee, multithreading, html, software engineering, weblogic, extjs, javascript, oracle 11g, struts, jsf, soap"
Java Specialist,Verizon Data Services India Pvt Ltd,2025-09-17,Chennai,4-7 Years,"web application development, java & spring boot, microservices architecture, devops tools utilization, agile software methodologies, css, html5, xml, project life cycle, oracle, javascript, sql, security, git, json, telecom domain, software delivery, system architecture, infrastructure"
Java Developer,Sourcetrace Systems pvt.ltd,2025-09-19,Coimbatore,0-3 Years,"service oriented, soa, ece, spring, java, j2ee, mysql, pl/sql, oracle, maven, java developer, struts, jsf, hibernate, software requirements, sql, unix scripting, database, soap web services, linux, rest, rdbms, svn"
Java Architect,LINKTAG,2025-09-21,Bengaluru,12-15 Years,"websphere, hibernate, sql, spring, jaxb, java, uml, oracle, weblogic, osgi, struts, j2ee technologies"
Java Programmer,clicqa services pvt ltd,2025-09-11,Hyderabad,3-6 Years,"core java development, rdbms expertise, mvc frameworks, configuration management, jquery, oops, mysql, oracle, sybase, ant, maven, svn, problem solving, javascript, spring framework, java programmer, struts, servlets"
Java Developer,cloudxlab,2025-09-21,Bengaluru,0-3 Years,"java developer, sql, nosql, spring framework, java ee"
Java Developer,CONNECTING 2 WORK,2025-09-21,Calicut,1-5 Years,"jee, hibernate, jquery, java developer, spring boot, java, java ee, mysql"
Java Developer,Team Computers Pvt Ltd,2025-09-08,Gurgaon,2-5 Years,"java development, restful apis, mysql management, microservices architecture, aws services, java developer, docker"
Java Lead,M/s Fast and Furious Consulting,2025-09-08,Bengaluru,5-8 Years,"java development, jee framework, spring framework, team leadership, requirement analysis, mobile, hibernate, java developer, j2ee, middleware"
Java Developer,BUSISOL SOURCING INDIA PVT. LTD,2025-09-07,Mumbai,2-3 Years,"css, jsp, jdbc, hibernate, ajax, jquery, sql, database, java, j2ee, json, mysql, html, director, xml/xsl, javascript, java developer, .net, software developer"
JAVA DEVELOPER,CONNECTING 2 WORK,2025-09-21,Cochin,2-4 Years,"oracle, jee, hibernate, sql, spring framework, spring boot, memory management, java, infrastructure, java ee"
Java Developer,LAKSH HUMAN RESOURCE,2025-09-02,Pune,3-6 Years,"c, bootstrap, technology, java developer, spring, java, oops, j2ee, angularjs"
Java Developers,effitrac solutions pvt ltd,2025-09-19,Coimbatore,1-5 Years,"spring, java, spring mvc, j2ee, jpa, hibernate, sql"
Java Developer,Headhuntersinc consultancy Private Limited,2025-09-04,Chennai,6-10 Years,"gwt, senior software engineer, ajax, java developer, java, j2ee, sql database"
Java Developer,FINITE HR CONSUTING PVT LTD,2025-09-21,Hyderabad,0-3 Years,"css, html5, maven, svn, problem solving, team player, javascript, jquery, sql, wicket, oop, swing, java, xml, j2ee, html"
Java Developer,ITSWS Technologies Pvt. Ltd.,2025-09-04,Noida,1-2 Years,"css, scala, jsp, jdbc, ajax, javascript, jquery, java developer, sql, database, java, servlets, j2ee, mysql, html"
Java Developers,bloom solutions pvt. ltd,2025-09-07,Bengaluru,0-3 Years,"java, php, html, javascript"
java developer,harness digitech private limited,2025-09-06,Coimbatore,0-3 Years,"java, oracle, team player"
Java Developer,ANR SOFTWARE PVT LTD,2025-09-02,Noida,0-3 Years,"oracle, weblogic, java developer, database, java, j2ee, jpa, api"
JAVA Developer,BUSISOL SOURCING INDIA PVT. LTD,2025-09-07,Mumbai,2-3 Years,"css, jsp, jdbc, hibernate, ajax, jquery, sql, database, java, j2ee, json, mysql, html, director, xml/xsl, javascript, java developer, .net, software developer"
Java Developer,BUSISOL SOURCING INDIA PVT. LTD,2025-09-07,Chennai,4-7 Years,"hive, scala, mockito, docker, database, java, j2ee, debugging, mysql, hadoop, big data, mongodb, junit, java developer, nosql, .net, hdfs, unix/linux, angularjs"
JAVA ARCHITECT,kbs consultants,2025-09-20,Mumbai,0-3 Years,"websphere, soa, weblogic, business rules, hibernate, spring, java, struts, j2ee"
Java Developer,Paragyte Technologies,2025-09-02,Pune,2-3 Years,"algorithms, information technology, jsp, hibernate, sql, spring, java, git, oops, mqtt, j2ee, debugging, multithreading, data structures, software engineering, maven, j2se, svn, problem solving, javascript, java developer, gradle, infrastructure, angularjs"
Java Developer,vocso technologies,2025-09-07,Faridabad,3-8 Years,"java, oracle, j2ee, web development, mysql, java developer, nosql"
Java Developer,Hexanika,2025-09-20,Pune,3-6 Years,"team player, java developer, sql, java, linux, java ee, debugging, hadoop, big data, hbase"
Java Developer,Truechip Solutions,2025-09-06,Noida,0-3 Years,"algorithms, jsp, artificial intelligence, fx, java, linux, j2ee, data structures, javafx, rest, rdbms, mobile, machine learning, java developer, spring framework, swing, servlets"
Java Developer,CONNECTING 2 WORK,2025-09-21,Thiruvananthapuram,0-3 Years,"gwt, jee, hibernate, sql, java developer, wicket, spring framework, memory management, java, spring mvc, java ee, jsf"
