Title,Company,Posted on,Location,Experience,Skills
Cloud AI SWE Recruiter,Google India Pvt Ltd,2025-09-30,Ireland,5-6 Years,"ai recruiting expertise, full cycle recruiting, strategic relationship management, data driven insights, job posting, talent acquisition, workforce planning, recruitment, compensation"
Digital AI Workforce Specialist,Microsoft India Pvt Ltd,2025-09-30,Japan,2-4 Years,"ai workforce solutions, consultative selling, customer engagement, sales collaboration, technology adoption, orchestration, information technology"
"AI Recruiter, Cloud",Google India Pvt Ltd,2025-09-30,Singapore,8-11 Years,"technical recruiting, stakeholder management, innovative sourcing, data driven analysis, executive search, job posting, talent acquisition, recruitment, workforce, decision making, compensation"
Senior Analyst - Gen AI,INDEGENE,2025-09-30,Bengaluru,2-4 Years,"llm integration, genai frameworks, python programming, cloud platforms, ai/ml development, fundamentals, java, javascript"
Novel AI Testing Analyst,Google India Pvt Ltd,2025-09-30,Seattle,4-7 Years,"ai testing expertise, data analysis proficiency, job posting, recruitment, workforce, compensation"
Applied AI Engineer (Hybrid),crowdstrike,2025-09-30,Bengaluru,6-9 Years,"ai engineering expertise, software engineering discipline, evaluation frameworks design, retrieval augmented pipelines, orchestration, security, python, adapters, javascript, infrastructure"
Responsible AI Advisor,Microsoft India Pvt Ltd,2025-09-30,Redmond,6-12 Years,"risk management expertise, ethical ai practices, stakeholder engagement, sales enablement strategies, information technology, business analyst, system security, data science, san, consulting, nist"
Cloud Engineer AI,Google India Pvt Ltd,2025-09-30,Bengaluru,3-5 Years,"big data, python, algorithms, scala, software design, data warehousing, storage, cloud computing, infrastructure"
AI-Enabled Visual Designer,Xoxoday,2025-09-29,Bengaluru,3-5 Years,"visual storytelling, brand identity development, digital content creation, conceptual thinking, ideas, cutting, blending"
Artificial Intelligence (AI),EVERYMEDIA ENTERTAINMENT MARKETING PRIVATE LIMITED,2025-09-28,Mumbai,1-4 Years,"ai tool proficiency, digital literacy, time management, appointments, internet"
"Principal Enterprise AI Architect, Enterprise AI Platform - Agentic AI",Nvidia Graphics Pvt Ltd,2025-09-28,Canada,1-4 Years,"ai architecture design, systems integration, data management strategies, security compliance, cloud deployment models, orchestration, sharepoint, salesforce, crm, python, servicenow"
Artificial Intelligence (AI) AI  Empowered Productivity Specialist,every media technologies pvt. ltd.,2025-09-28,Mumbai,1-4 Years,"ai tool proficiency, time management, content enhancement, task automation, appointments, internet"
Cloud AI SWE Recruiter,Google India Pvt Ltd,2025-09-27,Ireland,6-9 Years,"ai talent acquisition, full cycle recruiting, data driven insights, relationship building, job posting, workforce planning, recruitment, compensation"
AI Scientist,Qure.ai,2025-09-27,Bengaluru,1-4 Years,"deep learning optimization, statistical analysis, machine learning implementation, algorithm development, data acquisition protocols, algorithms, natural language processing, artificial intelligence"
"AI Recruiter, Cloud",Google India Pvt Ltd,2025-09-26,Singapore,8-11 Years,"technical recruiting, executive stakeholder management, innovative sourcing strategies, data driven analysis, market dynamics understanding, executive search, job posting, talent acquisition, recruitment, workforce, decision making, compensation"
Software Engineer - AI,CommerceIQ,2025-09-26,Bengaluru,3-5 Years,"ai development, backend services, java programming, cloud architecture, microservices design, security, software engineer, software engineering, python"
Gen AI Architect,HARMAN INTERNATIONAL,2025-09-26,Bengaluru,5-10 Years,"genai solutions, microservices architecture, graphql proficiency, full stack development, production ready systems, innovation, ideas, cutting, action"
Staff Gen AI Engineer,blue yonder,2025-09-26,Dallas,8-10 Years,"full stack development, ai solutions architecture, backend python expertise, restful api design, cloud technologies familiarity, css, orchestration, java, software engineering, html, javascript, docker, database, security, machine learning, infrastructure"
AI Intern,fixigo,2025-09-26,Bengaluru,0-1 Years,"ai/ml foundations, python programming, sql expertise, browser automation, workflow orchestration, algorithms, information technology, artificial intelligence, docker, security, git, data structures, rest, machine learning"
AI Lead,ETHOS,2025-09-26,Bengaluru,5-9 Years,"artificial intelligence, san, python"
Digital Specialist - AI Workforce,Microsoft India Pvt Ltd,2025-09-26,Dallas,3-4 Years,"consultative selling, ai workforce solutions, stakeholder engagement, business strategy development, technical expertise, orchestration, information technology, artificial intelligence, san"
AI and Digital Officer,Wadhwani Foundation,2025-09-26,Delhi,1-4 Years,"digital transformation, ai implementation, strategic advisory, data security, leadership coordination, digital transformation, service delivery, technology infrastructure, project management, collaboration"
AI Solutions Consultant  Industrial,yokogawa electric corp ltd- saudi arabia,2025-09-26,Singapore,5-8 Years,"ai/ml application development, industrial automation expertise, data driven storytelling, stakeholder engagement, recruitment, capability development, employee referral"
AI ML Lead,Fulcrum Digital,2025-09-26,Pune,5-10 Years,"healthcare, agile"
Engineering Manager- Gen AI,Exotel,2025-09-26,Bengaluru,8-10 Years,"team leadership, stakeholder management, software development, code quality assurance, cloud deployment, rest api, java, devops, voip, telecom, mysql, ruby, node.js, infrastructure, php"
AI Business Analyst - AI | AWS | Salesforce (Philippine-based),first advantage offshore services pvt. ltd,2025-09-26,Philippines,3-5 Years,"ai tools familiarity, dashboard development, cross functional collaboration, information technology, bi, business analyst, dashboards, data science, use cases, data analytics, business analysis, tableau"
Director- AI,Wadhwani Foundation,2025-09-26,Delhi,5-8 Years,"generative ai development, predictive ai modeling, advanced prompt engineering, data science leadership, placement"
AI/ML Lead,HARMAN INTERNATIONAL,2025-09-26,Bengaluru,5-7 Years,"natural language processing, machine learning models, python programming, generative ai solutions, cloud deployments (azure/aws), hive, algorithms, orchestration, sql, git, devops, hadoop, big data, mongodb"
LEAD AI ENGINEER,Apexon,2025-09-25,Hyderabad,8-11 Years,"technical leadership, ai/ml solutions, data science workflows, team management, financial services expertise, devops, python, mobile, machine learning"
"AI Software Solutions Engineer (AI Frameworks, Workloads)",Intel,2025-09-25,Bengaluru,10-15 Years,"ai frameworks development, deep learning inference, optimization techniques, algorithms, gcc, advanced c, storage, machine learning, artificial intelligence, infrastructure"
Technical Architect  AI & Gen AI Specialization,Bosch Ltd,2025-09-25,Germany,1-4 Years,"ai expertise generative ai large language models cloud services mlops best practices, artificial intelligence, docker, security, java, devops, rest, python, machine learning, infrastructure"
Senior AI Analyst (AI Trust and Integrity),Onit,2025-09-25,Pune,5-7 Years,"ai risk assessment, ethical compliance, python proficiency, vulnerability identification, data analysis tools, hr"
Full Stack AI Engineer,CGI Information Systems and Management Consultants Pvt Ltd,2025-09-25,Atlanta,5-10 Years,"machine learning, software engineering, system design, api development, python scripting, cgi"
"Data Engineer-AI,ML",Orion Innovation,2025-09-25,Chennai,5-8 Years,"generative ai development, python programming, azure cloud services, machine learning pipelines, data analysis, artificial intelligence, big data, natural language processing, .net"
AI Engineer (Prompt Engineer),Onit,2025-09-25,Pune,4-7 Years,"natural language processing, ai solutions development, business requirement translation, bi, machine learning, javascript, security, node.js"
AI LLM Engineer,CGI Information Systems and Management Consultants Pvt Ltd,2025-09-25,Czech,3-5 Years,"llm development, genai solutions, document data extraction, vision models"
"AI Recruiter, Cloud",Google India Pvt Ltd,2025-09-25,Singapore,8-11 Years,"technical recruiting, stakeholder management, client management, data driven strategy, innovative sourcing, executive search, job posting, talent acquisition, recruitment, workforce, decision making, compensation"
Director AI Acceleration,Onit,2025-09-25,Pune,8-11 Years,"ai integration strategies, project management expertise, stakeholder engagement, data management proficiency, learning, hr, capability development"
Senior AI Engineer,TARGET,2025-09-25,Bengaluru,6-9 Years,"generative ai solutions, performance tuning, machine learning optimization, cross functional collaboration, mentoring engineers, artificial intelligence, python, cloud services, system architecture"
AI Software engineer,GSK,2025-09-25,Bengaluru,5-8 Years,"ai digital twin, agile methodologies, python development, time series modeling, software design, artificial intelligence, software engineer"
Senior AI Engineer,INDEGENE,2025-09-25,Bengaluru,4-7 Years,"data engineering solutions, advanced analytics techniques, data quality assurance, data visualization tools, machine learning models, business requirements, bi, dashboards, sql, statistical modeling, data analysis, tableau, data governance"
Generative AI Architect,Orion Innovation,2025-09-25,Chennai,5-9 Years,"generative ai development, multimodal ai integration, python programming expertise, azure cloud services, foundation model fine tuning, algorithms, user interaction, memory management, data structures, machine learning"
Cloud AI SWE Recruiter,Google India Pvt Ltd,2025-09-25,Ireland,5-6 Years,"full cycle recruiting, data driven insights, complex negotiations, customer relationship management, team collaboration, job posting, talent acquisition, workforce planning, recruitment, compensation"
Senior AI/ML Engineer,BENCHMARK IT SOLUTIONS,2025-09-25,Pune,5-10 Years,"generative ai expertise, large language models, transformer models understanding, coding and problem solving, team leadership abilities, machine learning"
AI Engineering- Vice President,BLACKROCK,2025-09-25,Gurgaon,2-4 Years,"object oriented programming, api development, cloud platforms, agile development, ai/ml solutions, orchestration, java, software engineering, python, kernel, software delivery, messaging, nosql, cassandra"
AI Research Scientist,Intel,2025-09-25,Bengaluru,1-3 Years,"parallel computing, distributed algorithms, machine learning, performance optimization, compiler techniques, artificial intelligence, middleware, system architecture, high performance computing"
Senior Software Engineer - AI,Harness,2025-09-25,Bengaluru,3-6 Years,"backend development, python programming, rest apis, nosql databases, generative ai architecture, orchestration, software engineering, mysql, javascript, servicenow, mongodb, software delivery, machine learning, splunk"
Principal AI/ML Engineer,GSK,2025-09-25,Bengaluru,10-13 Years,"ai/ml project leadership, cloud ai platforms, generative ai techniques, large language models, ai/ml frameworks proficiency, recruitment, recruitment process, interview"
Python AI/ML Developer,Emorphis Technologies,2025-09-25,Indore,3-6 Years,"machine learning applications, deep learning algorithms, language model development, unit testing methodologies, python programming proficiency, natural language processing, software design, security, oops, ooad"
Cloud & AI Solution Engineer - AI Applications,Microsoft India Pvt Ltd,2025-09-25,Canada,3-7 Years,"technical pre sales, ai solutions architecture, cloud native development, application modernization, generative ai expertise, information technology, sql, database, technology management, postgresql, api, kernel"
"AI Software Solutions Engineer (AI Frameworks, Workloads)",Intel,2025-09-25,Bengaluru,5-6 Years,"ai frameworks design deep learning optimization pytorch framework expertise advanced c programming inference workloads profiling, algorithms, python, gcc, storage, machine learning, artificial intelligence, infrastructure"
AI Solution Engineer,AUTOMATION ANYWHERE,2025-09-25,Bengaluru,3-5 Years,"ai solution delivery, deploy ai solutions, data privacy management, cross functional collaboration, prompt engineering & rag, orchestration, sql, security, natural language processing, access management, cloud storage"
AI Developer,IQVIA,2025-09-25,Pune,5-6 Years,"natural language processing, machine learning models, python programming, rest api development, statistical analysis, algorithms, sql, django, consultant"
AI Engineer,Onit,2025-09-25,Pune,6-9 Years,"ai development, machine learning, natural language processing, python programming, bi, javascript, security, node.js"
AI Engineer,TARGET,2025-09-25,Bengaluru,3-4 Years,"python programming, machine learning techniques, natural language processing, code quality assurance, cloud platforms familiarity, django"
Senior AI/ML Engineer,DXC Technologies,2025-09-24,Noida,8-10 Years,"machine learning development, generative ai solutions, nlp techniques, python programming, cloud services (aws), algorithms, natural language processing"
AI Engagement Manager,Adobe Systems Ltd,2025-09-24,Germany,4-10 Years,"customer leadership, digital transformation, ai solutions expertise, agile project management, jira, engagement manager, director, metrics"
Principal AI Engineer,ORACLE,2025-09-24,Mexico,8-10 Years,"api integration, artificial intelligence, machine learning, natural language processing, python programming, security, oracle"
AI Solutions Engineer,TRAFIGURA,2025-09-24,Mumbai,5-8 Years,"machine learning expertise, natural language processing, python proficiency, microservices architecture, sql, nosql, django"
AI - Senior Staff Engineer,Synopsys Inc,2025-09-24,Hyderabad,8-11 Years,"generative ai algorithms, machine learning solutions, technical leadership, data analysis techniques, c, data mining, docker, git, python, production environment"
Specialist Data/AI Engineering,AT&T,2025-09-24,Bengaluru,7-10 Years,"data analysis, bi tools expertise, sql programming, etl processes, cloud technologies, data warehousing, data extraction, unix shell scripting, python scripting, rdbms, team player, unix/linux, reporting tools"
AI/ML Engineer,HARMAN INTERNATIONAL,2025-09-24,Bengaluru,4-5 Years,"ai/ml projects, computer vision, python coding, gan models, innovation, ideas, cutting, action"
"Engineering Manager, AI Innovation and Research, AI/ML",Google India Pvt Ltd,2025-09-24,Bengaluru,8-11 Years,"machine learning leadership, ai model deployment, team management, stakeholder influence, technical project oversight, job posting, recruitment, workforce, decision making"
Head of AI CoE,yokogawa electric corp ltd- saudi arabia,2025-09-24,Eastern,5-7 Years,"ai consultation, pre sales strategies, product development, team management, technology promotion, artificial intelligence"
Staff Engineer - AI Tools,Policygenius,2025-09-24,Bengaluru,3-7 Years,"generative ai research, model infrastructure, multi agent systems, llm fine tuning, ai system architecture, orchestration, artificial intelligence, machine learning"
Generative AI Data Scientist,CGI Information Systems and Management Consultants Pvt Ltd,2025-09-24,Canada,5-9 Years,"generative ai projects, data analytics expertise, risk mitigation strategies, advanced technology development, advanced analytics, cgi, data scientist"
"Engineering Manager, AI Innovation and Research, AI/ML",Google India Pvt Ltd,2025-09-24,Bengaluru,8-11 Years,"machine learning leadership, ai model deployment, team management, stakeholder influence, technical project oversight, job posting, recruitment, workforce, decision making"
"Senior Research Engineer, AI",THOMSON REUTERS CORPORATION,2025-09-24,Bengaluru,3-5 Years,"python programming, ai system development, machine learning implementation, data processing pipelines, research collaboration, algorithms, information retrieval"
Cloud Engineer AI,Google India Pvt Ltd,2025-09-24,Bengaluru,1-5 Years,"machine learning solutions, data structures algorithms, software development python, big data, scala, software design, data warehousing, storage, infrastructure"
Cloud AI SWE Recruiter,Google India Pvt Ltd,2025-09-24,Ireland,5-6 Years,"full cycle recruiting, ai talent acquisition, data driven insights, consultative partnership, job posting, workforce planning, recruitment, compensation"
AI Frameworks Engineer,Intel,2025-09-24,Bengaluru,2-5 Years,"software optimization, ai frameworks, gpu programming, deep learning, performance analysis, h1, job posting"
AI Frameworks Engineer,Intel,2025-09-24,Bengaluru,2-5 Years,"software optimization, ai frameworks, gpu programming, deep learning, performance analysis, h1, job posting"
AWS Conversational AI Designer,Quantiphi,2025-09-24,Bengaluru,1-3 Years,"team collaboration, innovative thinking, customer centric approach, growth mindset, diversity advocacy"
PhD Intern - AI,GE Healthcare Ltd,2025-09-24,Bengaluru,0-1 Years,"large language models, machine learning algorithms, generative ai expertise, prototyping ai solutions, statistical analysis, c, python, team player"
AI Software Engineer- Taiwan,Taboola,2025-09-24,Taiwan,3-6 Years,"ai system design, programming proficiency, distributed systems, algorithms, artificial intelligence, java, debugging, software engineer, data structures, python, infrastructure, forms"
AI Research Engineer/Scientist,Intel,2025-09-24,Bengaluru,5-8 Years,"c/c proficiency, ai/ml frameworks, cellular network protocols, packet processing, algorithms, linux, telecom, python, machine learning, system architecture, infrastructure"
AI/ML Engineer,HARMAN INTERNATIONAL,2025-09-24,Bengaluru,4-5 Years,"ai/ml projects, computer vision, python coding, gan models, innovation, ideas, cutting, action"
Cloud Engineer AI,Google India Pvt Ltd,2025-09-24,Bengaluru,1-5 Years,"machine learning solutions, data structures algorithms, software development python, big data, scala, software design, data warehousing, storage, infrastructure"
PhD Intern - AI,GE Healthcare Ltd,2025-09-24,Bengaluru,0-1 Years,"large language models, machine learning algorithms, generative ai expertise, prototyping ai solutions, statistical analysis, c, python, team player"
Consultant - AI Support Engineer,ASTRAZENECA,2025-09-23,Chennai,2-3 Years,"kubernetes management, python programming, machine learning implementation, devops strategies, storage, security, consultant, infrastructure"
Consultant - AI Support Engineer,ASTRAZENECA,2025-09-23,Chennai,2-3 Years,"kubernetes management, python programming, machine learning implementation, devops strategies, storage, security, consultant, infrastructure"
Software Developer - AI/ML,ORACLE,2025-09-23,Chennai,5-8 Years,"machine learning solutions, python programming, agile methodology, data quality verification, statistical analysis, algorithms, debugging, software engineering, oracle, mining"
Software Developer - AI/ML,ORACLE,2025-09-23,Chennai,5-8 Years,"machine learning solutions, python programming, agile methodology, data quality verification, statistical analysis, algorithms, debugging, software engineering, oracle, mining"
Gen AI Data Scientist,kyndryl,2025-09-23,Bengaluru,5-8 Years,"data analysis techniques, client relationship management, business process understanding, learning, employee referral, volunteer"
Associate Director-AI Science,Verizon Data Services India Pvt Ltd,2025-09-23,Hyderabad,6-9 Years,"data analytics, team leadership, predictive modeling, ai solutions, stakeholder management, algorithms, java, data structures, hadoop, business applications, python, problem solving, production environment"
AI Safety Data Scientist,Google India Pvt Ltd,2025-09-23,Bengaluru,5-8 Years,"data analysis expertise, machine learning proficiency, safe ai implementation, c, sql, database, security, python"
SE-2 Gen AI,Exotel,2025-09-23,Bengaluru,2-4 Years,"cloud solutions expertise, microservices architecture, restful services development, linux application development, data modeling proficiency, c, oop, java, devops, mysql, data structures, software engineering, python, node.js, fundamentals, git, team player, ruby, infrastructure, php"
Gen AI Data Scientist,kyndryl,2025-09-23,Bengaluru,8-11 Years,"data analysis techniques, machine learning expertise, business acumen, statistical modeling, employee referral, volunteer"
Software Engineer - Gen AI,MICRON TECHNOLOGY,2025-09-23,Hyderabad,5-8 Years,"software development, api integration, agile methodologies, conversational ai, problem solving, technology leadership, storage, artificial intelligence, salesforce, java, software engineer, rest, python, mobile, servicenow, soap, sql database"
Cloud Engineer AI,Google India Pvt Ltd,2025-09-23,Bengaluru,3-5 Years,"machine learning solutions, python programming, cloud computing expertise, big data, algorithms, scala, software design, data warehousing, storage, infrastructure"
Lead Consultant - AI Engineer,ASTRAZENECA,2025-09-23,Chennai,5-10 Years,"advanced python, machine learning, data processing, ai model optimization, cloud engineering, algorithms, sql, database, cloud services, nosql"
Data Science - AI Solutions Expert (Adani AI Labs),ADANI GROUP,2025-09-23,Kolkata,5-8 Years,"ai modeling techniques, machine learning algorithms, deep learning applications, predictive maintenance strategies, amp"
"Software Engineer, AI/ML, AI Innovation and Research",Google India Pvt Ltd,2025-09-23,Bengaluru,2-5 Years,"software development, machine learning, ai technologies, data processing, code optimization, algorithms, storage, artificial intelligence, security, system development, debugging, software engineer, software engineering, data structures, natural language processing, information retrieval, mobile"
Principal AI Architect,GE HealthCare,2025-09-23,Bengaluru,8-11 Years,"ai architecture design, generative ai solutions, cloud platforms expertise, machine learning techniques, technical guidance, algorithms, c, storage, security, java, python, natural language processing, infrastructure"
Staff AI Engineer,GE HealthCare,2025-09-23,Bengaluru,5-8 Years,"model deployment, infrastructure design, ci/cd pipelines, performance optimization, data management, algorithms, orchestration, signal processing, docker, security, git, devops, debugging, software engineering, image processing, python, machine learning, opencv"
Staff AI Scientist,GE HealthCare,2025-09-23,Bengaluru,4-7 Years,"machine learning frameworks, data quality assessment, ai model development, statistical methods, data analytics techniques, image processing, algorithms, python, opencv"
"Software Engineer, AI/ML, AI Innovation and Research",Google India Pvt Ltd,2025-09-23,Bengaluru,2-5 Years,"software development, machine learning, ai technologies, data processing, code optimization, algorithms, storage, artificial intelligence, security, system development, debugging, software engineer, software engineering, data structures, natural language processing, information retrieval, mobile"
Associate Director-AI Science,Verizon Data Services India Pvt Ltd,2025-09-23,Hyderabad,6-9 Years,"data analytics, team leadership, predictive modeling, ai solutions, stakeholder management, algorithms, java, data structures, hadoop, business applications, python, problem solving, production environment"
Principal AI Architect,GE HealthCare,2025-09-23,Bengaluru,8-11 Years,"ai architecture design, cloud platforms expertise, machine learning algorithms, generative ai models, programming languages proficiency, c, storage, security, java, python, natural language processing, infrastructure"
AI Safety Data Scientist,Google India Pvt Ltd,2025-09-23,Bengaluru,5-8 Years,"data analysis expertise, machine learning proficiency, safe ai implementation, c, sql, database, security, python"
SE-3 Gen AI,Exotel,2025-09-23,Bengaluru,4-6 Years,"distributed systems expertise, restful services development, oop languages proficiency, c, java, devops, mysql, data structures, software engineering, python, node.js, git, linux, team player, ruby, infrastructure, php"
Novel AI Testing Analyst,Google India Pvt Ltd,2025-09-23,Seattle,4-7 Years,"ai testing strategies, data analysis expertise, risk management, job posting, recruitment, workforce, compensation"
Director AI - Content - WEN,Wadhwani Foundation,2025-09-23,Bengaluru,10-15 Years,"ai product development, project management, cross functional collaboration, user centered design, analytical data interpretation, technical leader, user research, canvas, director, articulate, designing, painting"
Staff AI Scientist,GE HealthCare,2025-09-23,Bengaluru,5-8 Years,"machine learning, deep learning, image processing, algorithm development, medical imaging, c, signal processing, artificial intelligence, python, algorithms, pattern recognition, natural language processing, pathway"
AI Platform Architect,Adobe Systems Ltd,2025-09-23,Bengaluru,5-10 Years,"cloud computing expertise, data ingestion paradigms, ml pipeline design, kubernetes & docker, model finetuning techniques, orchestration, oss, sql, apache, postgresql, devops, mysql, mongodb, python, solution architect, machine learning, javascript"
Software Engineer- ML/AI,APPLE,2025-09-23,Bengaluru,10-13 Years,"machine learning techniques, ai systems development, big data management, java programming, nlp applications, information retrieval, lucene, data warehousing"
Senior AI Scientist,GE HealthCare,2025-09-23,Bengaluru,2-5 Years,"algorithms, problem solving"
