Title,Company,Posted on,Location,Experience,Skills
DevOps / SRE with Python,BAHWAN CYBERTEK,2025-09-30,Bengaluru,3-5 Years,"devops engineering, python programming, ci/cd implementation, cloud platforms, linux administration, docker, infrastructure, unix"
"Senior BI Analyst - Power BI, Python, Databricks & Marketing",blue yonder,2025-09-30,Bengaluru,5-8 Years,"marketing analytics, data visualization, sql querying, python automation, dashboard development, bi, dashboards, data extraction, data science, crm, advanced analytics, data analytics, data analysis, business analytics"
Senior Software Engineer (Java/Python/LLM),Binance,2025-09-30,Singapore,5-8 Years,"data processing, llm optimization, java development, python programming, cloud solutions, hive, orchestration, bi, senior software engineer, sql, security, big data, nosql, sql programming"
"Senior Python DL Automation Engineer, Deep Learning Algorithms",Nvidia Graphics Pvt Ltd,2025-09-30,Poland,5-8 Years,"python programming, deep learning, system design, continuous integration, high performance computing, cloud services, orchestration, infrastructure, devops, linux"
"Software Principal Engineer(C,C  Python,,Linux, IO Device Drivers,SCSI)",Dell India,2025-09-30,Bengaluru,8-12 Years,"linux kernel expertise, device driver development, agile software methodologies, c, python, go programming, storage domain, device drivers, software development life cycle, scsi, software engineering, jira, san, business environment, infrastructure, bug tracking"
Member of Technical Staff - 2 ( Python Backend ),Nutanix,2025-09-30,Bengaluru,2-4 Years,"python programming, backend development, postgresql optimization, api design, cloud technologies, css, html5, storage, hci, docker, devops, rest, javascript, node.js, django, infrastructure, web technologies"
"Senior BI Analyst - Power BI, Python, Databricks & Marketing",blue yonder,2025-09-30,Bengaluru,5-8 Years,"marketing analytics, data visualization, sql querying, python automation, dashboard development, bi, dashboards, data extraction, data science, crm, advanced analytics, data analytics, data analysis, business analytics"
QA Python Automation Engineer,SYNECHRON,2025-09-30,Bengaluru,2-5 Years,"python programming, data validation, db management, snowflake warehousing, databricks analytics, information technology, data warehousing, storage, software requirements, artificial intelligence, sql, database management, git, xml, json, api, big data, gtp, mobile"
Senior Developer - Python,Planful,2025-09-29,Hyderabad,7-10 Years,"python programming, aws services, django framework, postgresql management, restful api integration, iam, devops, debugging, cloud computing, database management system, infrastructure, software developer"
Incorta Lead / Architect,AugmatrixGo,2025-09-29,Hyderabad,10-15 Years,"python, sql, pyspark"
"""Application Developer-Automation.RPA"",Auto Center Manager",lala company,2025-09-29,Bengaluru,4-7 Years,"python, line, pandora"
ETL Developer,AugmatrixGo,2025-09-29,Hyderabad,4-6 Years,"fundamentals, python, bi, sql"
Senior Backend Python Developer,Nvidia Graphics Pvt Ltd,2025-09-29,Israel,5-8 Years,"python development, django framework, microservices architecture, sql proficiency, unit testing, docker, debugging, software engineering, linux networking, computer graphics, infrastructure"
Python Pyspark Fullstack Developer,Sopra Steria,2025-09-29,Bengaluru,4-6 Years,"data analysis methodologies, advanced sql expertise, machine learning model deployment, data mining, java, cloud services, team player, forms"
Career Opportunities: Associate Software Engineer (45407),Incedo Inc,2025-09-29,Mexico,3-5 Years,"python programming, software engineering principles, database technologies, web development frameworks, sql, oop, python scripting, program manager, telecom, nosql, django"
Python Internship in Ahmedabad,Maxgen Technologies,2025-09-28,Ahmedabad,0-1 Years,"django, opps concept"
"Full Stack Developer  Python, Azure",PiMARQ,2025-09-28,Bengaluru,15-18 Years,"c#, python, css, bootstrap, javascript, sql, html, angularjs"
"Sr. Data Engineer (Python, Spark, Hadoop, Hive, 4-7 years' experience)",Visa Inc.,2025-09-27,Bengaluru,5-8 Years,"etl workflow design, big data technologies, hadoop and spark, data pipeline development, production support, hive, security"
Sr. DevOps Engineer - Python Job Job Details | Yash Technologies,Yash Technologies Pvt Ltd,2025-09-27,Pune,3-4 Years,"incident management, python automation, cloud operations, troubleshooting techniques, ci/cd pipelines, orchestration, information technology, docker, devops, servicenow, infrastructure"
Aera Technology - Tech Lead - Python Engineering,Aera Technology,2025-09-27,San,8-11 Years,"python development, distributed systems, cloud native engineering, ci/cd pipelines, database optimization, java, devops, api, github, messaging, nosql, docker, rest, san, problem solving, django"
"Lead Software Engineer, Back End (Python, AWS) at Capital One",CAPITAL ONE FINANCIAL SERVICES CLIENT,2025-09-27,Richmond,7-10 Years,"back end development, cloud computing, microservices architecture, database management, agile methodologies, orchestration, scala, sql, docker, java, software engineer, software engineering, san, python, rdbms, microsoft azure, nosql, node.js, forms"
Software Development Engineer(Python),workday technical consultant,2025-09-27,Atlanta,4-7 Years,"software development, python programming, database management, project management, orchestration, docker, mongodb, github, nosql, infrastructure"
Sr. DevOps Engineer - Python Job Job Details | Yash Technologies,Yash Technologies Pvt Ltd,2025-09-27,Pune,3-4 Years,"incident management, python automation, cloud operations, troubleshooting techniques, ci/cd pipelines, orchestration, information technology, docker, devops, servicenow, infrastructure"
Aera Technology - Tech Lead - Python Engineering,Aera Technology,2025-09-27,San,8-11 Years,"python development, distributed systems, cloud native engineering, ci/cd pipelines, database optimization, java, devops, api, github, messaging, nosql, docker, rest, san, problem solving, django"
Career Opportunities: Associate Software Engineer (45406),Incedo Inc,2025-09-27,Mexico,3-5 Years,"python programming, software engineering principles, database technologies, web development frameworks, sql, oop, python scripting, program manager, telecom, nosql, django"
Senior Python Developer,origin hr,2025-09-27,Mumbai,5-8 Years,"python backend development, microservices architecture, cloud architecture, devops practices, analytical problem solving"
Senior Software Developer - PYTHON - Route Mobile,route mobile ltd,2025-09-27,Mumbai,8-10 Years,"high quality software, analytical thinking, reusable code writing, python proficiency, api development, git, postgresql, senior software developer, mysql, mongodb, team player, javascript, nosql"
Hiring For Python Web Development Python SQL,krazy mantra hr solutions,2025-09-27,Chennai,2-5 Years,"python development, sql server expertise, data engineering, numpy and pandas, rest api integration, web development"
Associate Software Developer Engineer(Python),workday technical consultant,2025-09-27,Atlanta,2-5 Years,"software development, python programming, nosql databases, project tracking, code collaboration, orchestration, docker, github, infrastructure"
"SOFTWARE DEVELOPER - (Backend Developer, Java,Scala, Python, GO lang)",NIELSEN,2025-09-26,Bengaluru,3-5 Years,"software development, programming languages, cloud technologies, data analytics, technical support, orchestration, information technology, scala, sql, java, git, postgresql, linux, mysql, hadoop, big data, python, github, cloud services, oracle, messaging, unix"
Senior Python Data Engineer,Thoucentric,2025-09-26,UK,5-7 Years,"python development, data analysis, pandas expertise, modular design, automated testing, business rules, git, github"
"Senior Software Engineer, Backend (Python, Lua, AWS at Capital One",CAPITAL ONE FINANCIAL SERVICES CLIENT,2025-09-26,Richmond,3-5 Years,"backend development, cloud technologies, agile practices, api integration, programming languages, orchestration, scala, senior software engineer, sql, docker, java, software engineering, san, python, rdbms, javascript, nosql, gateway, forms"
Python Developer  Contract,CONNECTING 2 WORK,2025-09-26,Thiruvananthapuram,3-5 Years,"python, rest api, storage, javascript, security, django, git, data structures, mysql, html, mongodb"
"Software Engineer ( Java , Python , SQL , AWS / Oracle)",NIELSEN,2025-09-26,Bengaluru,3-5 Years,"software development, agile methodologies, technical documentation, cloud integration, legacy technology, scala, sql, java, postgresql, devops, shell scripting, mysql, big data, python, oracle, grails, javascript, messaging, struts, unix/linux"
Python/ Django Developer,CONNECTING 2 WORK,2025-09-26,Thiruvananthapuram,2-3 Years,"security compliance, python, github, html5, storage, javascript, security, database, django, debugging, mysql, mongodb"
Python API Developer,Movate technologies limited,2025-09-26,Chennai,8-12 Years,"unit test development, agile/scrum practices, code scalability, cross functional collaboration, technical documentation, python, api"
"DevOps Engineer (Terraform, Jenkins, GitLab CI/CD, Python, Airflow)",NIELSEN,2025-09-26,Bengaluru,3-5 Years,"ci/cd pipeline development, containerization technologies, automation scripting, configuration management, orchestration, devops, software engineering, c#, python, messaging, docker, security, cloud services, software delivery"
"Sr. Software Engineer (Python, Networking, Linux, Databases)",forcepoint,2025-09-26,Mumbai,3-5 Years,"software design expertise, agile methodologies, project lifecycle management, python programming, c, sql, security, database, linux, software delivery"
Module Lead - Python Job Job Details | Yash Technologies,Yash Technologies Pvt Ltd,2025-09-26,Bengaluru,7-10 Years,"python fundamentals, rest api development, database management, version control git, cloud computing aws, sql, postgresql, data structures, mysql"
Junior Python Developer / Senior Python Developer - Chennai,elk education consultants private limited,2025-09-26,Chennai,0-3 Years,"python django machine learning data analytics network security, ece, team player, sql, database"
"Python Developer (Unix Shell Scripting, SQL/ Big Data)",FIS,2025-09-26,Bengaluru,7-10 Years,"python development, sql queries, shell scripting, hive, security, unix shell scripting"
"Senior Software Engineer ( Java , Python , SQL , AWS / Oracle)",NIELSEN,2025-09-26,Bengaluru,5-7 Years,"software development, agile methodologies, legacy technologies, cloud integration, technical documentation, scala, sql, java, postgresql, senior software developer, devops, shell scripting, mysql, big data, python, oracle, grails, javascript, messaging, struts"
PYTHON Developer,INFINITY GROUP,2025-09-26,Noida,2-5 Years,"python, css, django, html, bootstrap"
"DevOps Engineer (Terraform, Jenkins, GitLab CI/CD, Python, Airflow)",NIELSEN,2025-09-26,Bengaluru,3-5 Years,"ci/cd pipeline development, containerization technologies, automation scripting, configuration management, orchestration, devops, software engineering, c#, python, messaging, docker, security, cloud services, software delivery"
"Staff Data Engineer (8  Years, Java, Python, Spark)",Visa Inc.,2025-09-26,Bengaluru,5-10 Years,"full stack development, machine learning, containerization technologies, data engineering, restful apis, scala, docker, java, hadoop, spring boot"
Sr Python Developer,Hotelogix,2025-09-26,Bengaluru,8-11 Years,"python development, django framework, database design, api development, linux environments, git, web development, mysql, hbase, oracle, ubuntu, mobile"
Sr. Python Automation Engineer,HARMAN INTERNATIONAL,2025-09-26,Bengaluru,5-8 Years,python automation
Python test automation with ROBO,HARMAN INTERNATIONAL,2025-09-26,Bengaluru,6-9 Years,"automation testing, python programming, robot framework, ci/cd tools, problem solving, automation test engineer, test automation, linux, jenkins, agile"
"Senior Data Engineer - (Big Data, Spark, Scala, Java, Python, Cassandra, Elasticserach, AWS, Airflow, RDBMS, SQL)",NIELSEN,2025-09-26,Bengaluru,4-8 Years,"cloud implementation expertise, big data development, software development proficiency, orchestration, information technology, apache, java, devops, software engineering, shell scripting, mysql, python, oracle, messaging, cassandra, unix/linux"
Full Stack Developer - Python Javascript,SRIJAN TECHNOLOGIES,2025-09-26,Bengaluru,5-8 Years,"front end development, back end development, api integration, database management, ci/cd pipeline, css, xml, html, data structures, image processing, python, imaging, javascript, nosql, node.js, .net, unix, algorithms, jquery, linux, json, debugging, mongodb, cloud services, gateway"
Python Developer,Hotelogix,2025-09-26,Bengaluru,3-5 Years,"python coding, web application development, mvc architecture, api development, database design, html5, storage, javascript, security, django, git, testing tools, debugging"
Senior Python Engineer - Analytics Platform,workday technical consultant,2025-09-26,Czech,6-9 Years,"backend development, performance optimization, data pipeline design, architecture software design, bi, docker, spring, security, java, linux, python"
"Analyst, Product Strategist (Python - Automation)",BLACKROCK,2025-09-26,Gurgaon,1-3 Years,"portfolio management, performance analytics, python programming, data management, database"
Python test automation with ROBO,HARMAN INTERNATIONAL,2025-09-26,Bengaluru,6-9 Years,"automation testing, python programming, robot framework, ci/cd tools, problem solving, automation test engineer, test automation, linux, jenkins, agile"
Full Stack Developer - Python Javascript,SRIJAN TECHNOLOGIES,2025-09-26,Bengaluru,5-8 Years,"front end development, back end development, api integration, database management, ci/cd pipeline, css, xml, html, data structures, image processing, python, imaging, javascript, nosql, node.js, .net, unix, algorithms, jquery, linux, json, debugging, mongodb, cloud services, gateway"
Sr. Software Engineer - AWS Python Pyspark Job Job Details | Yash Technologies,Yash Technologies Pvt Ltd,2025-09-26,Bengaluru,3-4 Years,"aws services, data integration, python development, pyspark proficiency, sql queries, apache, devops, software engineer, mysql, mongodb, github, cloud services, oracle, nosql"
Sr. Python Automation Engineer,HARMAN INTERNATIONAL,2025-09-26,Bengaluru,5-8 Years,python automation
"Analyst, Product Strategist (Python - Automation)",BLACKROCK,2025-09-26,Gurgaon,1-3 Years,"portfolio management, performance analytics, python programming, data management, database"
"Sr. Software Engineer (Python, Networking, Linux, Databases)",forcepoint,2025-09-25,Mumbai,5-10 Years,"cloud native security, zero trust implementation, data protection strategies, regulatory compliance, cybersecurity awareness, job posting"
"Data Engineer (Python, SQL, AWS & Data Warehousing Expert) & ETL Tester",SYNECHRON,2025-09-25,Pune,7-10 Years,"python proficiency, sql expertise, cloud technologies, etl development, data warehousing, orchestration, rdbms, machine learning, management systems"
"Sr. Analytics Engineer - AI, Python, SQL, Semantic layers",blue yonder,2025-09-25,Bengaluru,5-8 Years,"data architecture design, sql query optimization, data modeling expertise, python data processing, delta, implementation, documentation, planning, maintenance"
QA Python Automation,SYNECHRON,2025-09-25,Bengaluru,3-5 Years,"python programming, data validation techniques, db database management, snowflake data warehousing, databricks big data processing, information technology, storage, software requirements, artificial intelligence, sql, git, xml, json, api, gtp, mobile"
Python Software Engineer,Zeta Global,2025-09-25,Hyderabad,5-8 Years,"python programming, software development, agile methodologies, debugging techniques, unit testing, conference, artificial intelligence, security, software engineer, html, san, mobile"
PySpark Python Consultant,IQVIA,2025-09-25,Bengaluru,5-7 Years,"pl/sql programming, data analysis tools, project management, statistical analysis, algorithms, python, sas, logical thinking"
Senior Software Engineer (Python/AWS),ELSEVIER,2025-09-25,Chennai,5-9 Years,"python programming, cloud computing, sql proficiency, agile methodologies, code review practices, senior software engineer, git, software engineering, forms"
"Sr Associate Data Analysis (Full Stack Developer- Python, React JS/Angular JS)",AT&T,2025-09-25,Bengaluru,3-5 Years,"python development, ui development, restful apis, database management, version control, css, orchestration, software design, data warehousing, sql, docker, security, git, postgresql, devops, debugging, html, github, cloud services, microsoft azure, javascript, nosql, software support"
"Senior Data Engineer- (AWS, Pyspark, Python, Redshift)",GLOBALFOUNDRIES,2025-09-25,Bengaluru,2-5 Years,"data warehousing design, aws cloud integration, performance tuning, pl/sql development, etl framework design, database management, python, cloud services"
"Technologist, Test Engineering ( Python, Automation.  Storage(servers/ Array), Platform, NVME",WESTERN DIGITAL,2025-09-25,Bengaluru,1-4 Years,"qa automation testing, firmware debugging, protocols expertise, operating systems troubleshooting, software development life cycle, security, scsi, linux, san, sas, windows, white box testing, infrastructure, agile"
Engineering Manager - Full Stack Development (Proficient in Python),Silicon Labs,2025-09-25,Hyderabad,8-9 Years,"full stack development, software quality advocacy, agile methodologies, python & reactjs, team leadership, test automation, software development life cycle, linux administration, software engineering, jira, testing, sdlc, system security, test data, jenkins, infrastructure, user acceptance"
QA Python Automation Engineer,SYNECHRON,2025-09-25,Bengaluru,2-5 Years,"python programming, data validation techniques, db database management, snowflake solutions, databricks analytics, information technology, data warehousing, storage, software requirements, artificial intelligence, sql, git, xml, json, api, big data, gtp, mobile"
Senior Software Engineer- Python,Clarivate,2025-09-25,Bengaluru,3-5 Years,"python programming, flask framework, database management, object oriented programming, oop, data extraction, postgresql, web api"
Software Engineer - Python,Onit,2025-09-25,Pune,3-7 Years,"python development django framework api integration aws services agile methodologies, fundamentals, salesforce, postgresql, github, cloud services, dash"
Senior Python Developer,Tranzmeo It Solutions,2025-09-25,Cochin,3-6 Years,"python, rdbms, machine learning, docker, git, oops, debugging, hadoop, big data"
Python Developer,SEVEN CONSULTANCY,2025-09-25,Chennai,1-4 Years,"rest, python, oracle, sybase, bi, storage, javascript, nosql, sql, python scripting, java, xml, linux, mysql, unix"
QA Python Automation,SYNECHRON,2025-09-25,Bengaluru,3-5 Years,"python programming, data validation techniques, db database management, snowflake data warehousing, databricks big data processing, information technology, storage, software requirements, artificial intelligence, sql, git, xml, json, api, gtp, mobile"
PySpark Python Consultant,IQVIA,2025-09-25,Bengaluru,5-7 Years,"pl/sql programming, data analysis tools, project management, statistical analysis, algorithms, python, sas, logical thinking"
Python Software Engineer,Zeta Global,2025-09-25,Hyderabad,5-8 Years,"python programming, software development, agile methodologies, debugging techniques, unit testing, conference, artificial intelligence, security, software engineer, html, san, mobile"
Python Developer,IQVIA,2025-09-25,Bengaluru,2-4 Years,"python programming, aws lambda, ci/cd processes, azure services, team player"
"Senior Data Engineer- (AWS, Pyspark, Python, Redshift)",GLOBALFOUNDRIES,2025-09-25,Bengaluru,2-5 Years,"data warehousing design, aws cloud integration, performance tuning, pl/sql development, etl framework design, database management, python, cloud services"
"Senior Full Stack Engineer- Salesforce Development- Python, JavaScript / Typescript",workday technical consultant,2025-09-25,Atlanta,5-9 Years,"salesforce implementation, api development, data management, security measures, performance optimization, apex, apache, visualforce, python, triggers, javascript, messaging, soap, sql, json, crm, rest, infrastructure"
"API Developer (Python, AWS, RESTful APIs, Pandas, Docker, Kubernetes)",SYNECHRON,2025-09-25,Gurgaon,4-5 Years,"python programming api development data manipulation cloud technologies version control, orchestration, information technology, docker, sql, database, git, postgresql, debugging, mysql, shell scripting, team player"
Associate - Investment Performance Analysis (Python Experience),BLACKROCK,2025-09-25,Gurgaon,4-7 Years,"risk management practices, regulatory reporting compliance, data visualization tools, bi, sql, debugging, exceptions, production support"
Associate - Investment Performance Analysis (Python Experience),BLACKROCK,2025-09-25,Gurgaon,4-7 Years,"risk management practices, regulatory reporting compliance, data visualization tools, bi, sql, debugging, exceptions, production support"
"Technologist, Test Engineering ( Python, Automation.  Storage(servers/ Array), Platform, NVME",WESTERN DIGITAL,2025-09-25,Bengaluru,1-4 Years,"qa automation testing, firmware debugging, protocols expertise, operating systems troubleshooting, software development life cycle, security, scsi, linux, san, sas, windows, white box testing, infrastructure, agile"
"Technologist, Test Engineering - Platform , (Server/ Storage) Automation, Python, (NVME/ PCIe)",WESTERN DIGITAL,2025-09-25,Bengaluru,1-4 Years,"server storage qa, firmware testing, operating systems, software development life cycle, security, scsi, linux, qa automation, san, sas, windows, white box testing, infrastructure, agile"
Software Engineer in Python and SQL,institutional shareholder services,2025-09-25,Mumbai,3-5 Years,"python development, sql implementation, rest apis, git source control, cloud technologies, orchestration, hosting, software engineer, django"
"ION Group - Senior Python Developer, Budapest",ion trading india pvt. ltd.,2025-09-25,Hungary,8-11 Years,"python development, microservices architecture, cloud native applications, agile methodologies, data streaming technologies, rest api, docker, sql, oop, database, software engineering, multithreading, mongodb, messaging"
Hiring For Python Developer,krazy mantra hr solutions,2025-09-25,Chennai,1-4 Years,"python programming, data structures, oops concepts, restful api, django/flask, curl, rdbms, mysql"
Python AI/ML Developer,Emorphis Technologies,2025-09-25,Indore,3-6 Years,"machine learning applications, deep learning algorithms, language model development, unit testing methodologies, python programming proficiency, natural language processing, software design, security, oops, ooad"
Senior Software Engineer - Python,Onit,2025-09-25,Pune,5-8 Years,"python development, api integration, software quality, agile methodologies, cloud services, fundamentals, salesforce, postgresql, github, django, dash"
Software Engineer  Dev Python AI/ML  REQ/0749 | Sysvine Technologies,Sysvine Technologies,2025-09-25,Chennai,3-8 Years,"python development, ai/ml implementation, model optimization, data structures, unit testing, software design, oop, postgresql, xml, games, debugging, software engineer, mysql, oracle, mobile"
"Consultant - Product Management - AI/ML (Python, SQL, Tableau, GenAI)",Verizon Data Services India Pvt Ltd,2025-09-25,Chennai,7-10 Years,"ai technologies, product management, data analytics, bb acumen, strategic thinking, sql, data extraction, design thinking, consulting, predictive analytics, statistical analysis"
QA Python Automation Engineer,SYNECHRON,2025-09-25,Bengaluru,2-5 Years,"python programming, data validation techniques, db database management, snowflake solutions, databricks analytics, information technology, data warehousing, storage, software requirements, artificial intelligence, sql, git, xml, json, api, big data, gtp, mobile"
Senior Software Engineer- Python,Clarivate,2025-09-25,Bengaluru,3-5 Years,"python programming, flask framework, database management, object oriented programming, oop, data extraction, postgresql, web api"
Senior Software Engineer (Python/AWS),ELSEVIER,2025-09-25,Chennai,5-9 Years,"python programming, cloud computing, sql proficiency, agile methodologies, code review practices, senior software engineer, git, software engineering, forms"
Position title Full-Stack Developer  MERN Stack   Python APIs,grazitti interactive,2025-09-25,Panchkula,3-5 Years,"full stack development, python api development, restful services understanding, version control (git), agile methodologies familiarity, react.js, node.js, security, devops, debugging, mongodb, express.js"
Software Engineer Senior - (Java/.Net/Python) 7 to 10 years (Bangalore/Indore),Worldpay,2025-09-25,Bengaluru,7-10 Years,"java/, net/python development, ai & cloud technologies, rest apis & microservices, agile methodology understanding, security, devops, software engineer, .net"
Python Developer,SEVEN CONSULTANCY,2025-09-25,Hyderabad,0-3 Years,"rest, python, web developer, storage, software developer"
Member of Technical Staff - QA Automation [8  YoE in Python Automation Testing],Nutanix,2025-09-25,Bengaluru,8-11 Years,"python automation testing, api testing tools, system performance evaluation, test automation framework, qa, usability, java, qa automation, test case development, logging, agile, performance testing, test cases, test scripts, software quality, storage, jmeter, writing, linux"
