Title,Company,Posted on,Location,Experience,Skills
"Lead Engineer-c#,Azure services, sql-7 Yrs-Mumbai(Hybrid) job in",crescendo global,2025-08-09,Mumbai,7-9 Years,"c# programming, azure services, sql proficiency, data engineering, agile methodologies, java, devops, software engineering, api, python, software delivery, nosql, .net"
Decision Analytics-Power BI & SQL-5  Years-Gurugram job in Gurgaon,crescendo global,2025-08-12,Gurgaon,6-10 Years,"decision analytics, power bi, sql, project management, insurance analytics, leadership hiring, recruitment, senior level"
Lead ETL Developer,"pegasus knowledge solutions india pvt ltd.,",2025-09-20,Bengaluru,8-10 Years,"oracle pl/sql, data warehousing, sql, oracle apex, software engineering, integration developer, oracle, production environment"
Data Analyst,Analytics Vidhya,2025-09-07,Mumbai,4-8 Years,"sas, consulting, program management, mobile, data analyst, sql, sas/sql"
"Micro Focus Cobol / MF-Cobol with Oracle, SQL, PLSQL",infinity business solutions pvt ltd,2025-09-20,Pune,5-7 Years,"micro focus cobol, mf cobol, oracle, sql, plsql, oracle pl/sql, oracle application server, sun solaris, plsql, internet technologies, unix scripting, database, security, windows nt, java, xml, system development, j2ee, project life cycle, software engineer, reports 6i, oracle forms, problem solving, triggers"
ETL Lead,CONNECTING 2 WORK,2025-08-21,Thiruvananthapuram,7-10 Years,"problem solving, sql, security"
Data Integration Lead/Developer (Talend & Hive),PiMARQ,2025-08-28,Bengaluru,15-18 Years,"hive, bi, sql, database, apache, git, devops, hadoop, api, big data, github, os, sql scripting"
"Job Posting Title Sr Associate Data Analysis (AI/ML, Python & SQL)",AT&T,2025-08-07,Bengaluru,3-5 Years,"data integration, sql & python, machine learning frameworks, data mapping rules, bi reporting tools, cloudera, data mining, data administration, apache, distributed databases, mysql, shell scripting, big data, team player, nosql, cassandra, unix/linux"
"Technical Program Manager, Big Data Analytics, Measured Work",Google India Pvt Ltd,2025-09-19,Mexico,2-5 Years,"program management, big data analytics, sql proficiency, data processing, technical expertise, program manager, python, javascript, sql programming"
Dot Net Developer,v support solutions,2025-09-20,Chennai,2-5 Years,"css, bootstrap, ajax, t-sql, sql, xml, asp.net, sql developer, html, api, mvc, c#, rest, entity framework, javascript, visual studio, .net, c#.net, angularjs, software developer, soap"
Senior .NET Developer (SQL Server / AWS),Sonata Software Ltd,2025-08-15,Bengaluru,7-10 Years,"net development, c# programming, aws services, entity framework, javascript frameworks, html5, jquery, docker, sql, security, devops, web api, kendo ui, .net"
"Application Support (SQL, Excel)",FIS,2025-09-20,Mumbai,2-5 Years,"microsoft excel proficiency, customer service orientation, recruitment, workforce"
Product Analyst/Business Analyst - SQL/Power BI/Power Query -,crescendo global,2025-08-27,Bengaluru,2-7 Years,"sql proficiency, power bi expertise, business requirements analysis, stakeholder engagement, kpi monitoring, business analyst, use cases, brd, product analyst, frs, gap analysis, business analysis, user training"
Converse Placement Services India Pvt. Ltd.,Converse Placement services,2025-09-21,Chennai,6-9 Years,"oracle retail, cloud applications, sql and pl/sql, rest api, java, shell scripting, software engineer, weblogic, infrastructure, oracle sql"
PL/SQL Developer & DBA - Expert in Oracle Administration & Scalable Data Architecture,SYNECHRON,2025-09-23,Pune,6-9 Years,"pl/sql optimization, database administration, data architecture, data integration, programming languages, cloudera, information technology, scala, security, oracle administration, hadoop, big data, pl/sql developer, python"
"Senior Data Quality Analyst with Python or R, SQL",institutional shareholder services,2025-08-26,Mumbai,6-9 Years,"data quality analysis, model verification strategy, analytical programming (python/r), project management, stakeholder collaboration, recruitment, performance analysis, performance appraisals, compensation"
Production Support (SQL) - IT,Flex,2025-09-19,Chennai,5-8 Years,"customer oriented mindset, lean process improvement, recruitment, mapping, interview"
Java - Senior Software Engineer,FMT CORPORATION LIMITED,2025-09-20,United,6-8 Years,"websphere, ant, weblogic, senior software engineer, jee, hibernate, sql, messaging, spring, java, xml, pl/sql"
"ETL Automation & Manual Testing Engineer (Database: MS SQL, Postgres; Azure: Synapse, ADF)",AT&T,2025-09-14,Bengaluru,5-8 Years,"test planning manual testing domain expertise azure synapse postgresql, test cases, test data, database, writing, user acceptance testing, jira, sql queries, automation testing, data integrity, database testing, agile"
"Module Lead - SQL, Snowflake Job Job Details | Yash Technologies",Yash Technologies Pvt Ltd,2025-09-03,Pune,5-7 Years,"sql server development, snowflake integration, data modeling expertise, etl process management, performance tuning, business intelligence, data quality, ssis, data integration, bi, data warehousing"
"Infrastructure Analyst, SQL DBA",NatWest Group,2025-09-20,Chennai,4-7 Years,"database administration, mssql management, agile environment, risk mitigation, t-sql, devops, python, windows, infrastructure, unix"
Database developer  SQL Server,ESN TECHNOLOGIES,2025-09-19,Hyderabad,1-4 Years,"data warehousing, sql, database, data modeling, etl, ssas, database security, integration services, ssis"
Team Member-MIS-Credit Card-Marketing HO,Kotak Mahindra Bank,2025-09-19,Mumbai,3-5 Years,"ms sql/my sql queries, auditing and reporting"
Hiring For Hadoop Developers,krazy mantra hr solutions,2025-09-04,Bengaluru,1-5 Years,"hadoop, scala, spark, sql, java"
Decision Analytics-Power BI & SQL-5  Years-Gurugram job in Gurgaon,crescendo global,2025-08-02,Gurgaon,6-10 Years,"decision analytics, power bi, sql, project management, insurance analytics, leadership hiring, recruitment, senior level"
Data base Developer - Senior Associate,State Street,2025-09-19,Hyderabad,7-10 Years,"pl/sql coding, t sql procedures, data warehouse concepts, performance tuning, agile methodology, problem solving, triggers, t-sql, database, debugging"
Test Engineer - Python / SQL,krazybee,2025-09-13,Bengaluru,2-3 Years,"api testing, sql database testing, test case writing, python automation, defect logging, automation test engineer, regression testing, test cases, test reporting, system testing, bug tracking, writing test cases"
"Senior Software Engineer - SQL, Snowflake, Python - Bangalore",Photon,2025-09-19,Bengaluru,3-5 Years,"sql optimization, snowflake projects, python scripting, aws services, data migration, oracle, orchestration, information technology, infrastructure"
"Consultant - Product Management - AI/ML (Python, SQL, Tableau, GenAI)",Verizon Data Services India Pvt Ltd,2025-08-28,Chennai,7-10 Years,"ai technologies, product management, data analytics, bb acumen, strategic thinking, sql, data extraction, design thinking, consulting, predictive analytics, statistical analysis"
Senior Software Engineer (Rust),Earlyjobs,2025-09-18,Bengaluru,5-10 Years,"sql, aws, java"
Hiring For Python Web Development Python SQL,krazy mantra hr solutions,2025-08-27,Chennai,2-5 Years,"python development, sql server expertise, data engineering, numpy and pandas, rest api integration, web development"
"Lead Engineer-c#,Azure services, sql-7 Yrs-Mumbai(Hybrid) job in",crescendo global,2025-08-02,Mumbai,7-9 Years,"c# programming, azure services, sql proficiency, data engineering, agile methodologies, java, devops, software engineering, api, python, software delivery, nosql, .net"
"Senior Software Engineer - Bigdata ( Java/Scala , Spark, SQL , AWS)",NIELSEN,2025-08-24,Bengaluru,4-8 Years,"cloud implementation, big data analytics, agile methodologies, software development, mentorship and coaching, orchestration, information technology, apache, java, devops, software engineering, shell scripting, mysql, python, oracle, unix/linux, hive, scala, docker, security, git, postgresql"
"ETL (AWS Glue)/Informatica-Redshift ,Java ,SQL",NIELSEN,2025-08-26,Bengaluru,5-8 Years,"aws glue expertise, informatica proficiency, java programming, messaging"
Oracle PLSQL Developer,LINKTAG,2025-09-21,Pune,3-4 Years,"plsql development, sql queries, technical"
"Database Service Software Engineer - SQL, C# &.Net",SALESFORCE,2025-09-23,Bengaluru,5-8 Years,"c# programming, net framework, cloud scale services, database management, performance troubleshooting, orchestration, docker, salesforce, security, postgresql, software engineering, api, crm, problem solving, infrastructure, .net"
Associate Data Engineer,COMMONWEALTH BANK,2025-09-23,Bengaluru,2-4 Years,"data warehouse/etl understanding, sql and t sql expertise, data quality assessment, information technology, bi, t-sql, ssrs, python"
"Senior Manager - AI/ML - Tech Strategy (GenAI, SQL, Python)",Verizon Data Services India Pvt Ltd,2025-08-20,Hyderabad,10-13 Years,"ai technology expertise, data analysis competence, leadership and negotiation, cross functional collaboration, bi, product roadmap, dashboards, sql, data science, use cases, tableau"
"Software Engineer Senior (Power BI, SQL, Tableau), 7 to 10 Years, Bangalore/Indore",Worldpay,2025-08-25,Bengaluru,7-10 Years,"data analysis expertise, data visualization, power bi proficiency, sql & tableau, data warehousing, dashboards, security, data analytics, user training, data governance"
Lead Dot Net core & SQL Developer,IQVIA,2025-09-23,Bengaluru,10-14 Years,"project management, client relationship management, software development, team leadership, problem solving, css, bug fixing, asp.net, web api, javascript, angularjs, soap, jquery, sql, git, microsoft .net, mvc, rest, entity framework"
SQL Server Database Administrator,information dynamics india pvt ltd.,2025-09-20,Chennai,4-7 Years,"rdbms, mvp, ms sql server, sql server, database design, security"
"Sr. Systems Architect (Cloud) - MS SQL, DBA",blue yonder,2025-09-05,Bengaluru,9-13 Years,"sql server optimization, performance tuning, database security, automation development, troubleshooting expertise, supply chain solutions"
Senior Product Manager - Technical,MASTERCARD,2025-08-26,Vadodara,5-10 Years,"product development, agile methodologies, sql querying, user story creation, security, sql queries, metrics"
"Software Engineer II (4  yrs experience into .Net,SQL,ASP.Net,MVC) Pune location",Worldpay,2025-09-20,Pune,5-8 Years,"net development, c# programming, asp, net core, ci/cd tools, ms sql server, software design, fx, database, security, oops, asp.net, debugging, .net developer"
Database Administrator - MSSQL,Relyon Softech Ltd,2025-09-08,Bengaluru,3-4 Years,"dba, database administrator, sql"
Power BI Developer  Consumer Insights,CONNECTING 2 WORK,2025-09-21,Thiruvananthapuram,2-3 Years,"bi, sharepoint, sql, security, microsoft azure"
Senior Software Developer,S&P Global,2025-08-26,Hyderabad,6-9 Years,"software development, database technologies, agile methodologies, java programming, sql proficiency, microsoft technologies, t-sql, senior software developer, pl/sql, python, oracle"
Asp.Net Developer,CONNECTING 2 WORK,2025-09-21,Thiruvananthapuram,2-3 Years,"oracle, asp.net, sql"
Technical Architect - Middleware Support/SQL/Python/MuleSoft,blue yonder,2025-09-20,Bengaluru,6-10 Years,"python development, mulesoft integration, sql proficiency, performance tuning, salesforce, api, adapters, linux operating system, mq, messaging, soap, message broker, database, middleware, rest, windows, production support, esb, splunk"
"Software Engineer AWS Cloud, SQL, Scripting - BLR",Photon,2025-09-23,Bengaluru,6-9 Years,"aws cloud, oracle pl/sql, autosys control m, incident management, python, triggers, control-m, java, apache, unix/linux"
Power BI Developer  Finance / Sales Reporting,CONNECTING 2 WORK,2025-09-21,Thiruvananthapuram,2-3 Years,"bi, sharepoint, sql, security, microsoft azure"
"Sr. Business Analytics Analyst - (Power BI, SQL)",blue yonder,2025-09-19,Bengaluru,3-5 Years,"data analytics, visualization tools, sql proficiency, python programming, advanced analytics, bi, dashboards, data extraction, data science, data visualization, data analysis, business analytics, analyst"
Senior Specialist Software Engineering - PL/SQL Developer,AT&T,2025-09-13,Bengaluru,4-5 Years,"pl/sql development, database optimization, performance tuning, data modeling, agile methodologies, information technology, system development, software engineering, mysql, pl/sql developer, github, oracle, triggers, database programming, delivery management, sql programming, security"
".Net Fullstack (.Net Core, C#, Web API, SQL Server, Angular & AWS/Azure)",CARRIER,2025-09-19,Hyderabad,4-6 Years,"net framework, web api development, angular framework, sql database management, agile methodologies, microsoft technologies, soa, git, asp.net, mongodb, c#, rest, github, entity framework, problem solving, visual studio, c#.net, soap"
Pre-Sales Consultant - Business Intelligence,Germane Analytics Pvt Ltd,2025-09-21,Bengaluru,5-8 Years,"c, bi, business intelligence, sql, dwh, etl tool, pl/sql"
Analyst I - Applications Programming,Bank of America,2025-08-23,Hyderabad,5-7 Years,"sharepoint proficiency, javascript expertise, risk management, nintex, t-sql, jquery, hadoop, oracle"
".Net Fullstack Developer (.Net, Angular, C#, Sql, Web API & Cloud  AWS /Azure)",CARRIER,2025-09-19,Hyderabad,4-6 Years,"web api development, angular framework proficiency, sql server management, cloud application exposure, microsoft technologies, soa, git, asp.net, mongodb, c#, rest, github, entity framework, problem solving, visual studio, c#.net, soap"
"Software Engineer - Bigdata ( Java/Scala ,Python, Spark, SQL, AWS )",NIELSEN,2025-08-24,Bengaluru,3-5 Years,"cloud architecture expertise, big data processing, unit & integration testing, orchestration, java, apache, devops, shell scripting, mysql, python, messaging, unix/linux, software developer, scala, storage, security, postgresql, json"
SAS Business Analyst,Elshaddai Global Solutions,2025-09-20,Trichy,1-2 Years,"dml, sas, data mining, ddl, sql"
Technical Lead,PTC,2025-08-25,Pune,6-8 Years,"sql & pl/sql development, database design optimization, performance tuning, troubleshooting & debugging, team collaboration, rest api, plsql, java, sql developer, toad, team player, oracle sql"
Oracle PL/SQL Developer,Kaarya Consulting Services Pvt Ltd,2025-09-20,Hyderabad,3-5 Years,"oracle pl/sql, debugging, programming language"
Data Analyst: Sql  Tableau,Analytics Vidhya,2025-09-07,Bengaluru,2-5 Years,"rdbms, oracle, sql, database"
Aws Developer,realizer technologies,2025-09-19,Pune,0-3 Years,"python, sql, ruby, java, linux, cloud storage, hadoop, big data, sql database"
Job Opening in Java and PL/SQL For Interns (Job Code RT 1455).,radical technologies,2025-08-24,Pune,0-3 Years,"java development, pl/sql basics, problem solving ability, team collaboration, information technology, consultant, infrastructure, debugging"
"Lead Software engineer - (GoLang/Java, Chef, Jenkins, Linux, Spring , SQL, Teleport , PAM , Terraform)",MASTERCARD,2025-08-31,Pune,8-12 Years,"software development expertise, java and spring, golang proficiency, linux environment, project life cycle, python, sql, security, git, software engineer, access management, ruby, splunk"
Software/Senior Software Engineers,infinity business solutions pvt ltd,2025-09-20,Bengaluru,2-5 Years,"spring java, mysql, oracle sql/ms sql, web application development, client server architecture, fundamentals, oracle, client server, sql, spring, database, java, uml, ooad, j2ee, mysql, software engineer, oracle sql"
ION Group - Data Associate - KYC6,ion trading india pvt. ltd.,2025-09-20,Hungary,1-3 Years,"data management, sql proficiency, information technology, database, java, python, infrastructure, sql database"
Asp.net / MVC Developer,M/s Fast and Furious Consulting,2025-09-21,Gurgaon,0-3 Years,"oracle, asp.net, toad, mvc, sql"
Consultant - SAS/SQL/ Tableau,Analytics Vidhya,2025-09-07,Bengaluru,1-3 Years,"sas, logical thinking, sql, tableau, consultant, sas/sql"
Tableau Developer - Tableau/SQL - 3  Years - Kolkata job in Calcutta,crescendo global,2025-09-20,Kolkata,3-6 Years,"tableau development, sql proficiency, data visualization, dashboard design, leadership hiring, recruitment"
Software Engineer (DB2),ITCAN Pte Ltd,2025-09-04,Singapore,2-5 Years,"sql, aix, database, linux, shell scripting, software engineer, mysql, oracle server, pl/sql, solaris, windows, sql database"
"IT Section Leader - PowerBI, Tableau, SQL, PLSQL",GOODYEAR,2025-09-20,Hyderabad,6-9 Years,"technical leadership, project management, team building, problem solving, talent acquisition, performance management"
Data Engineer,COMMONWEALTH BANK,2025-08-26,Bengaluru,5-7 Years,"sql t sql proficiency, data quality assessment, information technology, bi, t-sql, ssrs, python"
Senior Database Developer/ Architect,V12 Consulting,2025-09-20,United,8-11 Years,"sql, security, system architect, project life cycle, pl/sql, sas, database developer, database programming, oracle 11g"
Database Administrator SQL server,BAKER HUGHES,2025-08-26,Gurgaon,4-5 Years,"sql server administration, performance tuning, database security management, disaster recovery planning, data integration solutions, dba, index, ssms, query optimization, sql server dba, database administrator, replication, sql database"
Technical Specialist-Cloud & Infra Engg,Birlasoft,2025-09-19,Noida,5-7 Years,"sql server administration, backup and recovery, performance tuning, database security management, sql server dba, database administration, sql dba"
"Data Engineer-Biq Query, SQL-4  Years- Gurgaon job in",crescendo global,2025-09-20,Gurgaon,4-7 Years,"bigquery expertise, sql proficiency, data pipeline design, data quality assurance, leadership hiring, learning, recruitment"
Java Microservices Developer,ORACLE,2025-09-23,Bengaluru,3-5 Years,"java development, spring boot, microservices architecture, devops tools, sql queries, oracle, debugging, oracle sql"
"Principal Analyst - Managed Service Change(Intellimatch,SQL)",FIS,2025-09-20,Pune,6-10 Years,"database management, client relationship, reconciliation standards, uat testing, technical expertise, regression testing, sql, security, waterfall, jira, data integrity, windows, agile, health benefits"
"As/400, RPG ILE, CL ILE, SQL ILE on IBM I-series Platform Expert",infinity business solutions pvt ltd,2025-09-20,Gurgaon,7-12 Years,"rpg ile, cl ile, sql ile, ibm i series, db2/400, websphere mq, wmb, sql, db2/400, seu, software delivery, cl, problem solving, ile cl, messaging"
Microsoft Sql db Trainer,BRINGLE ACADEMY,2025-09-21,Mumbai,0-3 Years,"microsoft sql, training manuals, develop training"
Senior Specialist Software Engineering - PL/SQL Developer,AT&T,2025-09-13,Hyderabad,5-6 Years,"pl/sql development, oracle database, query optimization, data modeling, performance tuning, information technology, system development, software engineering, mysql, pl/sql developer, github, triggers, database programming, delivery management, sql programming, security"
Data Engineer - Python SQL,virtusa consulting services pvt. ltd.,2025-08-25,Chennai,3-5 Years,"sql data extraction, python scripting, databricks processing, data pipeline optimization, apache airflow dags, data engineer, data warehousing, data quality, data transformation, etl"
"Manager, Data Engineering",RSM,2025-09-22,Hyderabad,6-9 Years,"data migration expertise, oracle fusion proficient, technical solutions development, t-sql, devops, html, adf, github, author, database engine, crm, cloud services, sql database"
Database Administrator- SQL server,BAKER HUGHES,2025-08-26,Gurgaon,4-5 Years,"sql server administration, performance tuning, data security management, query optimization, cloud database solutions, disaster recovery, dba, database security, index, ssms, senior database administrator, sql server dba, replication, sql database"
Senior Analytics,Analytics Vidhya,2025-09-07,Delhi,5-10 Years,"python, sas, sql"
Hiring For MS SQL,krazy mantra hr solutions,2025-09-04,Chennai,0-3 Years,"ms sql, be/ b.tech /mca, it/computer science"
"Senior Java Backend Developer( should have 7 years experience in Java,Springboot,Sql) Pune)",Worldpay,2025-08-25,Pune,6-9 Years,"java development, spring boot framework, restful web services, database management, agile software lifecycle, plsql, java security, xml, data structures, github, oracle, maven, spring security, unix/linux, algorithms, software design, hibernate, debugging, json, gradle, gateway"
"Software Engineer II (should have 4 years of experience in Java ,Springboot,SQL) Pune",Worldpay,2025-09-22,Pune,4-9 Years,"java development, spring boot, rest apis, unit testing, database management, plsql, java security, xml, data structures, github, oracle, maven, spring security, unix/linux, algorithms, software design, hibernate, debugging, json, gradle, gateway"
.NET MVC Developer,OMNIE SOLUTIONS INDIA PVT. LTD.,2025-09-02,Noida,4-6 Years,"software design, t-sql, sql, database, xml, microsoft .net, asp.net, html, mvc, c#, javascript"
"Service Delivery Analyst - MS SQL, Oracle, Service Now, Splunk, ITIL, MS Office - 4  Years - Indore",Worldpay,2025-09-21,Indore,1-5 Years,"technical support, problem diagnosis, documentation maintenance, application analysis, information technology management, security, problem solving, production support"
Software Engineer,JIVA INFOTECH,2025-09-21,Hyderabad,5-8 Years,"fundamentals, css, t-sql, sql, git, asp.net, oops, web api, html, mvc, pl/sql, c#, rest, .net developer, problem solving, infrastructure, .net"
PL/SQL Applications Development Sr Programmer Analyst - C12 - PUNE,CITI,2025-09-23,Philippines,1-4 Years,"data architecture, performance tuning, query optimization, sql programming, data management, information technology, unix shell scripting, big data, pl/sql, python, oracle, senior programmer, database development, problem solving, production support"
Technical Specialist-Cloud & Infra Engg,Birlasoft,2025-09-19,Bengaluru,4-6 Years,"sql server management, database performance tuning, cloud migration expertise, automation scripting, sql server dba, security, sql dba, indexing, database security, database servers"
Sr Technical Lead-Cloud & Infra Engg,Birlasoft,2025-09-19,Noida,8-11 Years,"sql server management, azure cloud solutions, database performance optimization, data security implementation, sql server dba, sql dba, indexing, database security, database servers"
Senior Specialist Software Engineering - PL/SQL Developer,AT&T,2025-09-13,Hyderabad,5-6 Years,"pl/sql development, oracle database, query optimization, data modeling, performance tuning, information technology, system development, software engineering, mysql, pl/sql developer, github, triggers, database programming, delivery management, sql programming, security"
QA Engineer  Manual   Automation,Techcronus,2025-09-18,Ahmedabad,5-8 Years,"power bi reporting, data visualization, sql database management, data modelling, dax queries, reports, sql server, saas, performance optimization"
Sr. ETL Lead Developer,FINITE HR CONSUTING PVT LTD,2025-09-21,Hyderabad,5-8 Years,"data warehousing, graphics, sql, unix scripting, database, sql development, c, mobile, unix shell"
Graduate Opportunities,Veloxcore,2025-09-02,Ahmedabad,0-3 Years,"c#, java, .net, sql"
Hiring For Databricks Snowflake Pytho n SQL,krazy mantra hr solutions,2025-09-04,Chennai,1-4 Years,"databricks, snowflake, python, sql, etl, shell scripting"
"Senior Lead Analyst - Implementation Conversion (Adeptia, ETL and PL/SQL)",FIS,2025-09-23,Pune,8-10 Years,"data migration engineering, etl development expertise, pl/sql programming, t-sql, java, xml, ssrs, c#, python, oracle, triggers, soap, bi, database, security, git, json, pl / sql, rest, system architecture"
"Senior Business Analyst (Financial Services, SQL, BI Tools, Data Integration)",SYNECHRON,2025-08-25,Pune,8-11 Years,"sql database queries, business intelligence tools, data integration frameworks, etl process familiarity, data analysis proficiency, information technology, bi, data warehousing, software requirements, salesforce, ssrs"
"Application Analyst (SQL, Technical Support)",THOMSON REUTERS CORPORATION,2025-08-27,Hyderabad,1-3 Years,"application support, sql proficiency, problem resolution, customer service, root cause analysis, database, rest, problem solving"
PHP Developer,Parahit Technologies Limited,2025-09-16,Delhi,0-3 Years,"php, mysql, sql"
Crystal Reports / RDLC Developer,eDominer Systems,2025-09-02,Bengaluru,0-3 Years,"sql maestros, ssgas, dataplatform geeks"
Tableau Developer - Tableau/SQL - 3  Years - Kolkata job in Calcutta,crescendo global,2025-09-20,Kolkata,3-6 Years,"tableau development, sql proficiency, data visualization, dashboard design, leadership hiring, recruitment"
SQL/PLSQL Developer - 5 yrs Exp - Gurgaon - Only immediate joiners - CTC as per market standards - Angel and Genie - To,Angel and Genie,2025-09-12,Gurgaon,5-9 Years,"sql development, plsql optimization, etl processes, data warehousing, performance tuning, sql/plsql, database development, sql developer, oracle, toad, triggers"
Software Engineer - Java PL/SQL,NIELSEN,2025-09-23,Bengaluru,5-8 Years,"t sql development, code optimization, database troubleshooting, performance tuning, code refactoring, information technology, t-sql, database development, git, sql developer, debugging, pl/sql, database security, svn, triggers"
"MS BI Developer (SSAS, SSIS, SSRS)",E Hook Systems,2025-09-20,Delhi,6-9 Years,"data warehousing, t-sql, sql, database, ssrs, oracle, team player, problem solving, software implementation, consultant, unix"
