Title,Company,Posted on,Location,Experience,Skills
QA Engineer (Automation/Manual/Python/Java)- P2,NIELSEN,2025-09-23,Bengaluru,3-7 Years,"testing and debugging, api development, c, docker, database management, java, postgresql, windows platform, linux, j2ee, hadoop, c#, python, problem solving, javascript, messaging, .net"
Senior Python Programmer,IQVIA,2025-09-23,Bengaluru,5-7 Years,"data analysis, etl processes, python programming, gcp proficiency, scalability, clinical data, life sciences, transformation, clinical research"
"Senior Lead Engineer - Development (Machine Learning, Python)",FIS,2025-09-22,Pune,7-10 Years,"application design, machine learning, data analysis, python development, model optimization, senior software engineer, security, java, debugging, software engineering, c#, rest"
"Senior Software Engineer - Scala, Spark, Airflow, Python",NIELSEN,2025-09-22,Bengaluru,5-8 Years,"cloud implementation expertise, big data development, automation scripting, agile methodologies, orchestration, storage, security, java, apache, devops, json, software engineer, shell scripting, python, junit, os, messaging, infrastructure, unix/linux, sql programming"
Python API DevOps Engineer / Developer,Quantiphi,2025-09-22,Mumbai,1-4 Years,"python functions, async rest apis, mysql integration, custom authentication, production deployment, react.js, database, devops, linux, oracle, node.js, project delivery"
Senior Python Developer,Bright Vision Technologies,2025-09-22,Bengaluru,3-5 Years,"python programming, software development, django framework, sql databases, version control, css, javascript, git, web technologies, debugging, html, it professional"
Senior Engineer - Python,DUNNHUMBY,2025-09-22,Gurgaon,6-10 Years,"api development expertise, python data libraries, cloud platforms management, testing and debugging, algorithms, git, data structures, cloud services, problem solving"
"Senior Software Engineer - Scala, Spark, Airflow, Python",NIELSEN,2025-09-22,Gurgaon,5-8 Years,"cloud implementation expertise, big data processing, programming languages proficiency, orchestration, storage, security, java, apache, devops, json, software engineer, shell scripting, python, junit, os, messaging, infrastructure"
Python API DevOps Engineer / Developer,Quantiphi,2025-09-22,Mumbai,1-4 Years,"python functions, async rest apis, mysql integration, custom authentication, production deployment, react.js, database, devops, linux, oracle, node.js, project delivery"
"Senior Software Engineer - Bigdata ( Java / Scala / Python  & Spark, SQL , AWS)",NIELSEN,2025-09-22,Bengaluru,4-8 Years,"cloud implementation, big data analytics, agile methodologies, software development, technical troubleshooting, orchestration, information technology, apache, java, devops, software engineering, shell scripting, mysql, python, oracle, messaging, unix/linux, hive, scala, docker, security, git"
Research Software Python Data Engineer,waters corporation,2025-09-22,Bengaluru,3-6 Years,"python programming, data pipeline development, aws services integration, docker containerization, machine learning collaboration, workforce, compensation, interview"
Python Developer,"o9 Solutions, Inc.",2025-09-22,Netherlands,3-6 Years,"software engineering, database management, machine learning, cloud infrastructure, agile methodologies, hive, sql, hadoop, mongodb, python, telerik, team player, javascript"
Python Django Developer,Maverick Console Services Pvt. Ltd.,2025-09-22,Indore,5-8 Years,"python, svn, database, django, git, infrastructure, mysql"
Senior Engineer - Python,DUNNHUMBY,2025-09-22,Gurgaon,6-10 Years,"api development expertise, python data libraries, cloud platforms management, testing and debugging, algorithms, git, data structures, cloud services, problem solving"
"Principal Consultant - Implementation Conversion Technical (ETL, Python)",FIS,2025-09-22,Pune,8-10 Years,"data migration engineering, pl/sql development, rdbms architecture, t-sql, java, xml, ssrs, c#, python, oracle, triggers, soap, bi, database, security, git, json, pl / sql, rest, system architecture"
"SRE Application Support with Automation ,PowerShell / Python Scripting - 24/7 Rotational Shifts",FIS,2025-09-22,Pune,7-11 Years,"sre application support, powershell scripting, python programming, production support, sql proficiency, information technology, security, python scripting, devops, windows, intellimatch, infrastructure"
Python Developer - Data Science & ML Ops,"o9 Solutions, Inc.",2025-09-22,Netherlands,3-9 Years,"software engineering, machine learning, cloud infrastructure, database management, continuous integration, hive, sql, hadoop, mongodb, python, telerik, javascript"
Python Developer,Bright Vision Technologies,2025-09-22,Chennai,1-5 Years,"python programming, software development, testing and debugging, database management, version control, css, sql, git, html, software engineering, javascript, django, web technologies, it professional"
Senior Software Engineer( Full stack - Python /React),autodesk india pvt ltd,2025-09-22,Bengaluru,5-8 Years,"cloud computing, distributed systems, data engineering, ci/cd automation, sql proficiency, fundamentals, hive, soa, senior software engineer, java, git, mvc, hadoop, python, machine learning, consultant, infrastructure, angularjs"
"Senior Software Engineer - Scala, Spark, Airflow, Python",NIELSEN,2025-09-22,Mumbai,5-8 Years,"cloud implementation expertise, big data processing, agile methodologies, ci/cd practices, programming languages proficiency, orchestration, storage, security, java, apache, devops, json, software engineer, shell scripting, python, junit, os, messaging, infrastructure"
"Principal Analyst - Implementation Conversion (ETL, Python)",FIS,2025-09-22,Pune,8-10 Years,"data migration expertise, pl/sql proficiency, database optimization, t-sql, java, xml, ssrs, c#, python, oracle, triggers, soap, bi, security, git, json, pl / sql, rest, rdbms, system architecture"
"Senior Software Engineer - Python, Microservices, Cloud.",Ivanti,2025-09-22,Bengaluru,5-8 Years,"full stack development, python programming, react, js framework, cloud technologies, microservices architecture, css, sql, react.js, elastic search, d3.js, postgresql, linux, debugging, html, github, javascript, node.js"
"Senior Software Engineer - C  , Python, Linux",Ivanti,2025-09-22,Germany,5-8 Years,"network security solutions, python development expertise, cloud technologies, algorithms, snmp, docker, oops, linux, data structures, os, mobile, team player"
"Principal Analyst - Implementation Conversion (ETL, Python)",FIS,2025-09-22,Pune,8-10 Years,"data migration expertise, pl/sql proficiency, database optimization, t-sql, java, xml, ssrs, c#, python, oracle, triggers, soap, bi, security, git, json, pl / sql, rest, rdbms, system architecture"
Software Engineer III (C#.net with Python),FACTSET,2025-09-22,Hyderabad,3-5 Years,"net, document databases management, scalable systems design, machine learning applications, algorithms, software engineer, data structures, software engineering, mongodb, github, node.js, infrastructure, .net, c#.net, couchdb"
Senior Software Engineer (Python or Ruby),Clarivate,2025-09-22,Bengaluru,5-7 Years,"api development frontend frameworks python programming database management agile methodologies, sql, software engineer, team player, ruby"
Senior Python Developer,Salt Technologies,2025-09-22,Pune,3-4 Years,"python programming natural language processing ai model integration code optimization version control (git), machine learning, django"
Python Developer,Bright Vision Technologies,2025-09-22,Bengaluru,1-5 Years,"python programming, software development, database management, web technologies, problem solving, css, sql, git, debugging, html, software engineering, javascript, django, it professional"
Integration and Customization Engineer - 3 (Python),Exotel,2025-09-22,Bengaluru,4-7 Years,"python development, django framework, api integrations, mysql/postgres, security testing, information technology, xml, json, telecom, messaging, soap"
Software Engineer III (C#.net with Python),FACTSET,2025-09-22,Hyderabad,3-5 Years,"net, document databases management, scalable systems design, machine learning applications, algorithms, software engineer, data structures, software engineering, mongodb, github, node.js, infrastructure, .net, c#.net, couchdb"
Python Developer,Bright Vision Technologies,2025-09-22,Chennai,2-5 Years,"python programming, software development, database management, version control (git), problem solving, css, sql, debugging, html, software engineering, javascript, django, web technologies, it professional"
"Senior Software Engineer - Python, Microservices, Cloud.",Ivanti,2025-09-22,Bengaluru,5-8 Years,"full stack development, python programming, react, js framework, cloud technologies, microservices architecture, css, sql, react.js, elastic search, d3.js, postgresql, linux, debugging, html, github, javascript, node.js"
"Principal Engineer - Development (Machine learning, Python)",FIS,2025-09-22,Pune,5-10 Years,"machine learning models, python programming, data analysis techniques, ai/ml frameworks, security, java, debugging, software engineering, c#, rest"
"Senior Software Engineer - C  , Python, Linux",Ivanti,2025-09-22,Germany,5-8 Years,"network security solutions, python development expertise, cloud technologies, algorithms, snmp, docker, oops, linux, data structures, os, mobile, team player"
Python Django Developer,Maverick Console Services Pvt. Ltd.,2025-09-22,Indore,5-8 Years,"python, svn, database, django, git, infrastructure, mysql"
Python Developer,Bright Vision Technologies,2025-09-22,Chennai,1-5 Years,"python programming, software development, testing and debugging, database management, version control, css, sql, git, html, software engineering, javascript, django, web technologies, it professional"
Python Developer,"o9 Solutions, Inc.",2025-09-22,Netherlands,3-6 Years,"software engineering, database management, machine learning, cloud infrastructure, agile methodologies, hive, sql, hadoop, mongodb, python, telerik, team player, javascript"
Python Developer  Product Owner,SYNECHRON,2025-09-22,Bengaluru,7-12 Years,"product vision definition python backend development pyspark expertise react frontend integration product backlog management, amp, product development, kanban, action, innovation"
Senior Software Engineer (Python or Ruby),Clarivate,2025-09-22,Bengaluru,5-7 Years,"api development frontend frameworks python programming database management agile methodologies, sql, software engineer, team player, ruby"
Python Developer,Bright Vision Technologies,2025-09-22,Delhi,2-5 Years,"python programming, software development, database management, api integration, version control, css, sql, git, debugging, html, software engineering, javascript, django, web technologies, it professional"
Python Developer,Bright Vision Technologies,2025-09-22,Hyderabad,3-5 Years,"python programming, software development, database management, web technologies, version control, css, sql, git, debugging, html, software engineering, javascript, django, it professional"
Python Internship in Ahmedabad,Maxgen Technologies,2025-09-21,Ahmedabad,0-1 Years,python internship
"T.I.M.E. Chennai T.I.M.E. Chennai requires Sr. Technical Trainer / Programming Faculty (C, C  , Java, Python)",Triumphant Institute of Management Education Pvt Ltd (T.I.M.E.),2025-09-21,Chennai,4-20 Years,"programming languages, classroom training, student engagement, teaching methodologies, curriculum development, c, python, information technology, java"
Full Stack Developer,pattern effects labs private limited,2025-09-21,Bengaluru,2-5 Years,"python, hosting, hosting management"
Senior Python Backend Engineer (Data & AI),Tide,2025-09-21,Germany,6-9 Years,"backend python engineering, rest apis integration, ci/cd pipelines creation, event driven architectures, fundamentals, oop, java, software engineering, github, django, .net"
Senior RPA UiPath Developer,Ctd Techs Private Limited,2025-09-21,Chennai,3-8 Years,"c#, python, java, sql"
BDM...,CONNECTING 2 WORK,2025-09-21,Thiruvananthapuram,1-4 Years,"python, java"
Data Scientist,M/s Fast and Furious Consulting,2025-09-21,Bengaluru,0-3 Years,"algorithms, python, machine learning"
"Senior Lead Engineer - Development (Python, PLSQL/Linux)",FIS,2025-09-21,Pune,5-8 Years,"python development, database management, plsql debugging, unix/linux proficiency, object oriented design, senior software engineer, oid, security, git, sybase, oracle, problem solving, team player, project delivery, forms"
"Senior Lead Engineer - Development (Python, PLSQL/Linux)",FIS,2025-09-21,Pune,5-8 Years,"python development, database management, plsql debugging, unix/linux proficiency, object oriented design, senior software engineer, oid, security, git, sybase, oracle, problem solving, team player, project delivery, forms"
AM-TECH-DA-102 (JAVA/SCALA/AWS/Python),NIELSEN,2025-09-21,Bengaluru,5-7 Years,"api development, backend systems, aws proficiency, automation tools, unit testing, fundamentals, scala, windows, sql, messaging, database, infrastructure, linux"
Java developer with Azure (python),UBS,2025-09-21,Pune,5-8 Years,"java development, python programming, api management, cloud services, system design, information technology, software engineer, html, technology infrastructure, production support"
HIL/SIL python Testing Engineer,HARMAN INTERNATIONAL,2025-09-21,Pune,2-4 Years,"python programming, software engineering principles, embedded systems expertise, debugging"
Senior Software Engineer (Python/C  ),GOODYEAR,2025-09-21,Hyderabad,3-8 Years,"finite element analysis, software development life cycle (sdlc), python programming, troubleshooting techniques, documenting technical solutions, c, information technology, linux scripting, git, java, debugging, tcl, eclipse, tk, software developer, unix"
Python Developer  Data Integration,CONNECTING 2 WORK,2025-09-21,Calicut,5-8 Years,"python, data integration, database systems, etl/elt processes, aws services, data warehousing, sql, postgresql, mysql, software engineering, api, crm, cloud services, oracle, django, unix"
"ION Group - Senior .NET / Python Consultant, Budapest",ion trading india pvt. ltd.,2025-09-21,Hungary,6-9 Years,"c#/.net development python programming sql expertise software design agile methodologies, security, consultant, software engineering"
Data/QC Analyst,cloudxlab,2025-09-21,Bengaluru,5-8 Years,"bi, script language, sql, database, big data, python"
"ION Group - Senior .NET / Python Consultant, Budapest",ion trading india pvt. ltd.,2025-09-21,Hungary,6-9 Years,"c#/.net development python programming sql expertise software design agile methodologies, security, consultant, software engineering"
Software Engineer III (Python   Snowflake/Databricks),FACTSET,2025-09-21,Hyderabad,3-6 Years,"python development, cloud technologies, snowflake integration, relational databases, agile methodologies, fundamentals, postgresql, software engineer, mysql, api, entry level"
Python Backend Engineer(Machine Learning Engineer),Tide,2025-09-21,Germany,4-6 Years,"backend python engineering, rest api integration, ci/cd pipeline creation, event driven architecture, fundamentals, oop, java, software engineering, github, django, .net"
"R&D Verification Engineer ( CFD, Python, Testing )",ansysco anand,2025-09-21,Pune,1-3 Years,"software testing, cfd software, python scripting, linux proficiency, regression testing, algorithms, windows, high performance computing"
"Lead Data Analyst (SQL, PLSQL, Unix, python & ETL)",HARMAN INTERNATIONAL,2025-09-21,Pune,3-5 Years,"creative design, technical expertise, innovative solutions, team collaboration, problem solving, innovation, cutting, action, ideas"
"Senior Lead Data Scientist (Data Scientist, ML/Python)",FIS,2025-09-21,Pune,7-10 Years,"statistical analysis, machine learning, data visualization, big data technologies, data preprocessing, artificial intelligence, python, algorithms, scala, security, hadoop"
DevOps Engineer,cloudxlab,2025-09-21,Bengaluru,5-8 Years,"python, mobile, docker, system administration, java, infrastructure, debugging"
Python Developer,CONNECTING 2 WORK,2025-09-21,Cochin,2-3 Years,"database, python, css, rest api, html, javascript"
Python Developer (AI/ML),M/s Fast and Furious Consulting,2025-09-21,Delhi,5-8 Years,"python, data mining, machine learning, artificial intelligence, elastic search, data extraction, data structures, big data, opencv"
PYTHON TRAINER,CONNECTING 2 WORK,2025-09-21,Calicut,0-3 Years,"rest, python, django, mongodb"
Python Developer,cloudxlab,2025-09-21,Bengaluru,0-3 Years,"css, html5, jquery, git, linux, html, mysql, rest, python, github, problem solving, javascript, django, web hosting"
Python Developer,CONNECTING 2 WORK,2025-09-21,Cochin,0-3 Years,"security compliance, python, html5, mobile, javascript, database, django, debugging"
Python Developer,HARMAN INTERNATIONAL,2025-09-21,Bengaluru,3-6 Years,"python programming, django framework, database management, api development, testing frameworks, docker, git, debugging, rest, cloud services"
Python Developer,Ctd Techs Private Limited,2025-09-21,Chennai,3-5 Years,"html5, storage, artificial intelligence, security, testing tools, debugging, python, javascript, django"
Python Senior Developer,CONNECTING 2 WORK,2025-09-21,Thiruvananthapuram,6-7 Years,"python, css, github, hosting, bug fixing, bootstrap, javascript, jquery, django, heroku, json, html, api"
Python Django Developer,CONNECTING 2 WORK,2025-09-21,Cochin,1-5 Years,"rest, python, css, oracle, html5, svn, javascript, database, django, git, postgresql"
Senior Python Developer,CONNECTING 2 WORK,2025-09-21,Cochin,4-7 Years,"rest, python, django, rest api, api"
Python Django Developer,CONNECTING 2 WORK,2025-09-21,Thiruvananthapuram,0-3 Years,"python, rest api, html5, javascript, sql, security, django, git"
Python Django Developer,CONNECTING 2 WORK,2025-09-21,Thiruvananthapuram,3-5 Years,"rest, python, css, bootstrap, javascript, jquery, nosql, django, postgresql, html, mongodb"
Python / ML Developer,CONNECTING 2 WORK,2025-09-21,Bengaluru,4-7 Years,"python, django, machine learning, nosql"
Python Developer,CONNECTING 2 WORK,2025-09-21,Bengaluru,0-3 Years,"python, cache, rest api, storage, javascript, react.js, database, django, apache, postgresql, web technologies, .net, web development, mysql, angularjs"
Python Developer,CONNECTING 2 WORK,2025-09-21,Thiruvananthapuram,5-6 Years,"python, css, bug fixing, bootstrap, javascript, jquery, django, debugging, html, api"
Python Developer,CONNECTING 2 WORK,2025-09-21,Bengaluru,5-8 Years,"python, css, github, hosting, bug fixing, bootstrap, javascript, jquery, django, heroku, json, html, api"
Python Developer,CONNECTING 2 WORK,2025-09-21,Cochin,2-5 Years,"python, storage, sql, security, database, django, git, postgresql, oops, debugging, mysql, api"
Python Developer,CONNECTING 2 WORK,2025-09-21,Thiruvananthapuram,5-10 Years,"python, storage, django, testing tools, debugging"
Python Developer  Data Integration,CONNECTING 2 WORK,2025-09-21,Calicut,5-8 Years,"python, data integration, database systems, etl/elt processes, aws services, data warehousing, sql, postgresql, mysql, software engineering, api, crm, cloud services, oracle, django, unix"
PYTHON DEVELOPER,CONNECTING 2 WORK,2025-09-21,Bengaluru,5-8 Years,"python, css, github, hosting, bug fixing, bootstrap, javascript, jquery, django, heroku, json, html, api"
Python Developer,CONNECTING 2 WORK,2025-09-21,Cochin,2-5 Years,"python, storage, sql, security, database, django, git, postgresql, oops, debugging, mysql, api"
PYTHON TRAINER,CONNECTING 2 WORK,2025-09-21,Calicut,0-3 Years,"rest, python, django, mongodb"
Python Developer,Drawsera,2025-09-21,Mumbai,1-5 Years,"css, ajax, jquery, sql, database, postgresql, mysql, html, mvc, python, javascript, django"
Lead Python Django Developer,CONNECTING 2 WORK,2025-09-21,Thiruvananthapuram,4-8 Years,"security compliance, html5, storage, security, database, git, debugging, rest, python, mobile, javascript, django, infrastructure"
Python Developer,Mind Digital Group,2025-09-21,Delhi,2-5 Years,"algorithms, css, bootstrap, git, linux, html, shell scripting, data structures, pl/sql, solaris, python, rdbms, svn, javascript, django, php, unix/linux, unix"
Senior Developer  Python Django,CONNECTING 2 WORK,2025-09-21,Palakkad,3-6 Years,"python, css, software design, django, git, linux, html"
Python Developer,CONNECTING 2 WORK,2025-09-21,Bengaluru,0-3 Years,"python, cache, rest api, storage, javascript, react.js, database, django, apache, postgresql, web technologies, .net, web development, mysql, angularjs"
Python Developer,FINITE HR CONSUTING PVT LTD,2025-09-21,Hyderabad,4-7 Years,"python, github, mobile, problem solving, team player, ruby, java, cassandra, php"
Python Developer,CONNECTING 2 WORK,2025-09-21,Bengaluru,5-8 Years,"python, css, github, hosting, bug fixing, bootstrap, javascript, jquery, django, heroku, json, html, api"
Crimson AI - Principal Engineer - Python/ Node.Js/ Golang,CRIMSON INTERACTIVE PVT LTD,2025-09-20,Mumbai,6-9 Years,"coding, golang, mentoring"
Python Developer - Django,global invisions consulting,2025-09-20,Cochin,2-5 Years,"python development, django web framework, api design, front end technologies, git version control, rest, html5, mobile, problem solving, javascript, react.js, infrastructure, json"
Python developer,AxisTechnolabs,2025-09-20,Ahmedabad,1-4 Years,"python, django, html5, team player, angularjs, javascript"
Python Django Developer,highrise solutions llp,2025-09-20,Pune,3-7 Years,"python, django, flask, rest, orm, html5, cmp, symfony, sql, security, git, senior software developer, software engineer, mysql, api, javascript, php, .net"
Python backend Developer,3RI Technologies Pvt Ltd,2025-09-20,Pune,1-2 Years,"python, backend development, server side logic, problem solving, javascript, html5, docker, django, infrastructure, devops, debugging"
BI Developer - Databricks / Snowflake   Python - 5   Years - Bangalore,crescendo global,2025-09-20,Bengaluru,5-8 Years,"databricks expertise, snowflake proficiency, python programming, data modeling techniques, etl process optimization, information technology, data warehousing, business intelligence, bi developer, infrastructure"
Trainee Software Engineer,3RI Technologies Pvt Ltd,2025-09-20,Pune,0-3 Years,"python, software engineer, sql"
Specialist Data/AI Engineering (Python Full Stack Developer),AT&T,2025-09-20,Hyderabad,5-9 Years,"python development, react js / angular js, restful apis, sql/nosql databases, git and github, css, orchestration, software design, data warehousing, docker, security, postgresql, devops, debugging, html, cloud services, microsoft azure, javascript, software support"
Backend Developer,Photojaanic,2025-09-20,Bengaluru,15-18 Years,"digital imaging, python, docker, node.js, api, gateway"
AWS Python Developer,tcg digital solutions pvt ltd,2025-09-20,Kolkata,5-8 Years,"elastic search, python, node.js, java, oracle, linux, pl/sql, sql"
"Senior Lead Engineer - Development (Python, PLSQL/Linux)",FIS,2025-09-20,Pune,3-5 Years,"software development, python programming, sql database management, problem solving, agile methodology, senior software engineer, oid, plsql, security, git, debugging, sybase, oracle, team player, project delivery, unix/linux, forms"
Machine Learning Engineer,Vitrana,2025-09-20,Noida,2-4 Years,"algorithms, python, machine learning"
Industrial 4.0 Trainer,v support solutions,2025-09-20,Coimbatore,15-18 Years,"python, java, mqtt, unix"
CrimsonAI - Associate Architect - Python/ Node.Js/ Golang,CRIMSON INTERACTIVE PVT LTD,2025-09-20,Mumbai,0-3 Years,"design, engineering, designing, building"
Data Migration Analyst,infinity business solutions pvt ltd,2025-09-20,Thiruvananthapuram,2-4 Years,"data migration, sql server, ssis, api integration, python, python, sql, api"
Lead Data Engineer,Infostretch Solution Pvt Ltd,2025-09-20,Hyderabad,17-20 Years,"fundamentals, sql, database, python scripting, git, devops, software engineering, python, rdbms"
Python - Odoo,AxisTechnolabs,2025-09-20,Ahmedabad,0-1 Years,"python, django, html5, api, jquery"
03. C# .NET Python Software Developer,ez-xbrl solutions,2025-09-20,United,3-6 Years,"c#, python, css, software testing, html/xml, problem solving, javascript, production support, c# .net, microsoft .net, software developer, mongodb"
Python Developer - Business Intelligence,global invisions consulting,2025-09-20,Cochin,3-9 Years,"python proficiency, bi tools, data modeling, problem solving, data warehousing, business intelligence, data extraction, database, etl, data integration"
Full Stack Python Developer/Programmer/Engineer,Cotocus,2025-09-20,Bengaluru,0-3 Years,"python, exception handling, sql, docker, oops, data structures"
Senior Engineering Manager - Python/ Golang/ Nodejs,CRIMSON INTERACTIVE PVT LTD,2025-09-20,Mumbai,8-11 Years,"python, golang, nodejs"
3Pillar - Senior Python Developer(5  Years of Exp & Looking for Immediate Joiners),brickred (3pillar global),2025-09-20,Mumbai,4-5 Years,"back end development, object oriented programming, database management, software development, python, product delivery, oop, web development"
"AWS Engineer (Dot Net/Java/Python, Gen AI) Job Details | Gainwell Technologies LLC",Gainwell Technologies,2025-09-20,Chennai,5-8 Years,"aws infrastructure management, terraform automation, genai integration, application development, cloud monitoring tools, java, iam, api, c#, python, gateway"
Python Developer,v support solutions,2025-09-20,Chennai,2-5 Years,"rest, python, natural language processing, django, debugging, mysql, software developer, mongodb, soap"
Trainee-Embedded Systems,eurys infosystem pvt. ltd,2025-09-20,Jaipur,0-2 Years,"python, c, javascript, java, linux"
