Title,Company,Posted on,Location,Experience,Skills
Java FS Developer,SYNECHRON,2025-09-25,Bengaluru,7-10 Years,"java development, angular frameworks, object oriented design, agile methodologies, software testing, information technology, software design, software requirements, debugging, gtp"
Binance Accelerator Program - QA (Java),Binance,2025-09-25,Taiwan,0-1 Years,"qa methodologies, java programming, mysql database, bug tracking, automation testing, software engineering"
Java Software Engineer,welocalize,2025-09-25,Noida,5-8 Years,"object oriented programming, api design development, database modeling design, information technology, senior software engineer, java, devops, mysql, github, nosql, spring framework, spring security, mybatis, storage, hibernate"
Senior Java Developer,TARGET,2025-09-25,Bengaluru,5-9 Years,"software development, application architecture, problem solving, agile methodologies, code review, storage, debugging, software engineering"
Lead - Java Dev,SYNECHRON,2025-09-25,Bengaluru,5-8 Years,"java development, spring boot framework, rest api design, microservices architecture, hibernate, sql, git, java se, cloud computing, gtp, oracle, software delivery, java programming"
Java Developer-Pune,Indus Net Technologies,2025-09-25,Pune,4-7 Years,"java development, spring framework, microservices architecture, restful web services, frontend frameworks, hibernate, database, linux, debugging, software engineering, mysql, mobile, problem solving, java developer, nosql, spring boot, infrastructure"
Core Java Developer,SEVEN CONSULTANCY,2025-09-25,Navi,3-5 Years,"spring boot, database, java, spring security, rdbms, java programmer, web developer, json, hibernate, java developer"
Java Developer (Backend),CGI Information Systems and Management Consultants Pvt Ltd,2025-09-25,Boston,3-5 Years,"java development, backend services, software engineering, rest apis, problem solving, java developer"
Junior Engineer - Java,Hotelogix,2025-09-25,Bengaluru,2-4 Years,"core java, jee technologies, web services, spring framework, hibernate orm, css, jsp, xsd, jdbc, sso, jquery, xpath, wsdl, xml, sql developer, json, mysql, html, perforce, log4j, junit, oracle, maven, spring security, struts, mule esb, j2ee technologies, soap"
Sr. java Developer,SEVEN CONSULTANCY,2025-09-25,Chennai,3-5 Years,"algorithms, hibernate, sql, java developer, spring boot, database, java, spring mvc, ooad, data structures, mysql, mvc"
Lead Java Developer,TARGET,2025-09-25,Bengaluru,7-10 Years,"software development, application architecture, system optimization, data management, technical leadership, debugging, infrastructure"
Java Fullstack Developer,Indus Net Technologies,2025-09-25,Kolkata,3-5 Years,"java programming, spring boot, cloud services, frontend development, agile methodologies, algorithms, orchestration, linux scripting, docker, devops, data structures, perl, middleware, python, github, jdk, infrastructure, environment management"
Lead - Java Dev,SYNECHRON,2025-09-25,Bengaluru,5-8 Years,"java development, spring boot framework, rest api design, microservices architecture, hibernate, sql, git, java se, cloud computing, gtp, oracle, software delivery, java programming"
Sr Associate Java,SYNECHRON,2025-09-25,Chennai,5-8 Years,"core java, spring boot, microservices, angular"
Java Developer,SYNECHRON,2025-09-25,Mumbai,5-8 Years,"java/jee technologies, multi threaded applications, core java development, agile methodologies understanding, spring, security, j2ee, python, spring boot"
"Java Full Stack Developer, Associate",BLACKROCK,2025-09-25,Gurgaon,4-6 Years,"java development, object oriented programming, agile methodologies, cloud technologies, microservices architecture, spring, apache, software engineering, maven, ado, javascript, nosql, cassandra, software developer, hibernate, docker, database, git, junit, ant, microsoft azure, production support"
Java Developer,SEVEN CONSULTANCY,2025-09-25,Manali,2-4 Years,"software testing, jsp, java developer, sql, java, xml, debugging, enterprise java, ejb"
Java Microservices Support - Offshore,BAHWAN CYBERTEK,2025-09-25,Chennai,5-8 Years,"java/jee expertise, microservices architecture, restful api development, spring boot proficiency, oracle, production support, database, git, application support, j2ee"
Sr.Java Developer(spring),SEVEN CONSULTANCY,2025-09-25,Navi,0-3 Years,"rdbms, hibernate, java developer, spring boot, database, java, spring security, java programmer, web developer, j2ee, json"
"Java Architect II at Fiserv, Inc.",fiserv ce pvt ltd,2025-09-25,Chennai,10-13 Years,"java development, aws cloud solutions, api integration, microservices architecture, agile methodology, git, debugging, software engineering, oracle, rdbms, maven, mobile, team player, problem solving, java developer, nosql, messaging, spring boot, spring security"
Java Developer,SYNECHRON,2025-09-25,Chennai,3-5 Years,"java programming, java frameworks, database management, agile methodologies, information technology, hibernate, software requirements, intellij idea, spring, oop, mysql, netbeans, oracle, eclipse, struts"
Lead Java,SYNECHRON,2025-09-25,Pune,6-10 Years,"java proficiency, spring boot, microservices development, messaging systems, database management, information technology, software requirements, docker, sql, oop, git, postgresql, mysql, api, mongodb, mq, maven, nosql, gradle"
Senior Java Software Engineer,BlueOptima,2025-09-25,Mexico,7-10 Years,"java and jee, spring boot development, sql databases, application performance optimization, team leadership capabilities, senior software engineer, hibernate, docker, linux, j2ee, java ee, problem solving"
Java Consultant,SEVEN CONSULTANCY,2025-09-25,Hyderabad,0-3 Years,"functional specifications, oracle, business requirements, functional design, security, java, consultant, functional requirements"
JAVA Developer,Emorphis Technologies,2025-09-25,Indore,2-5 Years,"java development, agile methodology, restful services, software testing, database management, css, jsp, xsd, hibernate, jquery, spring, xml, debugging, json, jpa, html, ejb, mongodb, extjs, javascript, nosql, cassandra, struts"
Java developer,SEVEN CONSULTANCY,2025-09-25,Hyderabad,0-3 Years,"css, html, software developer, javascript, java developer"
Java Developer,SEVEN CONSULTANCY,2025-09-25,Bengaluru,2-5 Years,"css, jsp, hibernate, ajax, sql, aix, java, xml, linux, json, html, mysql, api, rest, oracle, os, javascript, nosql, java developer, jdk, consultant, servlets, soap"
Senior Java Software Engineer,BlueOptima,2025-09-25,Mexico,7-10 Years,"java and jee, spring boot development, sql databases, application performance optimization, team leadership capabilities, senior software engineer, hibernate, docker, linux, j2ee, java ee, problem solving"
"Java Frontend Developer , Aladdin Engineering - Analyst",BLACKROCK,2025-09-25,Gurgaon,2-5 Years,"full stack development, java programming, javascript expertise, agile methodologies, web systems administration, css, wordpress, html5, devops, software engineering, security, operating system, production support"
Java Full-stack Developer,SYNECHRON,2025-09-25,Pune,5-8 Years,"java technologies, microservices architecture, frontend development, ci/cd tools, secure coding practices, html5, software requirements, sql, spring, database management, devops, json, debugging, jpa, software engineering, rest, python, github, spring framework, spring boot"
Java Full stack Lead,Orion Innovation,2025-09-25,Chennai,5-10 Years,"full stack development, cloud technologies, microservices architecture, agile methodologies, ci/cd pipeline management, information technology, docker, security, java, git, devops, maven"
Sr. Java Developer(spring),SEVEN CONSULTANCY,2025-09-25,Navi,2-5 Years,"spring boot, java, spring security, rdbms, java programmer, json, hibernate, java developer"
Senior Software Engineer - Java,COMMONWEALTH BANK,2025-09-25,Bengaluru,7-10 Years,"java development, spring framework, rest api design, microservices architecture, cloud services, information technology, senior software engineer, system security, git, solution delivery, spring boot, gateway"
Staff Software Engineer-Java,ChargePoint,2025-09-25,Bengaluru,7-10 Years,"real time applications, cloud development, software design, team mentoring, java, software engineering, rest, director, mobile, nosql, spring boot"
Java Developer  - W6778,Nisum,2025-09-25,Chile,5-8 Years,"java development, spring framework, microservices architecture, unit testing (mockito), ci/cd pipeline, information technology, jsp, aem, sql, git, j2ee, software engineering, oracle, maven, svn, team player, spring boot"
Sr. Java Developer(spring),SEVEN CONSULTANCY,2025-09-25,Navi,2-5 Years,"spring boot, java, spring security, rdbms, java programmer, json, hibernate, java developer"
Java Developer,SYNECHRON,2025-09-25,Bengaluru,5-8 Years,"java proficiency, spring framework, microservices architecture, database management, agile methodologies, orchestration, information technology, oop, mysql, gtp, oracle, java developer, eclipse, struts, java programming, hibernate, software requirements, intellij idea, docker, git, debugging"
Lead Java,SYNECHRON,2025-09-25,Pune,7-10 Years,"java development, spring framework, multithreading techniques, mongodb usage, microservices architecture, storage, messaging, groovy, api"
java Developer,SEVEN CONSULTANCY,2025-09-25,Hyderabad,4-6 Years,"oracle, html5, hibernate, jquery, java developer, spring, advanced java, apache, java, struts, camel, software engineer, angularjs, soap"
"Senior Java Developer (Microservices, Spring, Database)",SYNECHRON,2025-09-25,Pune,7-10 Years,"java development, microservices architecture, database management, object oriented programming, agile/scrum methodologies, aop, information technology, intellij, spring, j2ee, multithreading, software engineering, oracle sql developer, maven, java developer, eclipse, oracle 11g, soap, hibernate"
Java Developer (Spring Boot & Microservices),SYNECHRON,2025-09-25,Chennai,3-6 Years,"java development, spring boot, microservices architecture, messaging systems, sql proficiency, information technology, software requirements, docker, oop, database, git, postgresql, mysql, api, mongodb, mq, maven, nosql, gradle"
Java Developer,BENCHMARK IT SOLUTIONS,2025-09-25,Pune,3-8 Years,"core java, spring framework, sql databases, restful apis, version control, hibernate, docker, security, git, postgresql, json, mysql, junit, maven, java developer, gradle, spring boot, web technologies, java programming"
"Software Engineer III (Java, Science)",ELSEVIER,2025-09-25,Chennai,3-5 Years,"distributed systems, java development, kubernetes expertise, rest web services, machine learning, spring, database, security, software engineer, software engineering, forms"
Associate Lead Software Engineer - Java,Clarivate,2025-09-25,UK,8-11 Years,"java development spring framework microservices architecture rest api integration aws services utilization, database, xml, j2ee, json, software engineer, oracle, director, nosql, spring boot"
Sr Java developer & Jr Java developer,SYNECHRON,2025-09-25,Pune,0-10 Years,"java/jee expertise, maven and spring, rest and soap, application security, xml, j2ee, java developer, putty, hibernate, software requirements, documentation tools, json, debugging, ant, gradle, spring boot"
Senior Java Microservices Developer,CAPCO,2025-09-25,Bengaluru,6-10 Years,"java development, microservices architecture, spring boot, cloud technologies, kubernetes management, database, api, bpm, rest, soap"
Java/Angular Technical Lead,Sopra Steria,2025-09-25,Noida,5-8 Years,"full stack development, core java expertise, microservices architecture, devops pipeline setup, agile methodologies, hibernate, sql, git, mongodb, forms"
Java Developer,SYNECHRON,2025-09-25,Pune,1-4 Years,"java development, spring framework, apache spark, kafka management, cloud platforms, information technology, software requirements, debugging, java developer, infrastructure, unix"
Java Developer,SEVEN CONSULTANCY,2025-09-25,Navi,1-4 Years,"html5, maven, jsp, svn, hibernate, jquery, sql, eclipse, java developer, spring, database, java, servlets"
Java Developer - G6831,Nisum,2025-09-25,Chile,4-7 Years,"java programming, spring boot, microservices design, oracle sql, kafka messaging, security"
Senior Software Engineer-Java,ChargePoint,2025-09-25,Bengaluru,5-8 Years,"real time applications, cloud services, energy management, microservices design, software engineering, rest, director, mobile, nosql, spring boot"
Principal Software Engineer (Java/Scala),HERE Technologies,2025-09-25,Bengaluru,1-4 Years,"technical leadership, cloud technologies, microservices architecture, system design, algorithms, scala, ip networking, java, iam, debugging, data structures, rest, python, access management, infrastructure, splunk"
Senior Software Engineer (Java/Golang),Cloudera,2025-09-25,Bengaluru,4-7 Years,"data engineering, big data technologies, apache spark, kubernetes & docker, cloud infrastructures, cloudera, algorithms, orchestration, senior software engineer, java, data structures, hadoop, microsoft azure"
QA Engineer - Java Selenium,SYNECHRON,2025-09-24,Bengaluru,7-10 Years,"java programming, automated testing, data validation, db management, cloud solutions, information technology, data warehousing, storage, software requirements, sql, database management, git, testing tools, xml, json, big data, gtp"
Senior Java Backend Developer,Allstate,2025-09-24,Bengaluru,6-9 Years,"java development, spring framework, agile methodologies, test driven development, sql & nosql databases, j2ee, security design, api, oracle, imaging, spring security, environment management, algorithms, telematics, hibernate, docker, debugging, software engineer, jpa, mongodb, junit, mobile, spring boot"
Associate Software Engineer-Java,Clarivate,2025-09-24,Noida,0-1 Years,"java proficiency, angular framework, code optimization, aws learning interest, hibernate, associate software engineer, software engineering, jpa, mysql"
Hiring For Technical Lead  Java,krazy mantra hr solutions,2025-09-24,Mumbai,5-7 Years,"java development, spring boot, sql databases, microservices architecture, jsp & servlets, oracle, javascript"
Java Server Developer,CONNECTING 2 WORK,2025-09-24,Thiruvananthapuram,0-3 Years,"hibernate, spring framework, elastic search, security, java, postgresql, mysql"
Software Developer Senior Specialist - Java Backend,NASDAQ,2025-09-24,Bengaluru,7-10 Years,"java backend development, agile methodologies, git, devops, system development, perl, python, messaging, software developer, unix"
"Java Developer , Aladdin Engineering - Associate",BLACKROCK,2025-09-24,Mumbai,3-5 Years,"core java development, object oriented programming, microservices architecture, agile methodologies, hibernate, spring, database, apache, devops, software engineering, rest, junit, python, operating system, maven, microsoft azure, nosql, cassandra"
Senior Java Engineer,Fiserv India Pvt Ltd,2025-09-24,Bengaluru,8-9 Years,"backend development, java spring boot, api development, cloud architecture, team collaboration, git, debugging, software engineering, oracle, rdbms, maven, mobile, team player, problem solving, java developer, nosql, messaging, spring security"
"Senior Engineer - Development (. Net/Java, Angular)",FIS,2025-09-24,Pune,3-5 Years,"fix protocol implementation, c#, net/win forms, relational databases, agile methodology, authoring, qa, functional testing, security, oms, ui, life cycle, uat, c# .net, unix/linux, c#.net"
"Lead Software Engineer (Java, Kotlin)",MASTERCARD,2025-09-24,Pune,5-10 Years,"java development, api design, spring boot, microservices architecture, agile methodologies, fundamentals, sql, security, database, postgresql, software engineer, oracle, software developer"
Sr. Software Engineer I - Java,Policygenius,2025-09-24,Noida,7-11 Years,"backend development, java technologies, nosql databases, microservice architecture, object oriented programming, soa, senior software engineer, docker, spring, git, oops, j2ee, rest, maven, spring boot"
Sr Software Engineer - Java ( full stack ),cme group,2025-09-24,Bengaluru,5-7 Years,"css, senior software engineer, git, json, html, language proficiency, maven, spring framework, infrastructure, forms"
Senior Software Engineer - Java/ PL-SQL,COMMONWEALTH BANK,2025-09-24,Bengaluru,9-12 Years,"java development pl sql proficiency microservices architecture cloud technologies technical leadership, senior software engineer, plsql, docker, postgresql, devops, j2ee, software engineering, spring boot, spring security"
Java Developer,SYNECHRON,2025-09-24,Bengaluru,5-8 Years,"java proficiency, microservices architecture, agile development methodologies, cloud technologies familiarity, algorithms, software design, artificial intelligence, software engineer, software testing, mobile"
Java Developer,SYNECHRON,2025-09-24,Bengaluru,5-8 Years,"core java proficiency, restful api development, microservices architecture, docker and kubernetes, orchestration, information technology, mockito, software requirements, spring, git, spring mvc, postgresql, mysql, mongodb, junit, maven, nosql, gradle"
Software Engineer (API & Microservices / Java),SYNECHRON,2025-09-24,Chennai,5-8 Years,"java proficiency, microservices architecture, api development, database systems, spring, j2ee, software engineering, oracle, maven, nosql, messaging, java developer, storage, software requirements, docker, git, j2se, gradle, spring boot, gateway"
Java Backend Developer,Alliance University,2025-09-24,Bengaluru,3-8 Years,"java programming, spring boot framework, restful web services, mysql database, agile methodology, algorithms, jsp, jee, mockito, hibernate, docker, security, spring mvc, java ee, jpa, data structures, api, junit, servlets"
Software Engineer- JAVA,Clarivate,2025-09-24,Bengaluru,2-5 Years,"java development, spring boot framework, microservices architecture, database management, api security, django, postgresql, debugging, software engineer"
ORMB Technical Consultant - OUAF/Java,ORACLE,2025-09-24,Bengaluru,6-10 Years,"java jee development, ormb component development, ouaf framework expertise, analytical problem solving, algorithms, security, j2ee, multithreading, oracle, technical consultant"
Senior Java Software Engineer,BlueOptima,2025-09-24,Mexico,7-10 Years,"java development, spring boot, database optimization, team mentoring, agile methodologies, senior software engineer, hibernate, sql, docker, linux, j2ee, java ee, problem solving"
Senior Software Engineer (Java),COMMONWEALTH BANK,2025-09-24,Bengaluru,7-10 Years,"java development, rest api design, microservices architecture, cloud services, ci/cd process, information technology, senior software engineer, system security, spring, git, solution delivery, spring boot, gateway"
Senior Software Engineer - Java,Veeva Systems,2025-09-24,Hyderabad,8-11 Years,"object oriented design, software development, middleware platforms, code reviews, lucene, senior software engineer, hibernate, intellij idea, spring, java, mysql, crm, san, maven, messaging, it delivery"
Core JAVA Technical Lead,Sopra Steria,2025-09-24,Bengaluru,6-8 Years,"core java, sql databases, linux shell scripting, agile methodologies, microservices development, python, intellij, eclipse, jasper, swing, git, html, jsf, forms"
Tech Engineering Manager- Java/Kafka/AW,SYNECHRON,2025-09-24,Pune,1-4 Years,"team leadership, java development, kafka expertise, aws services, project management, learning, talent development, recruitment, workforce, recruitment process"
Senior Software Engineer  Java,CONNECTING 2 WORK,2025-09-24,Cochin,3-5 Years,"algorithms, hibernate, sql, database, java, spring mvc, data structures, mysql, mvc, java developer, ooad"
"Senior Java Backend Developer(Java 8,Springboot,Microservices)",Worldpay,2025-09-24,Pune,5-10 Years,"java development, springboot framework, restful api design, docker containers, aws services, security, mobile"
Software Engineer - Java,blue yonder,2025-09-24,Pune,2-3 Years,"object oriented programming, sql database management, data structures understanding, java programming, css, html, python, oracle, edi, triggers, javascript, spring framework, oracle sql, soap, algorithms, hibernate, security, oops, software engineer, rest, ruby"
Development Lead - Java,HARMAN INTERNATIONAL,2025-09-24,Bengaluru,3-5 Years,"java programming, real time systems, data streaming, microservices architecture, problem solving, apache, software engineering"
"Senior UI Java Developer(Angular, Java, Rest API)_7-10Yrs_Bangalore",Worldpay,2025-09-24,Bengaluru,5-10 Years,"angular framework, reactjs/vue development, java proficiency, spring boot rest api, sql database management, css, aop, html5, bootstrap, hibernate, intellij idea, security, spring mvc, j2ee, software engineer, jpa, mysql, oracle, javascript, spring security, ioc, ionic framework"
Staff Software Engineer - Java,COMMONWEALTH BANK,2025-09-24,Bengaluru,1-4 Years,"java/jee development, micro service architecture, aws services expertise, rest api design, continuous integration tools, information technology, hibernate, docker, j2ee, software engineer, github, maven, gradle, spring security"
Software Engineer (API & Microservices / Java),SYNECHRON,2025-09-24,Chennai,5-8 Years,"java proficiency, microservices architecture, api development, database systems, spring, j2ee, software engineering, oracle, maven, nosql, messaging, java developer, storage, software requirements, docker, git, j2se, gradle, spring boot, gateway"
Senior Java Backend - NCRTC,BAHWAN CYBERTEK,2025-09-24,Chennai,3-5 Years,"typescript mastery, node, rdbms expertise, rest api development, software engineer, nosql, docker"
Java Developer,CONNECTING 2 WORK,2025-09-24,Cochin,0-3 Years,"hibernate, java developer, spring, multimedia, database, java, infrastructure, debugging"
Java Developer,SYNECHRON,2025-09-24,Pune,6-7 Years,"java programming, mern stack development, kubernetes orchestration, information technology, java se, mysql, oracle, maven, javascript, node.js, web technologies, software requirements, react.js, git, postgresql, mongodb, gradle"
"Java Developer (Java, Angular, Docker & Kubernetes)",SYNECHRON,2025-09-24,Gurgaon,6-8 Years,"java development, spring boot, angular framework, aws cloud solutions, unit testing, css, orchestration, mockito, software requirements, docker, devops, data structures, multithreading, junit, javascript, java developer, unix/linux"
JAVA SOFTWARE ENGINEER,Apexon,2025-09-24,Hyderabad,4-7 Years,"object oriented design, java programming, jee application development, performance tuning, agile methodologies, sql, devops, linux, j2ee, junit, oracle, mobile, weblogic, unix"
Java Developer,msg global solutions,2025-09-24,Bengaluru,2-5 Years,"java programming, spring framework, frontend development, cloud applications, agile methodologies, html5, hibernate, it projects, maven, spring boot, angularjs"
Java Backend Developer,SYNECHRON,2025-09-24,Bengaluru,7-15 Years,"java programming proficiency, agile methodology familiarity, information technology, hibernate, software requirements, intellij idea, oop, mysql, netbeans, oracle, eclipse, struts"
Software Development Engineer Java Nodejs,trellix,2025-09-24,Bengaluru,3-7 Years,"java programming, node, js development, cloud services, docker & kubernetes, test automation, authoring, artificial intelligence, security, apache, iam, mysql, rest, github, access management, messaging, node.js"
Hiring For Java NMS TAPI,krazy mantra hr solutions,2025-09-24,Chennai,3-5 Years,"java nms, tapi/mlpce, netconf, springboot, microservices, cassandra, sdn"
Software Engineer - Java & React,SYNECHRON,2025-09-24,Bengaluru,5-7 Years,"java programming, restful apis, react, js expertise, agile methodologies, version control systems, css, information technology, software requirements, sql, react.js, database, git, html, gtp, problem solving, javascript, nosql"
Full Stack Java/Angular Developer,Sopra Steria,2025-09-24,Bengaluru,4-6 Years,"java programming, angular development, sql database management, unit testing, version control git, forms"
Java Backend Developer,SYNECHRON,2025-09-24,Bengaluru,7-15 Years,"java programming proficiency, agile methodology familiarity, information technology, hibernate, software requirements, intellij idea, oop, mysql, netbeans, oracle, eclipse, struts"
Java Technical Architect,DXC Technologies,2025-09-24,Noida,5-10 Years,"core java development, jee architecture, performance tuning, agile methodologies, rest apis, spring, j2ee, multithreading, oracle, angularjs, hibernate, sql, advanced java, database, json, mvc"
Java Developer,SYNECHRON,2025-09-24,Pune,8-12 Years,"java programming, spring framework, hibernate technologies, agile methodologies, version control, css, database management, git, postgresql, html, mysql, javascript, web technologies"
"Full Stack Developer (Java, ReactJS)",UBS,2025-09-24,Pune,8-11 Years,"java development, spring boot, reactjs ui, microservices architecture, information technology, apache, devops, html, big data, python, problem solving, infrastructure"
QA Engineer - Selenium & Java,SYNECHRON,2025-09-24,Chennai,10-15 Years,"automation testing, scripting languages, data migration testing, team management, ci/cd tools, test automation, data validation, test scripts, qa, java, selenium, jenkins, data integrity, qtp, quality testing, agile"
Java Developer,CAPCO,2025-09-24,Bengaluru,5-8 Years,"java programming, apache kafka, spring framework, big data technologies, multithreading development, hive, algorithms, scala, sql, mysql, hadoop, mongodb, hbase, python, cache, rdbms, java developer, messaging, cassandra"
